id,year,title,Runtime,Rating,Directors,Writers,Production companies,Genres,Plot
12000,2000,King of the Cage #5: Cage Wars,,,,,,,
12001,1995,El Callejon De Los Milagros,140,7.5,Jorge Fons,Vicente Leñero-Najeeb Mahfouz,Alameda Films-Consejo Nacional para la Cultura y las Artes-Instituto Mexicano de Cinematografía,Drama,"Based on the Nobel Prize Winner's novel, the Egyptian Naguib Mahfouz. The story, translated from El Cairo to Mexico City's downtown, narrates the life of the members of the neighbourhood and the connection between them Don Ru, the owner of the local pub; Eusebia, his wife; Chava, his son and Abel his friend, who emigrate to USA in search of fortune; Susanita, the single landtender always dreaming to marry a good man; Guicho, the pub's employee, who extracts the money when Don Ru is not there and finally marries Susanita; Alma, the very good looking girl, the Abel's dream, who becomes a luxury prostitute while he's away; Jimmy, the handsome young man Don Ru becomes infatuated with, etc. This movie won the Ariel (the Mexican Oscar) as best movie in 1995."
12002,1988,Oliver & Company,74,6.7,George Scribner,Jim Cox-Tim Disney-James Mangold,Walt Disney Feature Animation-Silver Screen Partners III-Walt Disney Pictures,Animation-Adventure-Comedy-Family-Musical,"Inspired by Charles Dickens' ""Oliver Twist"". A homeless kitten named Oliver, roams the streets of New York, where he is taken in by a gang of homeless mutts who survive by stealing from others. During one of these criminal acts, Oliver meets a wealthy young girl named Jenny Foxworth. This meeting will forever change his life."
12003,1998,The X-Files: Fight the Future,,,,,Buena Vista Television,Talk-Show,
12004,1989,A Fool and His Money,84,3.8,Daniel Adams,Daniel Adams-Daniel Adams-Michael Mailer,Blossom Pictures-Chronicle Films,Comedy-Drama,
12005,1984,Iceman,100,6.1,Fred Schepisi,Chip Proser-John Drimmer-John Drimmer,Universal Pictures,Drama-Sci-Fi,An anthropologist who is part of an arctic exploration team discovers the body of a prehistoric Neanderthal man who is subsequently resuscitated. The researcher must then decide what to do with the prehistoric man and he finds himself defending the man from those that want to dissect him in the name of science.
12006,2002,Just One Look,104,7.0,Kam-Hung Yip,Kam-Hung Yip,Emperor Multimedia Group (EMG)-Kams' Creation Workshop,Comedy-Drama-Romance,
12007,1968,The Detective,114,6.5,Gordon Douglas,Abby Mann-Roderick Thorp,Arcola Pictures-Arcola-Millfield Productions,Crime-Drama-Thriller,"Police detective Joe Leland investigates the murder of a homosexual man. While investigating, he discovers links to official corruption in New York City in this drama that delves into a world of sex and drugs."
12008,1963,The Twilight Zone: Vol. 31,,,,,,,
12009,1994,Space Ghost Coast to Coast: Vol. 1,,,,,,,
12010,2000,Strangers in Good Company,,,,,,,
12011,1959,Operation Petticoat,124,7.3,Blake Edwards,Stanley Shapiro-Maurice Richlin-Paul King,Granart Company-Universal International Pictures,Comedy-Romance-War,"A submarine newly commissioned is damaged in the opening days of WW II. A captain, looking for a command insists he can get it to a dockyard and captain it. Going slowly to this site, they find a stranded group of Army nurses and must take them aboard. How bad can it get? Trying to get a primer coat on the sub, they have to mix white and red in order to have enough. When forced to flee the dock during an air attack, they find themselves with the world's only Pink submarine, still with 5 women in the tight quarters of a submarine."
12012,1989,Tour of Duty: Season 3,,,,,,,
12013,2001,The Arena,92,2.8,Timur Bekmambetov,John William Corrington,Juga Films Corporation-Bazelevs Production-Concorde-New Horizons,Adventure-Drama-Action,"In an age of Gladiators, the power that was Rome held its empire together with the might of its armies, the sweat and tears of its conquests, and the cheers and bloodlust of its citizens - glorified in the deadly spectacle of The Arena. Stolen from their homelands, the fiery Druid maiden Bodicia, exotic slave girl Jessemina, and the powerful barbarian Flavius, are pitted against each other as gladiators by the sadistic Roman Governor Timarchus. Banished by Caesar, Timarchus unleashes his frustration on his gladiators, staging extravagant spectacles of combat, orgy and death. In a violent world where only the strong survive, love and hate, life and death, are separated by an instant."
12014,1997,I Know What You Did Last Summer,101,5.7,Jim Gillespie,Lois Duncan-Kevin Williamson,Mandalay Entertainment-Summer Knowledge LLC,Horror-Mystery,"After an accident on a winding road, four teens make the fatal mistake of dumping their victim's body into the sea. But exactly one year later, the dead man returns from his watery grave and he's looking for more than an apology."
12015,1992,White Men Can't Jump,115,6.7,Ron Shelton,Ron Shelton,Twentieth Century Fox,Comedy-Drama-Sport,"Billy and Sydney think they're the best basketball hustlers in town, so when they join forces, nothing can stop them, except each other. To add to their problems, Billy owes money and is being chased by a pair of gangster types."
12016,2005,Classic Cartoon Favorites: Starring Chip 'n' Dale,,,,,,,
12017,1979,Quadrophenia,120,7.3,Franc Roddam,Dave Humphries-Martin Stellman-Franc Roddam,The Who Films-Polytel,Drama-Music,"London, 1965: Like many other youths, Jimmy hates the philistine life, especially his parents and his job in a company's mailing division. Only when he's together with his friends, a 'Mod' clique, cruising London on his motor-scooter and hearing music such as that of 'The Who' and 'The High Numbers', does he feel free and accepted. However, it's a flight into an illusionary world."
12018,1969,Krakatoa East of Java,,,,,,,
12019,2004,CSI: New York: Season 1,,,,,,,
12020,2001,The Best of the Improv: Vol. 1,,,,,,,
12021,1987,No Man's Land,106,6.1,Peter Werner,Dick Wolf,Orion Pictures,Crime-Drama-Thriller,"Benjy Taylor is a rookie cop who goes undercover to nab a gang of car thieves led by Ted Varrick. Taylor becomes too involved and starts to enjoy the thrill and lifestyle of the car thieves, and falls in love with Varrick's sister Ann."
12022,1999,The Great Barrier Reef: IMAX,,,,,,,
12023,2001,Tupac Shakur: Thug Angel: The Life of an Outlaw,,,,,,,
12024,2000,The Hunger: Bump in the Night,,,,,,,
12025,1994,That's Entertainment 3,113,7.6,Bud Friedgen-Michael J. Sheridan,Bud Friedgen-Michael J. Sheridan,Metro-Goldwyn-Mayer (MGM)-Turner Entertainment,Documentary-Family-Musical,"Some of MGM's musical stars review the studio's history of musicals. From The Hollywood Revue of 1929 (1929) to Brigadoon (1954), from the first musical talkies to Gene Kelly in Singin' in the Rain (1952), are examined."
12026,1996,ER: Season 3,,,,,,,
12027,1991,Naked Lunch: Bonus Material,,,,,,,
12028,2001,Shaolin Soccer,113,7.3,Stephen Chow,Stephen Chow-Kan-Cheung Tsang-Min Hun Fung,Star Overseas-Universe Entertainment,Action-Comedy-Fantasy-Sport,"After a fateful mistake costing his career, an ex-soccer player bum meets a shaolin kung fu student trying to spread the word of kung fu. The ex-soccer player helps reconcile with his five brothers, and teaches them soccer, adding shaolin kung fu as a twist."
12029,1972,The Pigkeeper's Daughter / Sassy Sue,92,4.8,Bethel Buckalew,,Boxoffice International Pictures-Pure Gold Productions,Comedy,"Harry Novak, brings us a obscure but entertaining tale of the coming of age of a farmer's daughter, Moonbean (Terry Gibson), a red-head, busty country bumpkin who is the town's whore. She is constantly spied on by her younger sister Pretty Patty (Peggy Church) who masturbates after seeing her sister's sexual encounters. The ladies in this movie are all on the voloptuos side, it is a soft core but in any decade it would have gotten an X-rating, the sex scenes are that explicit. The lucky guy is Jasper who gets to do all the ladies in the movie, including a hard to believe overdeveloped 15 year old hitchhiker, (who would make any guys quickie hall of fame). The movie has erotic moments, and is funny."
12030,2000,A Bing Crosby Christmas,,,,,,,
12031,2002,Scotland,,,,,,,
12032,1984,Talking Heads: Stop Making Sense,88,8.5,Jonathan Demme,Jonathan Demme-Talking Heads,Talking Heads-Arnold Stiefel Company,Documentary-Music,"David Byrne walks onto the stage and does a solo ""Psycho Killer."" Jerry Harrison, Tina Weymouth and Chris Frantz join him for two more songs. The crew is busy, still setting up. Then, three more musicians and two back-up singers join the band. Everybody sings, plays, harmonizes, dances, and runs. They change instruments and clothes. Bryne appears in the Big Suit. The backdrop is often black, but sometimes it displays words, images, or children's drawings. The band cooks for 18 songs, the lyrics are clear, the house rocks. In this concert film, the Talking Heads hardly talk, don't stop, and always make sense."
12033,1986,Nightmaster,,,,,,,
12034,1980,The Shining,146,8.4,Stanley Kubrick,Stephen King-Stanley Kubrick-Diane Johnson,Warner Bros.-Hawk Films-Peregrine-Producers Circle,Drama-Horror,"Signing a contract, Jack Torrance, a normal writer and former teacher agrees to take care of a hotel which has a long, violent past that puts everyone in the hotel in a nervous situation. While Jack slowly gets more violent and angry of his life, his son, Danny, tries to use a special talent, the ""Shining"", to inform the people outside about whatever that is going on in the hotel."
12035,2002,Oz: Season 5,,,,,,,
12036,2000,Directors: Terry Gilliam,60,7.4,Robert J. Emery,Robert J. Emery,Wellspring Productions,Documentary-Biography,
12037,1987,Stevie Nicks: Live at Red Rocks,60,8.2,Marty Callner,,,Documentary-Music,"Have you ever understood deja vu enough to accept that it happened? Do you know what Kabbalah is? The red strings are a symbol of it, or in the Edge of Seventeen, the red bow. Its basically an experience shared at different moments in time by (two) different people and what it feels, you feel, but the wicked thing is, would you really want to if you knew what you had and what you lost was just a mind game and not a dream? Well, well, well, this is just that. Read between the fake camera shots and get a glimpse to a certain time and a certain place that took me to the sister of the moon."
12038,2000,Miracle in Lane 2,120,6.2,Greg Beeman,Joel Kauffmann-Donald C. Yost,,Biography-Comedy-Drama-Family-Sport,"Myron Yoder's Indiana family always was proud of eldest son Seth, a sports prodigy, but most attention goes to younger Justin, whose spina bifida condition means a wheelchair and constant, frantic care. During make-up chores for endangering grumpy neighbor Vic Sauder's sports car, Justin discovers a sport he finally hopes to excel in, soap box cart racing, and gets highly experienced Vic and pa to help and coach him. That proves promising and dangerous, but also puts unbearable stress on the family cohesion as Seth now feels cruelly shoved aside."
12039,1997,Commandments,88,5.6,Daniel Taplitz,Daniel Taplitz,Universal Pictures-Northern Lights Entertainment,Comedy-Drama-Romance,"Seth Warner has reached the end of his rope. Ever since his wife died two years earlier, his world has been in turmoil. He is despondent, his career has fallen apart, even his house has been destroyed. There seems to be nothing left for him to live for. Confused and angry after two years of suffering, he finally directs his wrath at God from the rooftop of his apartment building in New York City. In the midst of a wild thunderstorm he demands to know why he has been betrayed by the god he has believed in and honored his whole life. God's answer is to strike down Seth's dog in a bolt of lightning. Pushed beyond his limits, Seth decides to respond to his years of torment by breaking each of the biblical Ten Commandments. While staying with his sister-in-law, Rachel, much to the chagrin of her shifty reporter husband, Harry, he systematically sets out to break each commandment one by one. A natural at breaking commandments, Harry is drawn to Seth's mission in the hopes of using it to further his career, but ultimately they clash as Seth turns the table and uses Harry to fulfill some of his missions. Things get further complicated when Rachel and Seth are romantically drawn to each other as he struggles with his crisis of faith and she struggles with a failing marriage. Inevitably, Seth comes down to the last and most important commandment, Thou shall not kill. In a climactic battle of will and redemption, Seth, Harry and Rachel cross paths with a raging hurricane at the far end of Long Island. Echoing Seth's first confrontation with God, the sky and the sea open up in this fateful encounter at the Montauk Lighthouse. Individually, each confronts forces beyond human control and more importantly, must come to an understanding of their own life choices and decisions. The resolution to the story for all characters is surprising, mystical and ultimately just."
12040,2004,Lil' Pimp,,,,,,,
12041,2002,Ghetto Dawg,,5.4,Brian Averill,Allen Cognata-Greg Russo,Jersey Bred Productions,Drama,
12042,1973,5 Fingers of Death,,,,,,,
12043,2002,On Edge,,,,,,,
12044,2001,The Legend of Suriyothai,185,6.6,Chatrichalerm Yukol,Sunait Chutintaranond-Chatrichalerm Yukol,American Zoetrope-Prommitr International Production,Action-Adventure-Drama-History-War,"The film describes historical events in the life of the heroine, Suriyothai, the queen of King Mahachakrapat. from the age of 15, ranging from love and attachment, royal wedding, resettlement in the capital, court life, intrigues, and sustenance of royal dignity."
12045,1999,Tomie,72,5.0,Toshirô Inomata,Junji Ito,,Horror-Romance,"Another movie about Tomie, the girl who just won't stay dead. This film is split into three separate stories in which Tomie is at different times in her life, first as a high school student, then as a young woman who falls for a photographer, and finally as a woman engaged to be married to her true love. In each story, she is murdered after her unusual secret is discovered, but she somehow manages to come back from beyond to take her revenge."
12046,2002,Depeche Mode: One Night in Paris: The Exciter Tour 2001,,,,,,,
12047,2000,Mission: Impossible II,123,6.1,John Woo,Bruce Geller-Ronald D. Moore-Brannon Braga,Paramount Pictures-Cruise/Wagner Productions-Munich Film Partners & Company (MFP) MI2 Productions,Action-Adventure-Thriller,"Chimera is a deadly virus that will bear a grisly death unless you are given the antidote. The creator of Chimera is murdered and the antidote is stolen by a disavowed I.M.F. Agent, Sean Ambrose (Dougray Scott). The Impossible Mission Force, (I.M.F.), hire the skilled and charming Ethan Hunt (Tom Cruise), and the beautiful Nyah Hall (Thandie Newton), who has had her share with Ambrose. Their mission, should they choose to accept it, is to send Hall undercover to Ambrose and learn what she can for Hunt to bring down Chimera, but they will have to break into a secure lab by jumping off of buildings and dodging bullets. Its impossible."
12048,1999,Timegate: Tales of the Saddle Tramps,79,3.9,Dan Golden,Louise Dunkirk,Surrender Cinema-Twilight Movies,Sci-Fi-Western,"While visiting an historic western town, two beautiful women stumble upon a device that transports them over a century back in time to the Old West. When the girls are mistaken for brothel babes, they get a hankerin' for some real cowboy action! But their erotic recreation with the local cowpokes soon ruffles a few feathers in town- and when the deputy winds up dead, the posse's hot on their tails for some answers! They must go back to their own time, before they're punished for the crime."
12049,1995,John Denver: Wildlife Concert,110,8.4,Jeb Brien,,The Element Foundation,Documentary-Music,"The Wildlife Concert celebrates John Denver's greatest hits, a magical and intimate performance featuring the songs that made him an American treasure. Also included are candid interviews, special wildlife footage and some surprise selections."
12050,2001,The Master Swordsman,200,6.1,,,,,
12051,1975,The French Connection II,119,6.8,John Frankenheimer,Alexander Jacobs-Robert Dillon-Laurie Dillon,Twentieth Century Fox,Action-Crime-Drama-Thriller,New York narcotics detective Popeye Doyle follows the trail of the French connection smuggling ring to France where he teams up with the gendarmes to hunt down the ringleader.
12052,1996,Primal Fear,129,7.7,Gregory Hoblit,William Diehl-Steve Shagan-Ann Biderman,Paramount Pictures-Rysher Entertainment,Crime-Drama-Mystery-Thriller,"Courtroom thriller about a slick, hotshot lawyer who takes the seemingly unwinnable case of a young altar boy accused of murdering an eminent catholic priest."
12053,1993,Dracula Rising,85,3.1,Fred Gallo,Rodman Flender-Daniella Purcell,New Horizons Picture,Horror-Romance,"Witness the romance and tragedy of one man's undying passion that led him to sell his soul. In this epic horror, Vlad Dracula exchanges salvation for immortality so that he may avenge the brutal death of his true love. Now he journeys to the twentieth century to lay claim to the woman he so desperately loves."
12054,1988,Child's Play,87,6.6,Tom Holland,Don Mancini-Don Mancini-John Lafia,United Artists,Horror-Thriller,"When Charles Lee Ray needs to get a quick escape from cop Mike Norris, he takes his soul and buries it into playful, seemingly good guy doll Chucky. Little does he know a little boy by the name of Andy Barclay will be the new owner of him soon-to-come. Charles confides in Andy while he commits numerous murders and once the adults accept Andy's story as truth, it's too late."
12055,1998,Chosen One: Legend of the Raven,88,2.7,Lawrence Lanoff,Sam Rappaport-Khara Bromiley,Discovery Entertainment,Action-Fantasy,"When a serial killer mysteriously and savagely murders a young Indian woman in rural Los Angeles county, her sister McKenna must replace her as the keeper of an amulet, the sacred crescent. Reluctantly, McKenna accepts the role of chosen one. With the amulet and after the rigors of the ritual, she takes on the spirit and powers of the raven, the good forces in the battle against evil, the wolf. McKenna's powers include a thirst for milk and great sexual energy, which she unleashes on her former boyfriend, Henry, a cop. The spirit of the wolf inhabits Rose, Henry's jilted lover. Rose wrecks havoc of her own before a final showdown with the chosen one."
12056,2004,Twisted,97,5.3,Philip Kaufman,Sarah Thorp,Paramount Pictures-Intertainment AG-Kopelson Entertainment-Blackout Productions Inc.-Harlequin Pictures,Crime-Drama-Mystery-Thriller,"Jessica Shepard is an on the rise police officer of San Francisco's esteemed police department, after having solved a big case about a serial killer. Her mentor John Mills is proud of Jessica as a father would be of his daughter, since Mills was the partner of Jessica's late father. With a newly established promotion, Jessica finds that she might once again have to prove herself in a department that takes no prisoners. Not to mention a new partner named Mike Delmarco, who might be Jessica's next closest thing to a confidant. However, a man has been found dead and the two officers are brought into the investigation. What they find is a surprise when the dead in question was a man Jessica slept with, he being part of a list of one night stands that Jessica has engaged in. Now under suspicion and a terrible drinking problem gnawing at her, Jessica will have to prove to her superiors and to her skeptical partner that she's not the one behind the murders and Mills is one of the few people standing behind her. This is a story about a woman trying to find the perpetrator of these horrible crimes, before she herself might end as one of them."
12057,2001,American Desi,100,6.7,Piyush Dinker Pandya,Piyush Dinker Pandya,American Desi Productions-Blue Rock Entertainment,Comedy-Drama-Romance,"College freshman Krishna Reddy, who has never cared for his Indian-American cultural heritage, looks forward to a new life on campus but is surprised to find that he has been assigned Indian roommates. Through his new experiences, he struggles to understand the side of himself he has always turned his back on in order to fit in."
12058,2001,Being Mick: You Would If You Could,,,,,,,
12059,2005,Unscripted: The Complete Series,,,,,,,
12060,2004,Bionicle 2: Legends of Metru Nui,75,6.1,David Molina-Terry Shakespeare,Henry Gilroy-Bob Thompson-Henry Gilroy,Creative Capers Entertainment-LEGO-Miramax,Animation-Action-Adventure-Fantasy,"The legends tells the story of how the Toa came to be, chosen from the pool of Matoran youth in the great city of Metru Nui and, though physically transformed, hardly prepared for increased size and super heroic powers. Now in short order, the Toa--who babble and bicker like agitated adolescents--have to master their new gifts, impress their leader, and prepare to protect their home."
12061,1936,The Petrified Forest,82,7.6,Archie Mayo,Charles Kenyon-Delmer Daves-Robert E. Sherwood,Warner Bros.,Drama-Film-Noir-Romance-Thriller,"Gabby lives and works at her dads small diner out in the desert. She can't stand it and wants to go and live with her mother in France. Along comes Alan, a broke man with no will to live, who is traveling to see the pacific, and maybe to drown in it. Meanwhile Duke Mantee a notorious killer and his gang is heading towards the diner where Mantee plan on meeting up with his girl."
12062,2002,The Wiggles: Wiggly Safari,52,7.4,Gary Matheson,Murray Cook-Jeff Fatt-Anthony Field,Lyrick Studios Video,Family-Music,"Filmed at Australia Zoo, there are so many things to see and do. Sing Cocky Want A Cracker with Captain Feathersword and Steve Irwin. Dance with Dorothy the Dinosaur and the Butterflies, dance the Dingo Tango with Wags the Dog and sing with Henry the Octopus and all our friends as we become part of The Crocodile Band."
12063,2003,Air Marshal,90,2.7,Alain Jakubowicz,Aaron Pope-Aaron Pope-James Becket,Martien Holdings A.V.V.-Millennium Films,Action-Adventure-Drama-Thriller,
12064,1963,This Sporting Life,134,7.8,Lindsay Anderson,David Storey-David Storey,Independent Artists-Julian Wintle/Leslie Parkyn Productions,Drama-Sport,"In Northern England in the early 1960s, Frank Machin is mean, tough and ambitious enough to become an immediate star in the rugby league team run by local employer Weaver. Machin lodges with Mrs Hammond, whose husband was killed in an accident at Weaver's, but his impulsive and angry nature stop him from being able to reach her as he would like. He becomes increasingly frustrated with his situation, and this is not helped by the more straightforward enticements of Mrs Weaver."
12065,1994,Hercules: The Legendary Journeys: Season 1,91,6.6,Doug Lefler,Christian Williams-Barry Pullman-Andrew Dettmann,Renaissance Pictures,Action-Adventure-Fantasy,"Hercules and Deianeira go in search of fire to save the world from cold. All the world's fire are fast going out. Hercules' father, Zeus, is on hand to help (and sometime hinder) the two."
12066,1988,Roseanne: Season 1,,,,,,,
12067,1994,Sugar Hill,,,,,,,
12068,2005,Funny Ha Ha,,,,,,,
12069,1998,Lexx: Series 2,,,,,,,
12070,2000,24 Hours in London,90,3.6,Alexander Finbow,Alexander Finbow,City Heat Productions-One World Films,Crime-Thriller,Big time criminal Christian is on a mission to eliminate all his rival gangs in a slightly futuristic London. During one of the hits a witness survives and the police think they have the key to a successful arrest and conviction. Working for Christian are the usual band of over the top gangsters with no regard for the life of others.
12071,1995,Mallrats,94,7.2,Kevin Smith,Kevin Smith,Gramercy Pictures (I)-Alphaville Films-View Askew Productions,Comedy-Romance,"Brodie Bruce, a Sega and comic book obsessed college student, and his best friend, TS Quint, are both dumped by their girlfriends on the same day, and to deal with their loss, they both go to the local mall. Along the way, they meet up with some friends, including Willam, a guy who stares at Magic Eye pictures, desprately trying to see the hidden image; Gwen, one of TS's ex-girlfriends; and Jay & Silent Bob, of Clerks fame. Eventually, they decide to try and win back their significant others, and take care of their respective nemesises (TS's girlfriend's father, and a store clerk who hates the two for not having any shopping agenda)."
12072,1987,Project X,108,6.1,Jonathan Kaplan,Lawrence Lasker-Stanley Weiser-Stanley Weiser,Amercent Films-American Entertainment Partners L.P.-Parkes/Lasker productions,Comedy-Drama-Sci-Fi-Thriller,"A young inductee into the military is given the task of looking after some chimpanzees used in the mysterious ""Project X"". Getting to know the chimps fairly well, he begins to suspect there is more to the secret project than he is being told."
12073,2001,Rain,94,7.8,Majid Majidi,Majid Majidi-Fouad Nahas,Fouad Nahas,Drama-Romance,"Young Lateef works on a construction site in Tehran with some Turks and a few illegal Afghan workers. When Lateef is given heavier tasks to compensate for new Afghan worker Rahmat, he resents his displacement and treats Rahmat cruelly. After one of his pranks, however, Lateef discovers Rahmat's secret--he is a girl named Baran. Latif's heart softens towards Baran and he shows his new affection for her by doing what he can to ease the hardships she suffers at work. When government inspectors force all Afghans to be fired from the site, Lateef discovers he cannot bear to be without her. Jeopardizing social standing and endangering his own well being, Lateef stops at nothing to save his love."
