id,year,title,Runtime,Rating,Directors,Writers,Production companies,Genres,Plot
13449,1997,Squeeze,102,6.1,Robert Patton-Spruill,Robert Patton-Spruill-Emmett Folgert,Danan/Moreno Films-ca.thar.tic filmWorks,Crime-Drama,"Ty, Hector, and Bao are close friends in a tough section of Boston, where they're called ""the PG-13 crew."" They're 14, decent kids with few skills who've bailed out of school. A small gang of older tough guys, led by Marcus and Tommy, menace them, and when the PG-13s fight back and rob one of the gang, Marcus and Tommy vow to kill them. They seek protection from Derick, a drug dealer, who agrees to help if they'll sell drugs. Meanwhile, Ty is recruited to work at a community center by J.J., its quiet leader. Ty and his friends are in a squeeze: surrounded by violence, drugs, and no opportunities, is there any way out?"
13450,1997,Gang Related,111,6.5,Jim Kouf,Jim Kouf,Orion Pictures-Kouf/Bigelow Productions-Blue Rider Pictures,Action-Crime-Drama-Romance-Thriller,"Two corrupt cops murder an undercover DEA agent by mistake, and frantically try to cover their tracks by framing a homeless man for the crime. That involves juggling evidence, coaching witnesses, and improvising to keep their desperate scheme from unraveling."
13451,1992,The Player,124,7.6,Robert Altman,Michael Tolkin-Michael Tolkin,Avenue Pictures-Spelling Entertainment-Addis Wechsler Pictures-Guild,Comedy-Crime-Drama-Thriller,"Events in the life of a Hollywood studio executive, unfold with the same unrealistic positive coincidences, ultimately culminating to a ""happy ending"", much like the movie scripts, with which he works day in and out, after he accidentally murders someone."
13452,1994,Jailbreakers,76,4.4,William Friedkin,Debra Hill-Gigi Vorgan,Drive-In Classics-Showtime Networks-Spelling Films International,Drama,A 1950's high school cheerleader meets a leather clad rebel biker and goes out on the town with him. When he steals an item of jewellery he gets thrown in prison but not for long. He makes a desperate escape and he is determined to catch up with his lost love and re-new their criminal activities.
13453,1994,Queen Margot,159,7.5,Patrice Chéreau,Alexandre Dumas-Danièle Thompson-Patrice Chéreau,Renn Productions-France 2 Cinéma-D.A. Films-N.E.F. Filmproduktion und Vertriebs (I)-Degeto Film-Arbeitsgemeinschaft der öffentlich-rechtlichen Rundfunkanstalten der Bundesrepublik Deutschland (ARD)-WMG Film-RCS Films & TV-Centre National de la Cinématographie (CNC)-Canal+-Miramax-Eurimages,Biography-Drama-History-Romance,"The night of August 24, 1572, is known as the Massacre of St. Bartholomew. In France a religious war is raging. In order to impose peace a forced wedding is arranged between Margot de Valois, sister of the immature Catholic King Charles IX, and the Hugenot King Henri of Navarre. Catherine of Medici maintains her behind-the-scenes power by ordering assaults, poisonings, and instigations to incest."
13454,1952,The Big Trees,89,5.8,Felix E. Feist,John Twist-James R. Webb-Kenneth Earl,Warner Bros.,Action-Romance-Western,"In 1900, unscrupulous timber baron Jim Fallon plans to take advantage of a new law and make millions off California redwood. Much of the land he hopes to grab has been homesteaded by a Quaker colony, who try to persuade him to spare the giant sequoias...but these are the very trees he wants most. Expert at manipulating others, Fallon finds that other sharks are at his own heels, and forms an unlikely alliance."
13455,2004,Bryan Kest's Power Yoga,,,,,,,
13456,1936,Come and Get It,99,7.0,Howard Hawks-William Wyler-Richard Rosson,Edna Ferber-Jane Murfin-Jules Furthman,The Samuel Goldwyn Company,Drama-Romance,"In 1884 lumberman Barney Glasgow leaves his true love, saloon singer Lotta Morgan, to marry Emma Louise, his boss's daughter. His buddy Swan Bostrom marries Lotta instead. Barney becomes a lumber magnate by stripping the Wisconsin forests, without re-planting. After 23 years, Barney finally visits Swan. Lotta has died, but Barney is smitten by their daughter Lotta Bostrom, who looks almost like her mother. His lavish attentions to Lotta create gossip and a rivalry between Barney and his son Richard."
13457,2000,Scooby-Doo's Creepiest Capers,,,,,,,
13458,1995,Virtuosity,106,5.6,Brett Leonard,Eric Bernt,Paramount Pictures,Action-Crime-Sci-Fi-Thriller,"The Law Enforcement Technology Advancement Centre (LETAC) has developed SID version 6.7: a Sadistic, Intelligent, and Dangerous virtual reality entity which is synthesized from the personalities of more than 150 serial killers. LETAC would like to train police officers by putting them in VR with SID, but they must prove the concept by using prisoners as test subjects. One such prisoner is ex-cop Parker Barnes. When SID manages to inject his personality into a nano-machine android, it appears that Barnes might be the only one who can stop him."
13459,1996,2 Days in the Valley,104,6.5,John Herzfeld,John Herzfeld,Rysher Entertainment-Redemption Productions,Comedy-Crime-Thriller,"John Herzfeld deftly welds together a multitude of subplots-- a loser hitman and a cool assassin involved in an insurance scam; a washed-up director, turned suicidal, if only he had someone to care for his beloved dog; a snooty art dealer, wracked by kidney stones, cared for by his devoted assistant; a grungy deranged vice cop, now partnered with a fresh-faced rookie; and two beautiful and jealous women entangled in their deadly scheme--into a spoof of the crime thriller genre."
13460,1979,Yanks,138,6.4,John Schlesinger,Colin Welland-Colin Welland-Walter Bernstein,CIP Filmproduktion GmbH,Drama-War,"During WWII, the United States set up army bases in Great Britain as part of the war effort. Against their proper sensibilities, many of the Brits don't much like the brash Yanks, especially when it comes to the G.I.s making advances on the lonely British girls, some whose boyfriends are also away for the war. One Yank/Brit relationship that develops is between married John, an Army Captain, and the aristocratic Helen, whose naval husband is away at war. Helen does whatever she needs to support the war effort. Helen loves her husband, but Helen and John are looking for some comfort during the difficult times. Another relationship develops between one of John's charges, Matt, a talented mess hall cook, and Jean. Jean is apprehensive at first about even seeing Matt, who is persistent in his pursuit of her. Jean is in a committed relationship with the kind Ken, her childhood sweetheart who is also away at war. But Jean is attracted to the respect with which Matt treats her. Despite Ken and Jean getting engaged during one of his leaves, Jean and Matt continue to see each other and fall in love. Beyond the issue of Jean's mother's disdain for Yanks and Ken and Jean's engagement, Matt and Jean still have to overcome the differences between the two worlds in which they live. Regardless, the goings-on of the war may override any of their immediate wishes."
13461,2002,Dirty Deeds,110,6.3,David Caesar,David Caesar,Alliance Atlantis Communications-Australian Film Finance Corporation-Haystack Productions Ltd.-Macquarie Film Corporation-New South Wales Film & Television Office-New Town Films Pty. Ltd.-Nine Film & Television Pty. Ltd.,Comedy-Crime,"Set in 1960s Sydney, this is the story of an Australian gangster whose booming business, buoyed by the influx of U.S. soldiers in town for R&R during their tours in Vietnam, attracts the attention of first the Chicago mafia, and then their East Coast competitors."
13462,1999,The General's Daughter,116,6.3,Simon West,Nelson DeMille-Christopher Bertolini-William Goldman,Paramount Pictures-Neufeld Rehme Productions-MFP Munich Film Partners GmbH & Company I. Produktions KG-Hollywood Licensing Group-Mace Neufeld Productions,Crime-Drama-Mystery-Thriller,"The naked corpse of Captain Elisabeth Campbell, daughter of Lieutenant General ""Fighting Joe"" Campbell, is found staked out on the urban warfare range of Fort MacCallum. Army CID detectives and ex-lovers Paul Brenner and Sara Sunhill are called in to investigate, and find themselves wrapped up in a maelstrom of sexual impropriety and misguided face-saving."
13463,2000,The Reduced Shakespeare Company,,,,,,,
13464,2002,Quicksand,92,4.8,Sam Firstenberg,Steve Schoenberg-Ruben Gordon,Quantum Entertainment-Swingin' Productions-Ushakiron Movies International,Drama-Thriller,"Randi Stewart is a sergeant on a marine base where her father is the commanding officer. She is being treated by the new base psychiatrist, Bill Turner. Her brother, Gordon Stewart is running for political office. General Stewart is murdered and Randi is the key suspect. Once Bill starts investigating the crime through his treatment of Randi, he begins to uncover an unusually large amount of suicides on the base. The intrigue grows and so does Bill's unprofessional feelings towards Randi. Is she the murderer? He doesn't really want to find out. He just keeps getting sucked deeper and deeper into the ""Quicksand""."
13465,2000,In the Beginning,189,6.7,Kevin Connor,John Goldsmith,HCC Happy Crew Company-Hallmark Entertainment-NBC Studios-NGP Holding,Adventure-Drama,
13466,2003,Down With Love,101,6.3,Peyton Reed,Eve Ahlert-Dennis Drake,Fox 2000 Pictures-Regency Enterprises-Jinks/Cohen Company-Mediastream Dritte Film GmbH & Co. Beteiligungs KG-Epsilon Motion Pictures,Comedy-Romance,An homage to the early 1960s sex comedies that starred Rock Hudson and Doris Day. The story follows a best-selling female advice author who has all the answers until a sly journalist playboy starts asking the questions.
13467,2002,Samourais,90,3.3,Giordano Gederlini,Alexandre Coquelle-Giordano Gederlini-Matthieu Le Naour,CP Medien AG-Canal Plus Ecriture-Canal+-Fidélité Productions-M6 Films-Pathé Image Production-Telecinco,Action,"Half a century ago, a Japanese family summoned a demon known as Kodeni to dispose of its adversaries. Once the killing was done, the family was cursed. Now, Tokyo Police Inspector Fujiwara is investigating the murder of a video game designer. The investigation leads him to a frightening discovery - the same lethal demon is about to be reborn. Fujiwara must travel to Paris and kill this unborn child who is the reincarnation of Kodeni and who threatens to destroy the world."
13468,1992,Law & Order: Season 3,,,,,,,
13469,2000,The Gleaners and I,82,7.7,Agnès Varda,Agnès Varda,Ciné Tamaris,Documentary,"An intimate, picaresque inquiry into French life as lived by the country's poor and its provident, as well as by the film's own director, Agnes Varda. The aesthetic, political and moral point of departure for Varda are gleaners, those individuals who pick at already-reaped fields for the odd potato, the leftover turnip."
13470,1979,Disco Godfather,93,5.3,J. Robert Wagoner,J. Robert Wagoner-Cliff Roquemore,Generation International Pictures,Action-Crime-Drama-Thriller,"A retired cop becomes a DJ/celebrity at the Blueberry Hill disco-- he's the ""Disco Godfather!"" All is well until his nephew flips out on a strange new drug that's sweeping the streets, called ""angel dust,"" or PCP. Disco Godfather vows ""to personally come down on the suckers that's producing this shit!"" He takes to the streets, slaps drug dealers and even exposes a crooked cop that is covering for the dealers. In between, he still finds time to manage the Blueberry Hill and perform. ""Put a little slide in yo' glide,"" he pleads to the patrons, ""Put some weight on it!"" Disco Godfather tracks down the kingpin that is behind all the angel dust production, but not before he is kidnapped and forced to inhale PCP through a gas mask!"
13471,2004,Jersey Girl,102,6.2,Kevin Smith,Kevin Smith,Miramax-View Askew Productions-Beverly Detroit-Close Call Films,Comedy-Drama-Romance,"Oliver Trinke has always tried to put his Highlands, New Jersey past behind him, but it has been a difficult task for the past six years. Ollie was a successful New York City music publicist. He and his wife Gertrude had a daughter, immediately after which Gertrude died leading to Ollie naming their daughter Gertie. Unprepared to be a father let alone a single father, Ollie, through a single incident largely putting his desire for professional success over his responsibilities as a father, became persona non grata in the entertainment publicity industry, resulting in Ollie and Gertie needing to move back to Highlands, moving in with his father, Bart Trinke, until he got back onto his feet. But unexpectedly for Ollie, getting back on his feet in an immediate sense meant getting a job working side-by-side with Bart in the Borough of Highlands works crew, a job he still has. Ollie still has the desire both to get back to a New York City life and a high powered job as an entertainment publicist, despite learning to be a responsible, loving father to Gertie in his current life. To the contrary, Gertie, now seven, has only known life in Highlands, liking everything about it, including living with Bart, her ""Pop"". As Ollie tries to make his dream come true, he may get a clearer picture of his priorities with the help in part from Maya, a video store clerk/graduate student that Ollie and Gertie befriend."
13472,2000,Price of Glory,118,6.4,Carlos Ávila,Phil Berger,New Line Cinema-Esparza / Katz Productions-Arthur E. Friedman Productions,Drama-Sport,"An ex-boxer, living with the knowledge that his fight career was cut short by a crooked manager, channels his bitter disappointment in a single-minded quest for boxing championships for his three sons. We see them in pee-wee Silver Glove matches with dad constantly pushing them. Ten years later, they're young men, with dad as both father and manager. A professional promoter, Nick Everson, wants to sign the boys, but dad rejects those offers. Then, in expressions of their varied relationships with their father, each son makes his own decisions. Can dad ever step aside, and can the family hold together?"
13473,1968,Death Rides a Horse,,,,,,,
13474,2001,Bat Thumb,28,6.7,David Bourla,Steve Oedekerk,O Entertainment,Comedy-Short,
13475,1984,Antonio Gaudi,72,7.4,Hiroshi Teshigahara,,Teshigahara Productions-Toho,Documentary,"Hiroshi Teshigahara's camera takes us over, under, around, and into buildings and a park designed by Antonio Gaudí (1852 - 1926), Catalan architect, ceramist, and sculptor. Teshigahara suggests the influence of Romanesque churches and monasteries on Gaudí and the influence of the caves and crags of Montserrat, close to Barcelona. Every line of Gaudí's seems curved, and no surface is without textures. With little narration, the film takes us through Casa Vicens, projects for the industrialist Güell (including the Crypt of the Colònia Güell and Park Güell), Casa Batlló, Casa Milà, and Barcelona's landmark, the unfinished Templo de La Sagrada Familia."
13476,2001,Chaos,109,7.1,Coline Serreau,Coline Serreau,Bac Films-Canal+-DH Film Service-Eniloc Films-France 2 Cinéma-Les Films Alain Sarde-StudioCanal,Comedy-Drama-Crime,"A bourgeois couple, modern yet conventional. One night by accident, a young prostitute barges into their lives. Hounded down, beaten up, threatened, she will continue to struggle, with the help of a well off lady, first for her survival-her resurrection-then for her dignity and freedom. Stormy encounters for everyone involved."
13477,1997,Stephen King's The Shining,273,6.1,Mick Garris,Stephen King,Lakeside Productions-Warner Bros. Television,Drama-Fantasy-Horror-Thriller,"Television adaptation of Stephen King novel that follows a recovering alcoholic professor. He ends up taking a job as a winter caretaker for a remote Colorado hotel which he seeks as an opportunity to finish a piece of work. With his wife and son with him, the caretaker settles in, only to see visions of the hotel's long deceased employees and guests. With evil intentions, they manipulate him into his dark side which takes a toll on he and his family."
13478,1973,Ivan Vasilievich: Back to the Future,93,8.4,Leonid Gaidai,Mikhail A. Bulgakov-Vladlen Bakhnov-Leonid Gaidai,Mosfilm,Adventure-Comedy-Sci-Fi,"Shurik Timofeev builds a working model of a time machine. By accident, Ivan Bunsha, an apartment complex manager, and George Miloslavsky, a petty burglar, are transferred to the 16th century Moscow, while Tsar Ivan the Terrible goes into the year 1973."
13479,1986,Otello,118,7.2,Franco Zeffirelli,Arrigo Boito-Franco Zeffirelli-Masolino D'Amico,Cannon City Produktie Maatschappij B.V.-Cannon Productions-Italian International Film-RAI Radiotelevisione Italiana,Drama-Music,"Based on Shakespeare's play, Verdi's opera depicts the devastating effects of jealousy, ""...the green-eyed monster which doth mock the meat it feeds upon"". Believing Otello has promoted the fast-rising Cassio over himself, Iago plots to destroy both Cassio and Otello. Iago convinces the jealous Otello that his beautiful wife Desdemona is unfaithful, and that Cassio is her lover. Jealousy is followed by tragedy, then retribution, ""Has Heaven no more thunderbolts?"""
13480,2004,Barney: Now I Know My ABCs,38,6.1,Jim Rowley,Michael Anthony Steele-Cheryl Ammeter-Sheryl Leach,Lyons Partnership L.P.,Family,"Barney's friends have F-U-N learning the ABCs, colors and more! Baby Bop discovers the excitement of writing her name, and the children get everything in shape for the most colorful art show ever! Whether drawing a cat made of triangles or a train made of squares, using their imagination helps kids learn about shapes and colors. How do you spell ""learning?"" B-A- R-N-E-Y"
13481,1979,The Black Stallion,118,7.4,Carroll Ballard,Melissa Mathison-Jeanne Rosenberg-William D. Wittliff,Omni Zoetrope,Adventure-Family-Sport,"While traveling with his father, young Alec becomes fascinated by a mysterious Arabian stallion who is brought on board and stabled in the ship he is sailing on. When it tragically sinks both he and the horse survive only to be stranded on a desert island. He befriends it, so when finally rescued, both return to his home where they soon meet Henry Dailey, a once-successful trainer. Together they begin training the stallion to race against the fastest horses in the world."
13482,2004,Bob the Builder: Dig,46,,,,,,
13483,1964,7 Faces of Dr. Lao,100,7.3,George Pal,Charles Beaumont-Charles G. Finney-Ben Hecht,George Pal Productions,Fantasy-Mystery-Western,"An old Chinese gentleman rides into the town of Abalone, Arizona and changes it forever, as the citizens see themselves reflected in the mirror of Lao's mysterious circus of mythical beasts."
13484,1980,The Octagon,103,5.1,Eric Karson,Leigh Chapman-Paul Aaron-Leigh Chapman,American Cinema Productions,Action-Drama-Romance-Thriller,"Scott's life is plagued by two kinds of flashbacks. First are the childhood memories of the rigorous training he and a friend endured under a martial arts master. The second is of a mission Scott went on that ended with him watching his friend get murdered. Scott later becomes drawn closer to a vicious crime ring known as The Octagon. As he gets closer to the truth, Scott learns that these may be the men that murdered his friend so long ago."
13485,1984,City Heat,93,5.5,Richard Benjamin,Blake Edwards-Blake Edwards-Joseph Stinson,Warner Bros.-The Malpaso Company-Deliverance Productions,Action-Comedy-Crime,"Kansas City in the 1930s: private investigator Mike Murphy's partner is brutally murdered when he tries to blackmail a mobster with his secret accounting records. When a rival gang boss goes after the missing records, ex-policeman Murphy is forced to team up again with his ex-partner Lieutenant Speer, even though they can't stand each other, to fight both gangs before KC erupts in a mob war."
13486,1998,Out of Sight,123,7.0,Steven Soderbergh,Elmore Leonard-Scott Frank,Universal Pictures-Jersey Films,Crime-Drama-Romance-Thriller,"A career bank robber busts out of jail (Clooney) with the help of his buddy (Rhames) and kidnaps a US Marshal (Lopez) in the process. When the two cons head for Detroit to pull off their final big scam, the Marshal is put on their case but she finds she is attracted to one of them and has second thoughts about bringing them in."
13487,1993,When the Bough Breaks,,,,,,,
13488,2004,Ella Enchanted,96,6.3,Tommy O'Haver,Laurie Craig-Karen McCullah-Kirsten Smith,Miramax-Jane Startz Productions-Blessington Film Productions-Enchanted Productions-Irish Film Industry-World 2000 Entertainment,Comedy-Family-Fantasy-Romance,"Based on Gail Carson Levine's award winning novel, this is the story of Ella, a young woman who was given a ""gift"" of obedience by a fairy named Lucinda. She must obey anything anyone tells her to do. When her mother passes away, she is cared for by her thoughtless and greedy father who remarries a loathsome woman with two treacherous daughters. This modern-day, fantasy Cinderella story features fairies, ogres and elves...as well as a hero in the guise of Prince Charmont, whom Ella falls in love with. Unlike Cinderella though, she must depend on herself and her intelligence to get her through her troubles and find Lucinda in order for her ""curse"" to be broken!"
13489,2000,Attila,,,,,,,
13490,2000,Chopper,94,7.2,Andrew Dominik,Mark Brandon Read-Andrew Dominik,Australian Film Finance Corporation-Mushroom Pictures-Pariah Entertainment Group,Biography-Crime-Drama,"Chopper tells the intense story of Mark ""Chopper"" Read, a legendary criminal who wrote his autobiography while serving a murder sentence in prison. His book, From the Inside, upon which the film is based, was a best-seller."
13491,2002,Jamie Oliver: Jamie's Kitchen,,,,,,,
13492,1994,The Cool Surface,,,,,,,
13493,1989,Lean on Me,108,7.4,John G. Avildsen,Michael Schiffer,Norman Twain Productions-Warner Bros.,Drama,"An arrogant and unorthodox teacher returns as principal to the idyllic high school from which he had earlier been fired to find it a den of drug abuse, gang violence, and urban despair. Eventually his successful but unorthodox methods lead to a clash with city officials that threatens to undo all his efforts. Based on a true story."
13494,1996,Lynrd Skynyrd: Freebird: The Movie / Tribute Tour,,,,,,,
13495,1996,Thesis,125,7.4,Alejandro Amenábar,Alejandro Amenábar-Alejandro Amenábar-Mateo Gil,Las Producciones del Escorpión-Sogepaq,Horror-Mystery-Thriller,"Why is death and violence so fascinating? Is it morally correct to show violence in movies? If so, is there a limit to what we should show? That's the subject of Ángela's examination paper. She is a young student at a film school in Madrid. Together with the student Chema (who is totally obsessed with violent movies) they find a snuff movie in which a young girl is tortured and killed. Soon they discover that the girl was a former student at their school..."
13496,1997,B.A.P.S.,91,4.5,Robert Townsend,Troy Byer,New Line Cinema-Island Pictures,Comedy,"Nisi and Mickey are girlfriends who work as waitresses. To get the necessary money for opening their dream restaurant they fly to California to audition for a music video. There Nisi is asked by the nephew of Mr.Blakemore's (who is video director) to act for a week as granddaughter of Lily, Mr.Blakemores one true love, whom he lost long ago and couldn't pursue because she was his family's housekeeper. They revive Blakemore's interest for life, and he teaches them to be ""Black American Princesses"" in return."
13497,1980,Pink Lady and Jeff,60,4.9,,Jim Brochu-Mark Evanier-Lorne Frohman,Krofft Entertainment,Comedy-Music,
13498,1986,Defense of the Realm,,,Don Voigt,,Buena Vista Television-WBBM-TV,Talk-Show,
13499,1999,Babylon 5: A Call to Arms,94,7.2,Michael Vejar,J. Michael Straczynski-J. Michael Straczynski,Babylonian Productions-TNT,Action-Adventure-Drama-Sci-Fi,"Five years after the events of the Babylon 5 series, a technomage named Galen predicts an imminent attack by the Drakh, the old allies of the Shadows. Through dreams, a thief, a captain, and a president are brought together to head them off. The president is John Sheridan. Because of his irrational behavior, Sheridan's friends begin to wonder about his sanity. It's up to all of them and two prototype battlecruisers, the Excalibur and the Victory, to stop the fleet and their planet-killer. But is there more to the Drakh's plan?"
13500,2002,Skins,84,7.2,Chris Eyre,Adrian C. Louis-Jennifer D. Lyne,First Look International-Starz! Encore Entertainment-Aboriginal Peoples Television Network-Grandview Pictures,Crime-Drama,"Rudy Yellow Lodge is an investigator with the police department and witnesses firsthand the painful legacy of Indian existence. Although rampant unemployment, alcoholism and domestic violence are the norm for many reservation inhabitants, Rudy has largely escaped this cycle of despair. His brother Mogie, however, has not. Now faced with the discovery of a bloodied body, a flaming liquor store just off native land that sells millions of cans of beer a year to the native population, and his brother's ongoing self-destruction, Rudy goes on a quest to avenge himself, his family, and his culture and to seek justice."
13501,1985,Rocky IV,91,6.8,Sylvester Stallone,Sylvester Stallone,United Artists-Metro-Goldwyn-Mayer,Drama-Sport,"Rocky Balboa accompanies his friend Apollo Creed to the ring in a boxing match against a Russian Boxer named Ivan Drago. Drago is too strong for Creed, and unfortunately kills him in his match. Balboa blames himself for Creed's death and is determined to defeat Drago in a boxing match. He gains the help of Creed's former manager, Duke and travels to U.S.S.R. to take on Drago."
