id,year,title,Runtime,Rating,Directors,Writers,Production companies,Genres
4890,1998.0,Next Stop Wonderland,104,6.7,Brad Anderson,Brad Anderson-Lyn Vaus,Robbins Entertainment,Comedy-Drama-Romance
4891,2003.0,Loco Love,94,5.3,Bryan Lewis,Steven Baer,Three Springs Entertainment-Enigma Entertainment-Three Springs Productions,Comedy-Romance
4892,1943.0,Val Lewton: The Leopard Man / The Ghost Ship,,,,,,
4893,2000.0,The Newcomers,90,4.9,James Allen Bradley,Tony Jiti Gill-Garrett Clancy,Edgewood Studios,Drama-Family
4894,1998.0,Celia Cruz: Fania Allstars in Africa,,,,,,
4895,1984.0,Toy Soldiers,91,5.1,David Fisher,David Fisher-Walter Fox,Producciones Rodas S.A. de C.V.-Toy Soldiers Associates,Action-Drama
4896,1996.0,The Thorn Birds: The Missing Years,178,6.5,Kevin James Dobson,Colleen McCullough-David Stevens,The Wolper Organization-Village Roadshow Pictures Television-Warner Bros. Television,Drama-Romance
4897,1961.0,Nikki: Wild Dog of the North,74,7.0,Jack Couffer-Don Haldane,Ralph Wright-Winston Hibler-James Oliver Curwood,Walt Disney Productions-Cangary-Westminster Films,Adventure-Family
4898,1961.0,Pocketful of Miracles,136,7.3,Frank Capra,Hal Kanter-Harry Tugend-Robert Riskin,Franton Productions,Comedy-Drama
4899,2002.0,Pinata: Survival Island,85,2.5,David Hillenbrand-Scott Hillenbrand,David Hillenbrand-Scott Hillenbrand,,Horror-Thriller
4900,2002.0,Let's Dance Salsa: Beginning Lessons 1,,,,,,
4901,1999.0,Aa Ab Laut Chalen,177,5.5,Rishi Kapoor,Sachin Bhowmick-Rumi Jaffery-Rumi Jaffery,R.K. Films Ltd.,Musical-Romance-Drama
4902,1985.0,Young Sherlock Holmes,109,6.8,Barry Levinson,Arthur Conan Doyle-Chris Columbus,Amblin Entertainment-Industrial Light & Magic-Paramount Pictures,Adventure-Fantasy-Mystery-Thriller
4903,1985.0,Ram teri Ganga maili,178,6.8,Raj Kapoor,Raj Kapoor-V.P. Sathe-K.K. Singh,R.K. Films Ltd.,Drama-Musical-Romance
4904,1993.0,Manhattan Murder Mystery,104,7.4,Woody Allen,Woody Allen-Marshall Brickman,TriStar Pictures-Jack Rollins & Charles H. Joffe Productions,Comedy-Mystery
4905,1992.0,Love in Sampan,87,5.3,Dick An,Heung Sang Kong,Perth Advertising,Drama-Romance
4906,1999.0,Stuart Little,84,5.9,Rob Minkoff,E.B. White-M. Night Shyamalan-Greg Brooker,Columbia Pictures-Franklin/Waterman Productions-Global Medien KG,Adventure-Comedy-Family-Fantasy
4907,2000.0,Grass,,,,,,
4908,2004.0,Cartoon Network Christmas: Yuletide Follies,,,,,,
4909,2005.0,Parineeta,130,7.3,Pradeep Sarkar,Saratchandra Chatterjee-Vidhu Vinod Chopra-Rekha Nigam,Vinod Chopra Productions,Drama-Musical-Romance
4910,1996.0,Allyson is Watching,,,,,,
4911,1992.0,Munchie,80,3.8,Jim Wynorski,R.J. Robertson-Jim Wynorski-Vincent Albert DiStefano,New Horizons Picture,Comedy-Family-Fantasy
4912,1955.0,Mister Roberts,123,7.7,John Ford-Mervyn LeRoy-Joshua Logan,Frank S. Nugent-Joshua Logan-Thomas Heggen,Warner Bros.-Orange,Comedy-Drama-War
4913,1994.0,Clean Slate,107,5.7,Mick Jackson,Robert King,Metro-Goldwyn-Mayer (MGM)-The Zanuck Company,Comedy-Mystery
4914,2005.0,White Noise,101,5.5,Geoffrey Sax,Niall Johnson,Universal Pictures-Gold Circle Films-White Noise UK Ltd.-Brightlight Pictures-Endgame Entertainment-Corus-The Movie Network (TMN)-Province of British Columbia Film Incentive BC-Canadian Film or Video Production Tax Credit (CPTC),Drama-Horror-Mystery-Thriller
4915,1994.0,Magic Knight Rayearth,30,7.8,,Clamp-Eric P. Sherman-Terrence Stone,TMS Entertainment,Animation-Action-Adventure-Comedy-Fantasy-Romance
4916,2002.0,Tycoon: A New Russian,123,6.8,Pavel Lungin,Yuliy Dubov-Aleksandr Borodyanskiy-Pavel Lungin,Arte France Cinéma-Arte-CTB Film Company-Catherine Dussart Productions-Etalon Film-France 2 Cinéma-Gimages-Kominter-Magnat-Network Movie Film-und Fernsehproduktion-Zweites Deutsches Fernsehen,Crime-Drama
4917,2001.0,Amazons and Gladiators,94,3.1,Zachary Weintraub,Zachary Weintraub,MBP-Drotcroft Limited-Lithuanian Film Studio-Weintraub/Kuhn Productions,Drama-Action-Adventure
4918,1997.0,Slayers Try DVD Collection,,,,,,
4919,1997.0,South Park: Passion of the Jew,,,,,,
4920,1982.0,Tron: Bonus Material,,,,,,
4921,1995.0,Megaman: Battle for the Future,,,,,,
4922,2002.0,Sorcerers and Wizards: Real Magic,,,,,,
4923,1996.0,A Very Brady Sequel,90,5.7,Arlene Sanford,Sherwood Schwartz-Harry Elfont-Deborah Kaplan,Paramount Pictures-The Ladd Company,Comedy
4924,1961.0,The Twilight Zone: Vol. 13,,,,,,
4925,1989.0,God of Gamblers,126,7.4,Jing Wong,Jing Wong,Win's Movie Productions Ltd.,Action-Comedy-Drama
4926,1997.0,Washington Square,115,6.7,Agnieszka Holland,Henry James-Carol Doyle,Alchemy Filmworks-Caravan Pictures-Hollywood Pictures-Roger Birnbaum Productions,Drama-Romance
4927,1956.0,A Kiss Before Dying,94,6.8,Gerd Oswald,Lawrence Roman-Ira Levin,Crown Productions (II),Crime-Film-Noir-Mystery-Romance-Thriller
4928,2005.0,The Bridge of San Luis Rey,,,,,,
4929,2004.0,Born to be Wild: The Leading Men of American Ballet Theatre,,,,,,
4930,2000.0,Bedrooms and Hallways,,,,,,
4931,2004.0,Catwoman,104,3.3,Pitof,Bob Kane-Theresa Rebeck-John Brancato,Warner Bros.-Village Roadshow Pictures-DiNovi Pictures-Frantic Films-Maple Shade Films-Catwoman Films,Action-Crime-Fantasy
4932,1997.0,The Saint,116,6.2,Phillip Noyce,Leslie Charteris-Jonathan Hensleigh-Jonathan Hensleigh,Paramount Pictures-Rysher Entertainment-Mace Neufeld Productions-Robert Evans Company,Action-Adventure-Romance-Sci-Fi-Thriller
4933,1996.0,Pretty Village,115,8.7,Srdjan Dragojevic,Vanja Bulic-Srdjan Dragojevic-Srdjan Dragojevic,Cobra Films-MCRS-Radio Televizija Srbije,Comedy-Drama-History-War
4934,1995.0,Danielle Steel's Vanished,96,5.6,George Kaczender,Kathleen Rowell-Danielle Steel,NBC Productions-The Cramer Company,Drama-Romance
4935,1998.0,VH1 Divas Live,80,7.5,Michael Simon,Gary T. Carlin-Martin Lewis,,Documentary-Music
4936,1998.0,My Giant,103,4.9,Michael Lehmann,Billy Crystal-David Seltzer-David Seltzer,Castle Rock Entertainment-Face Productions,Comedy-Drama
4937,1995.0,Chinese Odyssey 1: Pandora's Box,87,7.8,Jeffrey Lau,Jeffrey Lau-Cheng'en Wu,Xi'an Film Studio,Action-Adventure-Comedy-Fantasy-Romance
4938,1994.0,Napoleon,,6.2,Saji,,,
4939,2001.0,Discovering Greece,,,,,,
4940,1989.0,Maine Pyar Kiya,192,7.4,Sooraj R. Barjatya,S.M. Ahale-Sooraj R. Barjatya-Sooraj R. Barjatya,Rajshri Productions,Drama-Family-Musical-Romance
4941,2004.0,Aetbaar,152,4.7,Vikram Bhatt,Robin Bhatt-Vikram Bhatt-Girish Dhamija,Cutting Edge Entertainment,Drama-Musical-Romance-Thriller
4942,1990.0,Time to Kill,,,,,,
4943,1984.0,Against All Odds,128,5.9,Taylor Hackford,Eric Hughes-Daniel Mainwaring-Daniel Mainwaring,Columbia Pictures-Columbia-Delphi Productions-New Visions,Action-Adventure-Crime-Drama-Romance-Thriller
4944,1994.0,The Three Tenors in Concert: Dodger Stadium,,,,,,
4945,1973.0,5 Films About Christo & Jeanne-Claude,,,,,,
4946,2002.0,Inside Islam,,6.6,Mark Hufnail,Douglas Brooks West,MPH Entertainment Productions,Documentary
4947,1933.0,The Invisible Man: Special Edition,,,,,,
4948,2002.0,Run Ronnie Run,86,6.4,Troy Miller,David Cross-Bob Odenkirk-Scott Aukerman,Burg/Koules Productions-Dakota North Entertainment-Dakota Pictures-Home Box Office,Comedy
4949,1999.0,House on Haunted Hill,93,5.6,William Malone,Robb White-Dick Beebe,Dark Castle Entertainment,Horror-Mystery-Thriller
4950,2001.0,Discovering England,,,,,,
4951,2003.0,Runaway Jury,127,7.1,Gary Fleder,John Grisham-Brian Koppelman-David Levien,Regency Enterprises-New Regency Pictures-Epsilon Motion Pictures,Crime-Drama-Thriller
4952,2000.0,Dr. Wayne Dyer: How to Get What You Really Want & Improve Your Life,,,,,,
4953,1995.0,Three Wishes,115,6.2,Martha Coolidge,Clifford Green-Ellen Green-Elizabeth Anderson,Rysher Entertainment,Drama-Fantasy
4954,1980.0,Sandbaggers: Collection 3,,,,,,
4955,1976.0,Satan's Brew,112,7.2,Rainer Werner Fassbinder,Rainer Werner Fassbinder,Albatros Filmproduktion-Trio Film,Comedy-Drama-Romance
4956,1989.0,Back to the Future Part II,108,7.8,Robert Zemeckis,Robert Zemeckis-Bob Gale-Robert Zemeckis,Universal Pictures-Amblin Entertainment-U-Drive Productions,Adventure-Comedy-Sci-Fi
4957,2001.0,Para Para Sakura,,5.8,Jingle Ma,,Golden Harvest Company-Red on Red Productions-Tianshan Film Studio,Musical-Comedy-Romance-Drama
4958,1977.0,Chinese Roulette,,,,,,
4959,2000.0,Caillou: Caillou's Train Trip and Other Adventures,,,,,,
4960,2002.0,New York Firefighters: The Brotherhood of 9/11,,,Peter Schnall,Hilary Sio-Hilary Sio,Partisan Pictures,Documentary
4961,1991.0,Black Cat,,,,,,
4962,2003.0,Twin Towers,34,7.5,Bill Guttentag-Robert David Port,,MOPO Entertainment-Shape Pictures-Universal Television-Wolf Films,Short
4963,1991.0,Grateful Dead: View from the Vault 2,,,,,,
4964,2003.0,Tiptoes,90,4.6,Matthew Bright,Bill Weiner,Langley Productions-Marshak / Zachary-Canal+-StudioCanal-Wild Bunch,Comedy-Drama-Romance
4965,1962.0,Mamma Roma,106,7.9,Pier Paolo Pasolini,Pier Paolo Pasolini,Arco Film,Drama
4966,1990.0,The Hot Spot,130,6.4,Dennis Hopper,Charles Williams-Nona Tyson-Charles Williams,Orion Pictures,Crime-Drama-Romance-Thriller
4967,1999.0,Jaanam Samjha Karo,153,4.9,Andaleeb Sultanpuri,Rajkumar Santoshi-Rajkumar Santoshi,Karishma Internationals,Drama-Romance
4968,1998.0,National Geographic: The Photographers,53,6.7,,,National Geographic Video,Documentary
4969,1981.0,The Flame Trees of Thika,50,7.9,Roy Ward Baker,John Hawkesworth-Elspeth Huxley,Euston Films-Thames Television,Biography-Drama
4970,1992.0,Damage,111,6.9,Louis Malle,David Hare-Josephine Hart,Nouvelles Éditions de Films-Skreba Films-StudioCanal-European Co-production Fund-Channel Four Films-Canal+,Drama-Romance
4971,1991.0,La Belle Noiseuse,238,7.7,Jacques Rivette,Pascal Bonitzer-Christine Laurent-Jacques Rivette,Pierre Grise Productions-George Reinhart Productions-FR3 Films Production-Centre National de la Cinématographie (CNC)-Canal+-Investimage 2-Investimage 3-Région Languedoc-Roussillon,Drama
4972,2003.0,Paycheck,119,6.3,John Woo,Philip K. Dick-Dean Georgaris,Paramount Pictures-DreamWorks-Davis Entertainment-Lion Rock Productions-Solomon/Hackett Productions-Province of British Columbia Film Incentive BC,Action-Crime-Drama-Mystery-Sci-Fi-Thriller
4973,1939.0,W.C. Fields: You Can't Cheat an Honest Man,79,7.2,George Marshall-Edward F. Cline,George Marion Jr.-Richard Mack-Everett Freeman,Universal Pictures,Comedy
4974,1982.0,Alone in the Dark,92,6.1,Jack Sholder,Jack Sholder-Robert Shaye-Michael Harrpster,Masada Productions-New Line Cinema,Horror-Thriller
4975,1909.0,D.W. Griffith: Years of Discovery 1909-1913,,,,,,
4976,1999.0,The Trench,98,6.1,William Boyd,William Boyd,Arts Council of England-Blue PM-Bonaparte Films-British Screen Productions-Canal+-Galatée Films-Portman Entertainment Group-Skyline Films,Drama-History-War
4977,1988.0,The Great Outdoors,91,6.6,Howard Deutch,John Hughes,Hughes Entertainment-Universal Pictures,Comedy
4978,2000.0,Freaks & Geeks: The Complete Series,,,,,,
4979,2002.0,Star Trek: Enterprise: Season 2,,,,,,
4980,2000.0,Dead or Alive 2,97,6.9,Takashi Miike,Masa Nakamura,Toei Video Company-Excellent Film-Daiei Motion Picture Company,Crime-Drama-Thriller
4981,1979.0,Dracula,109,6.5,John Badham,W.D. Richter-Hamilton Deane-John L. Balderston,The Mirisch Corporation,Horror-Romance
4982,1990.0,Skinny Tiger,100,6.8,Chia Yung Liu,Kwok Chi Tsang,Cinema Capital Entertainment Ltd.,Action-Comedy
4983,2004.0,Sarah McLachlan: Afterglow Live,137,8.6,Russell Thomas,,Done and Dusted Productions,Documentary-Music
4984,1995.0,Hiroshima,190,8.0,Koreyoshi Kurahara-Roger Spottiswoode,John Hopkins-Toshirô Ishidô,Telescene Film Group Productions,Drama-War
4985,1999.0,Lost & Found,95,5.0,Jeff Pollack,J.B. Cook-Marc Meeks-David Spade,Alcon Entertainment-Dinamo Entertainment,Comedy-Romance
4986,2002.0,The Shipment,,,,,,
4987,1999.0,Music of the Heart: Bonus Material,,,,,,
4988,2005.0,Saturday Night Live: The Best of John Belushi,78,7.6,,Michael O'Donoghue,NBC Universal Television,Comedy
4989,1999.0,Pantera: 3 Vulgar Videos From Hell,245,9.1,,,Elektra Entertainment Group,Comedy-Music
4990,1979.0,Taxi: Season 2,,,,,,
4991,2005.0,Barbie and the Magic of Pegasus,83,6.5,Greg Richardson,Elana Lesser-Cliff Ruby,Mainframe Entertainment-Mattel-Voice Box Productions,Animation-Family-Romance
4992,1999.0,Kathy Smith: Kickboxing Workout,45,6.9,,,,
4993,2004.0,Chicago with Earth,,,,,,
4994,2002.0,Snapshots,93,6.2,Rudolf van den Berg,Michael O'Loughlin-Rudolf van den Berg,Albion Entertainment-Cadenza Films B.V.-Dune Films-Film Venture C.V.-Overseas FilmGroup,Romance
4995,2002.0,Crossroads,93,3.4,Tamra Davis,Shonda Rhimes,Fuzzy Bunny Films-MTV Films-Paramount Pictures-Zomba Films,Comedy-Drama-Romance
4996,2000.0,Gone in 60 Seconds,118,6.5,Dominic Sena,H.B. Halicki-Scott Rosenberg,Touchstone Pictures-Jerry Bruckheimer Films,Action-Crime-Thriller
4997,2004.0,Alabama Love Story,,,,,,
4998,1948.0,Anna Karenina,139,6.7,Julien Duvivier,Jean Anouilh-Guy Morgan-Julien Duvivier,London Film Productions,Drama-Romance
4999,2001.0,Lucky Break,107,6.2,Peter Cattaneo,Ronan Bennett-Stephen Fry,FilmFour-Fragile Films-Miramax-Senator Film Produktion,Comedy-Crime-Romance
5000,1994.0,Getting Even with Dad,109,4.7,Howard Deutch,Tom S. Parker-Jim Jennewein,Metro-Goldwyn-Mayer,Comedy-Crime-Family
5001,1998.0,Lulu on the Bridge,103,6.3,Paul Auster,Paul Auster,Capitol Films-Redeemable Features,Drama-Music-Mystery-Romance
5002,2003.0,MTV Power Yoga,,,,,,
5003,2003.0,2003 World Series,,,,,Fox Network,Sport
5004,2001.0,Nowhere in Africa,141,7.6,Caroline Link,Caroline Link-Stefanie Zweig,Bavaria Film-Bavaria Filmverleih- und Produktions GmbH-Bayerischer Banken-Fonds-Beauftragter der Bundesregierung für Angelegenheiten der Kultur und der Medien (BKM)-Constantin Film-FilmFernsehFonds Bayern-Filmförderungsanstalt (FFA)-MTM Cineteve-Media Cooperation One,Biography-Drama
5005,1995.0,Vampire in Brooklyn,100,4.5,Wes Craven,Eddie Murphy-Vernon Lynch-Charlie Murphy,Eddie Murphy Productions-Paramount Pictures,Comedy-Fantasy-Horror-Romance
5006,2004.0,The White Stripes: Under Blackpool Lights,81,8.7,Dick Carruthers,,,Documentary-Music
5007,2002.0,Queer as F**k,,,David Beebe,,David Beebe Productions,Short-Reality-TV
5008,1998.0,The Pentagon Wars,104,7.3,Richard Benjamin,James Burton-Jamie Malanowski-Martyn Burke,Home Box Office,Comedy-War
5009,1984.0,Faerie Tale Theatre: Cinderella,,,,,,
5010,1990.0,Postcards from the Edge,101,6.7,Mike Nichols,Carrie Fisher-Carrie Fisher,Columbia Pictures,Comedy-Drama
5011,1992.0,Painted Skin,94,5.5,King Hu,Cheng Ah-King Hu,New Treasurer Films Company,Horror
5012,2004.0,Miles Davis: Cool Jazz Sound,,,,,,
5013,1992.0,Under Suspicion,,,,,,
5014,1986.0,Alf: Season 1,,,,,,
5015,1981.0,Ragtime,155,7.3,Milos Forman,E.L. Doctorow-Michael Weller-Heinrich von Kleist,Dino De Laurentiis Company-Sunley Productions Ltd.,Drama
5016,1996.0,Set It Off,123,6.9,F. Gary Gray,Takashi Bufford-Takashi Bufford-Kate Lanier,New Line Cinema-Peak Films,Action-Crime-Drama-Romance-Thriller
5017,1963.0,A New Kind of Love,110,6.0,Melville Shavelson,Melville Shavelson,Llenroc Productions-Paramount Pictures,Comedy-Romance
5018,2001.0,Fruits Basket,24,8.0,,John Burgmeier-Akitarô Daichi-Mamiko Ikeda,Nihon Ad Systems-TV Tokyo,Animation-Comedy-Drama-Fantasy-Romance
5019,1944.0,The Princess and the Pirate,94,7.0,David Butler-Sidney Lanfield,Don Hartman-Melville Shavelson-Everett Freeman,The Samuel Goldwyn Company,Adventure-Comedy-Romance
5020,2003.0,Johnny English,88,6.2,Peter Howitt,Neal Purvis-Robert Wade-William Davies,Universal Pictures-StudioCanal-Working Title Films-Kanzaman S.A.M.,Action-Adventure-Comedy
5021,1990.0,Tales from Avonlea,60,8.6,,Lucy Maud Montgomery-Fiona McHugh-Heather Conkie,Disney Channel-Sullivan Entertainment,Drama-Adventure-Family-Mystery-Romance
5022,2001.0,Little Otik,,,,,,
5023,2002.0,Take Care of My Cat,,,,,,
5024,1983.0,The Greatest American Hero: Season 3,,,,,,
5025,1985.0,Mask: Director's Cut,,,,,,
5026,2004.0,Kathy Griffin: Allegedly,86,7.9,Keith Truesdell,Kathy Griffin,Inappropriate Laughter Inc.-Production Partners,Comedy
5027,1980.0,Bad Timing,123,7.0,Nicolas Roeg,Yale Udoff,Recorded Picture Company-The Rank Organisation,Drama-Mystery-Thriller
5028,1998.0,Whispering Corridors,105,6.1,Ki-hyeong Park,Jung-Ok In-Ki-hyeong Park,Cine-2000 Film Production,Drama-Horror-Mystery-Thriller
5029,1999.0,Children of the Century,135,6.5,Diane Kurys,Murray Head-Diane Kurys-François-Olivier Rousseau,Alexandre Films-Canal+-Conseil Général de l'Indre-FilmFour-France 2 Cinéma-Les Films Alain Sarde-Procirep-Studio Images 5,Biography-Drama-Romance
5030,1997.0,Black Scorpion 2: Ground Zero,,,,,,
5031,2002.0,Satin Rouge,100,6.7,Raja Amari,Raja Amari,A.N.P.A.-ADR Productions-Arte France Cinéma-Canal+-Centre National de la Cinématographie-Nomadis Images,Musical-Drama
5032,1983.0,Legend of the Eight Samurai,133,6.6,Kinji Fukasaku,Kinji Fukasaku-Toshio Kamata,Kadokawa Haruki Jimusho-Toei Company,Adventure-Drama-Fantasy-Romance
5033,1993.0,Son in Law,95,5.7,Steve Rash,Patrick J. Clifton-Susan McMartin-Peter M. Lenkov,Hollywood Pictures-Touchwood Pacific Partners 1,Comedy-Drama-Romance
5034,1989.0,Dick Francis Mysteries,,,,,,
5035,1998.0,54,93,5.8,Mark Christopher,Mark Christopher,Dollface-FilmColony-Miramax-Redeemable Features,Drama-Music
5036,1998.0,Ernest in the Army,85,4.9,John R. Cherry III,Jeffrey Pillars-Joseph Dattorre-John R. Cherry III,Active Entertainment-Emshell Producers,Family-Comedy
5037,1997.0,Hameshaa,141,5.4,Sanjay Gupta,Sanjay Gupta-Ranbir Pushp,NH Studioz,Drama
5038,1996.0,American Strays,97,5.4,Michael Covert,Michael Covert,Canned Pictures Inc.-Harmony Gold,Action-Comedy
5039,2003.0,Detention,98,4.3,Sidney J. Furie,Paul Lynch-John Sheppard,Millennium Films-GFT Entertainment-GFT Detention Films Inc.,Action-Drama-Thriller
5040,1994.0,The Endless Summer II,109,7.6,Bruce Brown,Bruce Brown-Dana Brown,,Documentary-Adventure-Sport
5041,1998.0,Clay Pigeons,104,6.6,David Dobkin,Matthew L. Healy,Fade In Films-IMF Internationale Medien und Film GmbH & Co. Produktions KG-Intermedia Films-Polygram Filmed Entertainment-Scott Free Productions,Comedy-Crime
5042,2003.0,Deliver Us From Eva,105,6.1,Gary Hardwick,James Iver Mattson-B.E. Brauner-James Iver Mattson,Baltimore Spring Creek Productions-USA Films,Comedy-Drama-Romance
5043,1963.0,The Dick Van Dyke Show: Season 3,,,,,,
5044,2003.0,The Second Coming,144,7.6,Adrian Shergold,Russell T. Davies,Red Production Company,Drama-Fantasy-Romance-Thriller
5045,1969.0,The Trouble With Girls,97,5.5,Peter Tewksbury,Arnold Peyser-Lois Peyser-Day Keene,Metro-Goldwyn-Mayer,Comedy-Musical
5046,2003.0,Iron Maiden: Visions of the Beast,154,8.6,,,Sanctuary Records Group,Documentary
5047,2001.0,Max Keeble's Big Move,86,5.4,Tim Hill,David L. Watts-Jonathan Bernstein-Mark Blackwell,Walt Disney Pictures-Karz Entertainment,Comedy-Crime-Family
5048,2002.0,Gene Kelly: Anatomy of a Dancer,85,7.5,Robert Trachtenberg,Robert Trachtenberg,American Masters-Eagle Rock Entertainment-Turner Entertainment-WNET Channel 13 New York,Documentary-Biography
5049,1982.0,Rehearsal for Murder,96,7.0,David Greene,Richard Levinson-William Link,CBS Entertainment Production-Richard Levinson / William Link Productions-Robert Papazian Productions,Drama-Mystery-Thriller
5050,1953.0,Roman Holiday,118,8.1,William Wyler,Ian McLellan Hunter-John Dighton-Dalton Trumbo,Paramount Pictures,Comedy-Romance
5051,1983.0,Queen: On Fire: Live at the Bowl,,,,,,
5052,1991.0,Separate But Equal,190,7.4,George Stevens Jr.,George Stevens Jr.,George Stevens Productions-New Liberty Productions-Republic Pictures (II),Drama-History
5053,1937.0,Laurel and Hardy: Way Out West / Block-Heads,,,,,,
5054,1996.0,Mission: Impossible,110,7.1,Brian De Palma,Bruce Geller-David Koepp-Steven Zaillian,Paramount Pictures-Cruise/Wagner Productions,Action-Adventure-Thriller
5055,1998.0,Hope Floats,114,6.0,Forest Whitaker,Steven Rogers,Twentieth Century Fox-Fortis Films,Drama-Romance
5056,1994.0,Angels in the Outfield,102,6.1,William Dear,Dorothy Kingsley-George Wells-Richard Conlin,Caravan Pictures-Walt Disney Pictures,Comedy-Family-Fantasy-Sport
5057,2004.0,WWE: Unforgiven 2004,180,6.8,Kevin Dunn,,World Wrestling Entertainment,Action
5058,2004.0,Swades,210,8.3,Ashutosh Gowariker,M.G. Sathya-Ashutosh Gowariker-Ashutosh Gowariker,Ashutosh Gowariker Productions-Dillywood-UTV Motion Pictures,Drama
5059,1981.0,Outland,109,6.6,Peter Hyams,Peter Hyams,The Ladd Company-Outland Productions,Action-Crime-Sci-Fi-Thriller-Western
5060,1990.0,Campion: Flowers for the Judge,54,7.7,Michael Owen Morris,Margery Allingham-John Hawkesworth-Brian Thompson,,Adventure-Crime-Drama-Mystery
5061,1994.0,The Bodyguard from Beijing,92,6.4,Corey Yuen,Gordon Chan-Kin Chung Chan-Jack Maeby,Eastern Productions-Golden Harvest Company,Action-Crime-Thriller
5062,1980.0,The Monster Club,,,,,,
5063,1997.0,Mouse Hunt,98,6.4,Gore Verbinski,Adam Rifkin,DreamWorks,Comedy
5064,2005.0,Left Behind: World at War,,,,,Trinity Christian Center of Santa Ana,Music-Talk-Show
5065,1933.0,W.C. Fields: Six Short Films,,,,,,
5066,1994.0,New Legend of Shaolin,95,6.4,Jing Wong-Corey Yuen,Domonic Muir-Jing Wong,Eastern Productions,Action-Adventure-Comedy-Drama-History-Romance
5067,2000.0,Molokai: The Story of Father Damien,,,,,,
5068,1970.0,Alice in Acidland / Smoke and Flesh,,,,,,
5069,1991.0,Sleeping With the Enemy,99,6.2,Joseph Ruben,Nancy Price-Ronald Bass,Twentieth Century Fox,Drama-Thriller
5070,1998.0,Nazca: Betrayal of Humanity,,,,,,
5071,2005.0,Fever Pitch,104,6.2,Bobby Farrelly-Peter Farrelly,Lowell Ganz-Babaloo Mandel-Nick Hornby,Fox 2000 Pictures-Flower Films-Wildgaze Films-Alan Greenspan Productions-Mars Media Beteiligungs-ELC Productions Ltd.,Comedy-Drama-Romance-Sport
5072,2001.0,Visitor Q,84,6.8,Takashi Miike,Itaru Era,Alphaville-CineRocket,Comedy-Drama-Horror-Thriller
5073,1998.0,Nightwatch,,,,,,
5074,1965.0,Major Dundee,123,6.8,Sam Peckinpah,Harry Julian Fink-Harry Julian Fink-Oscar Saul,Jerry Bresler Productions,Adventure-War-Western
5075,1973.0,High Plains Drifter,105,7.6,Clint Eastwood,Ernest Tidyman-Dean Riesner,The Malpaso Company,Mystery-Western
5076,2003.0,Atlantis: Milo's Return,70,5.1,Victor Cook-Toby Shelton-Tad Stones,Thomas Hart-Henry Gilroy-Kevin Hopps,Disney Television Animation-Disneytoon Studios-Walt Disney Pictures,Animation-Action-Adventure-Comedy-Drama-Family-Fantasy-Sci-Fi
5077,1996.0,Sworn To Justice,97,5.2,Paul Maslak,Robert Easter-Paul Maslak-Neva Friedenn,Maslak/Friedenn Films-Amazing Movies-B Just Productions Inc.-Gorilla Pictures,Action-Drama
5078,2003.0,Harvie Krumpet,23,8.0,Adam Elliot,Adam Elliot-Luke Elliot,Melodrama Pictures-The Australian Film Commission-SBS Independent-Film Victoria,Animation-Comedy-Short-Drama
5079,1947.0,Copacabana,92,6.2,Alfred E. Green,László Vadnay-László Vadnay-Howard Harris,Beacon Productions,Comedy-Musical
5080,1975.0,Dario Argento Collection: Vol. 3: Deep Red,,,,,,
5081,2003.0,WWE: From the Vault: Shawn Michaels,,7.2,Kevin Dunn,,World Wrestling Entertainment (WWE),Sport
5082,1975.0,The Lost Honor of Katharina Blum,106,7.4,Volker Schlöndorff-Margarethe von Trotta,Heinrich Böll-Volker Schlöndorff-Margarethe von Trotta,Bioskop Film-Paramount-Orion Filmproduktion-Westdeutscher Rundfunk,Crime-Drama
5083,1986.0,The Worst Witch,70,7.2,Robert Young,Jill Murphy-Mary Pleshette Willis,Central Independent Television,Comedy-Family-Fantasy-Musical
5084,1981.0,Escape from New York,99,7.2,John Carpenter,John Carpenter-Nick Castle,Embassy Pictures-International Film Investors-Goldcrest Films International-Major Studio Partners,Action-Adventure-Sci-Fi
5085,2003.0,Seabiscuit,140,7.3,Gary Ross,Laura Hillenbrand-Gary Ross,Universal Pictures-DreamWorks-Spyglass Entertainment-Larger Than Life Productions-The Kennedy/Marshall Company,Drama-History-Sport
5086,2000.0,In the Weeds,91,6.2,Michael Rauch,Michael Rauch,Catchlight Films-Glatzer Productions,Comedy-Romance
5087,1999.0,Mystery,121,6.1,Kinka Usher,Neil Cuthbert-Bob Burden,Universal Pictures-Golar Productions-Dark Horse Entertainment,Action-Comedy-Fantasy-Sci-Fi
5088,1987.0,Dirty Dancing: Bonus Material,,,,,,
5089,2002.0,Fushigi Yugi: The Mysterious Play: Eikoden,,,,,,
5090,1983.0,The Survivors,103,5.8,Michael Ritchie,Michael Leeson,Rastar Films,Comedy-Crime-Drama
5091,1979.0,Star Blazers: Series 3: The Bolar Wars,,,,,,
5092,1997.0,Buffy the Vampire Slayer: Season 2,44,8.2,,Joss Whedon-Douglas Petrie-Rebecca Kirshner,Mutant Enemy-Kuzui Enterprises-Sandollar Television-20th Century Fox Television,Action-Drama-Fantasy-Romance
5093,1955.0,It Came From Beneath the Sea,79,6.0,Robert Gordon,George Worthing Yates-Harold Jacob Smith-George Worthing Yates,Columbia Pictures-Clover Productions,Horror-Sci-Fi
5094,1974.0,The Year Without a Santa Claus,51,7.9,Jules Bass-Arthur Rankin Jr.,William J. Keenan-Phyllis McGinley,Rankin/Bass Productions,Animation-Comedy-Family-Fantasy-Musical
5095,2003.0,Running on Karma,93,6.7,Johnnie To-Ka-Fai Wai,Ka-Fai Wai-Nai-Hoi Yau-Kin-Yee Au,China Star Entertainment-One Hundred Years of Film Company-Milky Way Image Company,Action-Drama-Thriller
5096,2005.0,My Summer of Love,,,,,,
5097,1963.0,Bye Bye Birdie,112,6.6,George Sidney,Michael Stewart-Irving Brecher-George Sidney,Columbia Pictures-Kohlmar-Sidney Productions,Comedy-Musical
5098,2001.0,Pyaar Ishq aur Mohabbat,,4.1,Rajiv Rai,Shabbir Boxwala-Rajiv Rai-Rajiv Rai,Demian Communications-Trimurti Films Pvt. Ltd.,Drama-Musical-Romance
5099,2002.0,Devdas,185,7.6,Sanjay Leela Bhansali,Saratchandra Chatterjee-Prakash Kapadia-Sanjay Leela Bhansali,Red Chillies Entertainment-Mega Bollywood,Drama-Musical-Romance
5100,2001.0,Queensryche: Live Evolution,139,7.3,Michael Drumm,,Music Link Productions,Music
5101,2004.0,Taboo: The Beginning of Erotic Cinema,,,,,,
5102,1971.0,Dr. Jekyll and Sister Hyde,97,6.6,Roy Ward Baker,Robert Louis Stevenson-Brian Clemens,Hammer Films,Horror-Sci-Fi
5103,1993.0,The Simpsons: Season 5,,,,,,
