id,year,title,Runtime,Rating,Directors,Writers,Production companies,Genres,Plot
12499,2001,Scenes of the Crime,91,5.8,Dominique Forma,Dominique Forma-Daniel Golka-Amit Mehta,Battleplan Productions-Cinecrime-Cinerenta Medienbeteiligungs KG-Destination Films,Thriller-Drama-Action,"Lenny Burroughs is a struggling auto mechanic who serves as part-time driver for local gangster Rick in order to earn enough to buy his own garage and pay for his upcoming marriage. Unbeknownst to Lenny, his assignment includes kidnapping Jimmy Berg, an important gang kingpin who has robbed rival criminal Trevor Morrison of over $7 million dollars and killed three of his men including the son of Morrison's partner. The plan is for Morrison to trade Berg back to his partner, Steve Wayne, in exchange for the return of his money, a million dollar indemnity, and a percentage of union municipal contracts which are very profitable for the politically savvy Wayne. However, something goes wrong. Rick contradicts Trevor's plans and seems to be following the agenda of an unknown third party by ordering Lenny to a side street instead of the agreed-upon location. When he leaves the van, he's immediately run down by Wayne's men, who execute him gangland style. Fearing he'll be killed too, Lenny grabs the gun and threatens to shoot Berg unless the hoods return to their vehicles. A grim stand-off occurs on the street and in a local deli as negotiations continue on the phone as Lenny finds he has no choice but to act in Trevor's interest."
12500,1999,Boys Don't Cry,118,7.6,Kimberly Peirce,Kimberly Peirce-Andy Bienen,Fox Searchlight Pictures-The Independent Film Channel Productions-Killer Films-Hart Sharp Entertainment,Biography-Crime-Drama-Romance,"Based on actual events. Brandon Teena is the popular new guy in a tiny Nebraska town. He hangs out with the guys, drinking, cussing, and bumper surfing, and he charms the young women, who've never met a more sensitive and considerate young man. Life is good for Brandon, now that he's one of the guys and dating hometown beauty Lana; however, he's forgotten to mention one important detail. It's not that he's wanted in another town for GTA and other assorted crimes, but that Brandon Teena was actually born a woman named Teena Brandon. When his best friends make this discovery, Brandon's life is ripped apart."
12501,1984,The NeverEnding Story,102,7.4,Wolfgang Petersen,Wolfgang Petersen-Herman Weigel-Michael Ende,Constantin Film-Bavaria Studios-Westdeutscher Rundfunk (WDR)-Warner Bros.-Producers Sales Organization-Bavaria Film-Dieter Geissler Filmproduktion,Adventure-Drama-Family-Fantasy,"Bastian is a young boy who lives a dreary life being tormented by school bullies. On one such occasion he escapes into a book shop where the old proprieter reveals an ancient story-book to him, which he is warned can be dangerous. Shortly after, he ""borrows"" the book and begins to read it in the school attic where he is drawn into the mythical land of Fantasia, which desperately needs a hero to save it from destruction."
12502,2000,Mikado: Gilbert & Sullivan: Stratford Festival,,,,,,,
12503,2000,Urbania,103,7.0,Jon Shear,Daniel Reitz-Daniel Reitz-Jon Shear,Daly-Harris Productions,Drama,"Charlie takes an odyssey through grief during a fall weekend in New York City. His encounters are planned and chance: with a homeless man who sleeps by his building, with a friend who's dying, with the couple who lives (and noisily loves) in the flat above him, with a bartender and a one-night-stand he follows home, and with a tattooed stranger whom he seeks out and befriends. Along the way, Charlie inhabits a city full of moments of violence and of stories and legends: a kidney thief, a microwaved poodle, a rat in a hot dog bun, a baby left on a car top, a tourist's toothbrush, needles in public-phone change slots. Charlie lives and tells his own stories. What caused his melancholy?"
12504,1953,The Stooge,,,,,,,
12505,1984,Care Bears: Kingdom of Caring,,,,,,,
12506,1974,Godzilla vs. Mechagodzilla,84,6.4,Jun Fukuda,Jun Fukuda-Masami Fukushima-Shin'ichi Sekizawa,Toho Company-Toho Eizo Co.,Action-Fantasy-Horror-Sci-Fi,"Aliens intend to take over the planet and, just in case Godzilla tries to interfere, have built a mechanical version of him to put an end to his interference. The Earth humans summon the legendary King Seesar to assist Godzilla in the battle."
12507,1987,Hello Kitty Goes to the Movies,,,,,,,
12508,1968,Chitty Chitty Bang Bang,144,6.9,Ken Hughes,Ian Fleming-Roald Dahl-Ken Hughes,Dramatic Features-Warfield,Adventure-Family-Fantasy-Musical,"An eccentric professor invents wacky machinery but can't seem to make ends meet. When he invents a revolutionary car, a foreign government becomes interested in it and resorts to skulduggery to get their hands on it."
12509,1974,Swept Away,114,7.6,Lina Wertmüller,Lina Wertmüller,Medusa Distribuzione,Adventure-Comedy-Drama,"A rich woman, Raffaella, and some friends rent a yacht to sail the Mediterranean Sea during summer. The sailor, Gennarino, who is a communist, does not like this woman but has to bear with her bad mood. One day she wakes up late in the afternoon and asks to be taken to land where everyone had gone earlier. Gennarino sets up a boat but during the trip, the boat breaks down. They spend the night in the middle of the sea."
12510,1999,Sesame Street: Babies,,,,,,,
12511,1985,Mapp and Lucia: Series 1,,,,,,,
12512,1989,True Believer,105,6.7,Joseph Ruben,Wesley Strick,Columbia Pictures,Drama-Crime,"Eddie Dodd is a burnt out former civil rights lawyer who now specializes in defending drug dealers. Roger Baron, newly graduated from law school, has followed Eddie's great cases and now wants to learn at his feet. With Roger's idealistic prodding, Eddie reluctantly takes on a case of a young Korean man who, according to his mom, has been in jail for eight years for a murder he did not commit."
12513,1998,Star Trek: Insurrection,103,6.4,Jonathan Frakes,Gene Roddenberry-Rick Berman-Michael Piller,Paramount Pictures-Digital Image Associates,Action-Adventure-Sci-Fi-Thriller,"While on a mission to observe the peaceful Ba'ku race, Lieutenant Commander Data suddenly behaves as if having to fear for his existence. The immortal Ba'ku, whose planet offers regenerative radiation, and therefore incredible lifespans, live in harmony with nature and reject advanced technology. Their planet and their culture is secretly researched by the Federation associated with an alien race called the Son'a. But the Son'a intend to abduct the Ba'ku in order to take the planet for themselves and for the Starfleet officials who all would like to regenerate their bodies. But they did not think of the loyalty of Captain Jean-Luc Picard and the crew of the U.S.S. Enterprise NCC-1701-E to the Prime Directive."
12514,2002,Triggermen,96,6.0,John Bradshaw,Tony Johnston-Mark Thomas,First Look International-International West Pictures (IWP)-Now Entertainment Group-Trimuse Entertainment Inc.-Gemini Film Productions-Ballpark Productions Partnership-T-Men Productions,Crime-Comedy,
12515,2000,Phish: Bittersweet Motel,82,8.1,Todd Phillips,,Aviva Entertainment-Bittersweet Films-Little Villa Features-Stranger Than Fiction,Documentary,"This film follows the band, Phish, through a year of its life; from the Great Went concert in Limestone, ME in August 1997 through the subsequent touring in the next year, leading up to August 1998. The director, Todd Phillips, said, ""We weren't looking to make 'Tie-Dyed'; I wanted to concentrate on the music."""
12516,1983,Lovesick,95,5.0,Marshall Brickman,Marshall Brickman,The Ladd Company,Comedy-Fantasy-Romance,
12517,2003,Gigli,121,2.4,Martin Brest,Martin Brest,Revolution Studios-City Light Films-Casey Silver Productions,Comedy-Crime-Romance,"Gigli, a lowly and inept hitman, is assigned a job by the mob to kidnap an intellectually disabled brother of a California district attorney. Gigli abducts the brother from his mental hospital and holds him hostage in his apartment. Ricki, a ""lesbian assassin"", is sent to oversee Gigli's job and make sure he doesn't screw it up. Comedic high jinks ensue as the two go on the lam and start to fall in love."
12518,1998,School of Flesh,110,6.8,Benoît Jacquot,Jacques Fieschi-Yukio Mishima,Orsans Productions-V.M. Productions-La Sept Cinéma-Les Films du Camélia-Artémis Productions-Radio Télévision Belge Francophone-Samsa Film-Canal+-Studio Image 4-Centre du Cinéma et de l'Audiovisuel de la Fédération Wallonie-Bruxelles-Centre National de la Cinématographie (CNC)-Fonds National de Soutien à la Production Audiovisuelle du Luxembourg-Procirep-Eurimages,Drama-Mystery-Romance,"Fashion executive Dominique's obsession for Quentin, a young bisexual hustler, fills her desire for physical love but leaves her taxed emotionally. Twists and turns in the relationship, along with the man's violent and abusive nature, force Dominique to reconcile the conflicts created by her passion. In this quest, Dominique is aided [and sometimes hindered] by friends, clients, and Quentin's former and current acquaintances."
12519,1988,The Ladies Sing the Blues,,,,,,,
12520,1986,Just Between Friends,110,5.9,Allan Burns,Allan Burns,MTM Enterprises-Orion Pictures,Drama,"Holly and Sandy strike up an instant friendship; they don't know however that they have more in common than they'd like. When tragedy strikes, their relationship is tested."
12521,1979,My Brilliant Career,100,7.3,Gillian Armstrong,Eleanor Witcombe-Miles Franklin,Margaret Fink Productions-New South Wales Film Corporation-Greater Union Organisation (GUO),Biography-Drama-Romance,"Sybylla Melvyn is an independent young woman who soon after arriving to live with her Grandmother Bossier and aunt Helen announces that she will never marry and plans on having a career instead. She does attracts the interest of several suitors. The bumbling Englishman Frank Hawdon has only been in Australia for three months and proposes that she return home with him as his wife. She rejects him out of hand telling her grandmother that she does not love him. Then there's her neighbor, the handsome young farmer Harry Beecham, who she is attracted to and eventually accepts his proposal. Time passes however and in the end refuses to marry him while she seeks to become a writer."
12522,1975,Rancho Deluxe,93,6.4,Frank Perry,Thomas McGuane,Elliott Kastner Productions,Comedy-Romance-Western,"Jack McKee (Jeff Bridges) and Cecil Colson (Sam Waterston) are bumbling drifters who make a living by rustling cattle in the wilds of Montana. Jack left his wealthy parents because he resented their posh lives. Cecil is of Caucasian and Native American descent seeking his own path in life away from his grumpy cowboy father (Joe Spinell). Both Jack and Cecil hustle and rustle their way in the world by targeting cattle owned by wealthy ranch-owner John Brown (Clifton James). Frustrated that someone is killing his cattle, John hires a pair of ranch hands, Burt and Curt (Richard Bright and Harry Dean Stanton), to find the rustlers. When Brown realizes he cannot trust his two inept ranch hands, he turns to the grizzled former rustler Henry Beige (Slim Pickens) to find the cattle thieves. Jack and Cecil always stay a step ahead of their pursuers, not realizing that their luck must run out sometime."
12523,2002,All or Nothing,128,7.6,Mike Leigh,Mike Leigh,Les Films Alain Sarde-Thin Man Films,Drama,"Penny's love for her partner, taxi-driver Phil, has run dry. He is a gentle, philosophical guy, and she works on the checkout at a supermarket. Their daughter Rachel cleans in a home for elderly people, and their son Rory is unemployed and aggressive. The joy has gone out of Phil's and Penny's life, but when an unexpected tragedy occurs, they are brought together to rediscover their love. All or Nothing is set on a London working-class housing estate over a long weekend, and also tells the stories of a range of Phil and Penny's neighbors, some of whom become involved in the family's lives, and all of whom experience an emotional journey."
12524,2004,Spider-Man: The Return of the Green Goblin,,,,,,,
12525,2002,Tai Chi for Beginners,,,,,,,
12526,2004,Word Wars,80,6.9,Eric Chaikin-Julian Petrillo,,E-Wolf-Seventh Art Releasing,Documentary-Comedy,"The classic board game, Scrabble, has been popular for decades. In addition, there are fanatics who devote heart and soul to this game to the expense of everything else. This film profiles a group of these enthusiasts as they converge for a Scrabble convention where the word game is almost a bloodsport."
12527,2003,Newlyweds: Nick & Jessica: Season 1,30,3.9,,Donson Clash-Carla Connor-Monica Plie,MTV Productions,Reality-TV-Romance,
12528,2001,Final,111,5.9,Campbell Scott,Bruce McIntosh,InDigEnt-Independent Film Channel-Spare Room Productions,Sci-Fi-Drama-Thriller,"Bill wakes up from a coma in a hospital ward, raving about tissue regeneration experiments, final injections, organ transplants and having been cryogenically frozen. Battling flashbacks of his father's death and a car crash, occasional hallucinations and fits of rage he tries to piece together his own history with the help of Ann, a lonely medical psychologist sent in to evaluate whether he should be released. In their confrontational, sexually-charged sessions, Bill flip-flops between pitch-perfect self-diagnoses and his paranoid bio-tech fantasies, but slowly begins to heal. But things are not what they seem."
12529,1998,Darkness Falls,,,,,,,
12530,2004,Sex and the City: Season 6: Part 2,,,,,,,
12531,1991,Eerie,30,8.2,,Jose Rivera-Karl Schaefer-Matt Dearborn,Cosgrove/Meurer Productions-Hearst Entertainment Productions-Unreality,Adventure-Comedy-Drama-Family-Fantasy-Horror-Mystery-Sci-Fi-Thriller,"Marshall Teller's family moves to the small country town of Eerie, Indiana (Pop. 16,661). There, Marshall discovers that Eerie, as he puts it, ""is the center of weirdness for the universe"". Elvis lives there, so do a pair of twins who stay young by sleeping in Tupperware, and many other strange things. Each episode, Marshall and his friend Simon collect evidence about the creepy things that happen there."
12532,2004,Sonic Youth: Corporate Ghost: The Videos 1990-2002,,,,,,,
12533,1994,Country Life,118,6.8,Michael Blakemore,Michael Blakemore-Anton Chekhov,Australian Film Finance Corporation-Dalton Films,Drama-Romance,"Adaptation of Chekhov's ""Uncle Vanya"" set in rural Australia in the 1920's. Jack Dickens and his niece Sally run the family farm to support brother-in-law Alexander as a (supposedly brilliant) literary critic in London. Action begins when Alexander returns with his beautiful young wife Deborah, revealing himself as an arrogant failure and wanting to sell the farm out from under Jack. Blakemore introduces themes about Australia's separation from England, as well as expanding the pacifist and ecological philosophies espoused by the local Doctor Max Askey."
12534,2005,Steamboy,,7.1,Gilbert Perez,Katski Flores-Enrico C. Santos,Star Cinema,Romance,
12535,2000,Maggie and the Ferocious Beast: Let's Go to the Beach!,,,,,,,
12536,1981,Just Before Dawn,90,6.3,Jeff Lieberman,Mark Arywitz-Jeff Lieberman-Jonas Middleton,Oakland Productions,Horror-Thriller,"Five campers arrive in the mountains to examine some property they have bought, but are warned by Forest Ranger Roy McLean that a huge machete-wielding maniac has been terrorising the area. Ignoring the warnings, they set up camp, and start disappearing one by one."
12537,2003,Undermind,108,6.0,Nevil Dwek,Nevil Dwek,Vertical Pictures-double A Films,Crime-Drama-Fantasy-Thriller,"This psychological dramatic thriller set in New York City is about one man on a journey to find himself. Derrick, a 27 year-old corporate lawyer with a large trust fund, enters the polar opposite world of Zane, a hapless criminal and an aspiring musician. Although the two have never met, and never will, the lives of Derrick and Zane are more connected than either one could ever imagine. One morning the privileged Derrick wakes up in a different apartment, in bed with a woman he has never seen before. It's clear that she knows him, but she calls him Zane. And so does everybody else. From that moment on, Derrick finds himself living Zane's criminal life, where individuals strangely resemble those in his real life: A man he shoots in self defense in this new world resembles his former psychiatrist; Lucy, a manager of an upscale jewelry store that he has been forced to rob is the embodiment of his former girlfriend, Olivia; he takes as hostage a woman who is his mother's doppelganger, as well as the Sampson couple, Brian Sampson and Wendy Sampson. Meanwhile, Zane has also entered a parallel world and must now grapple with Derrick's life. He is seduced by Derrick's privileged world of money and power. As he begins to contend with Derrick's demons, he yearns to return to and improve his own life, yet is completely powerless to do so. As Derrick and Zane make his way through the life of the other, each of them starts to reshape his new world and in so doing discover hidden strengths that neither knew he possessed."
12538,1985,The Black Cauldron,80,6.5,Ted Berman-Richard Rich,Lloyd Alexander-David Jonas-Vance Gerry,Walt Disney Pictures-Silver Screen Partners II,Animation-Action-Adventure-Family-Fantasy-Horror,"Centuries ago, in the land of Prydain, a young man named Taran is given the task of protecting Hen Wen, a magical oracular pig, who knows the location of the mystical black cauldron. This is not an easy task, for The Evil Horned King will stop at nothing to get the cauldron."
12539,1986,The Fly / The Fly 2,,,,,,,
12540,2000,100 Girls,94,5.9,Michael Davis,Michael Davis,Dream Entertainment-Michael/Finney Productions,Comedy-Romance,"This sexy, teen-comedy is about a freshman, Matthew, at college who meets his dream girl in a dorm elevator during a blackout. He never sees her face, but instantly falls in love. In the morning, the power is restored, but the ""dream girl"" has vanished. All Matthew knows is that she lives in an all-girls dorm. He sets out on a semester-long journey to find his mystery girl amongst a hundred female suspects. Could it be Wendy? Dora? Arlene? Patty? Cynthia? Or the 95 other girls, any of whom could have been in that elevator with Matthew."
12541,1990,The Adventures of Ford Fairlane,104,6.3,Renny Harlin,Daniel Waters-James Cappe-David Arnott,Twentieth Century Fox-Silver Pictures,Action-Adventure-Comedy-Crime-Music-Mystery,"Ford ""Mr. Rock n' Roll Detective"" Fairlane is experiencing problems, and it's not with the opposite sex. One of them is that all the rock stars pay him with drum sticks, koala bears, food processors and bicycle shorts. Another one of them is that all his employers that want him to find a girl named Zuzu Petals get killed. Why didn't he become a fisherman's detective instead? A must-see for Andrew Dice Clay fans."
12542,2001,Wasabi,94,6.7,Gérard Krawczyk,Luc Besson,EuropaCorp-Samitose Productions-TF1 Films Production-Canal+-Victor Company of Japan-Destiny,Action-Drama-Comedy-Crime-Thriller,"Hubert is a French policeman with very sharp methods. After being forced to take 2 months off by his boss, who doesn't share his view on working methods, he goes back to Japan, where he used to work 19 years ago, to settle the probate of his girlfriend who left him shortly after marriage without a trace. There he mets his former colleague Momo and his daughter Yumi who he did not know was ever born. Hubert eventually finds out why his girlfriend left him and the reason becomes his and his new daughters problem."
12543,2000,Time Code,97,6.2,Mike Figgis,Mike Figgis,Screen Gems-Red Mullet Productions,Drama-Romance,"The primary story with this movie is that it is shown in four simultaneously filmed ninety-three minute single shot takes (in other words, shown in four quadrants), with the actual plot secondary. The four cameras follow the players involved, with two or more of the four cameras sometimes filming the exact same scene from different angles and thus different perspectives. The audio on each of the four quadrants is turned up and down based on which quadrant(s) the viewer should pay most attention to at any given time. The actual plot, which takes place in Hollywood, involves the pre-production by Red Mullet Productions for the movie ""Bitch from Louisiana"". The production team is in an executive meeting to discuss several aspects of the movie, including problems with one of their own, Alex Green, who has been missing in action from much of the production and this meeting. Alex's problems stem from his substance abuse and philandering, his wife Emma who is contemplating leaving him, of which he is unaware. Lester Moore, the movie's director, is also causing the producers some concern as they believe he again is using drugs against company policy. The production team is also talking about casting the role of ""The Bitch"". One actress who wants to audition is Rose, who is having an affair with Alex as a foot in the door. Rose does not officially have an audition, although she tells her controlling lover, Lauren, that's why she is going to Red Mullet's office, while she really is meeting with Alex for a tryst. Lauren, however, believes that Rose is indeed cheating on her. Through it all, Quentin, a masseuse, is present giving free massages as a means to gain Red Mullet as a corporate client. Their goings-on come to a head during a pitch meeting by visiting European actress, Ana Pauls, who is accompanied by her agent, Bunny Drysdale, and her musician boyfriend, Joey Z."
12544,2004,Peter Gabriel: Play: The Video Collection,,,,,,,
12545,1972,Sanford and Son: Season 1,,,,,,,
12546,1990,Home Alone,103,7.5,Chris Columbus,John Hughes,Hughes Entertainment-Twentieth Century Fox,Comedy-Family,"It is Christmas time and the McCallister family is preparing for a vacation in Paris, France. But the youngest in the family named Kevin got into a scuffle with his older brother Buzz and was sent to his room which is on the third floor of his house. Then, the next morning, while the rest of the family was in a rush to make it to the airport on time, they completely forgot about Kevin who now has the house all to himself. Being home alone was fun for Kevin, having a pizza all to himself, jumping on his parents' bed, and making a mess. Then, Kevin discovers about two burglars, Harry and Marv, about to rob his house on Christmas Eve. Kevin acts quickly by wiring his own house with makeshift booby traps to stop the burglars and to bring them to justice."
12547,2002,Gladiator Days: Anatomy of a Prison Murder,60,7.5,Marc Levin,,Blowback Productions,Documentary,"The story of Troy Kell, a white-supremacist convicted in Nevada at age 18 of first-degree murder and sentenced to life in prison without parole. He was later transferred to a prison in Utah, where he attacked and murdered a black inmate by stabbing him 67 times. For that crime he was convicted and sentenced to death."
12548,2003,Waisa Bhi Hota Hai,137,7.3,Shashanka Ghosh,Javed Ahmed-Shashanka Ghosh-Zunaid Memon,Impact Films,Comedy-Crime-Drama,"After being asked to leave by his Policewoman fiancee, Agni Sinha (Sandhya Mridul), Punit Sanyal (Arshad Warsi) is lying drunk on a street bench in Bombay, when he comes across a wounded man on the street, shot at by hoodlums owing allegiance to Gangleader, Gangu Tai (Pratima Kazmi). He decides to assist this male, Vishnu (Prashant Narayanan), owing allegiance to yet another crime boss, Ganpat Mohite (Anant Jog). Vishnu and Punit become close friends, though Punit is not asked to participate in any criminal activity. When Ganpat finds out that Punit's brother was a police informer, and his fiancee a policewoman, he instructs Vishnu to kill Punit, but Vishnu does not do so, and Ganpat issues instructions to have him killed also. In the meantime, Punit is abducted by Gangu Tai and held there. Gangu has taken a liking to Punit, as he reminds her of her son. When the police start an investigation against Gangu Tai, they assign Agni to go and arrest her, which she does. When Gangu is released, she herself has Agni abducted and tied up in her hide-out. Agni is shocked when she finds out that Punit is involved with some of Bombay's most wanted, and now Punit must decide to stay with Vishnu, Gangu, and Ganpat or else go back to Agni, if so, will the three permit him to do so?"
12549,1999,Drop Dead Gorgeous,97,6.6,Michael Patrick Jann,Lona Williams,New Line Cinema-Capella International-KC Medien,Comedy-Romance-Thriller,"In a small Minnesota town, the annual beauty pageant is being covered by a TV crew. Former winner Gladys Leeman wants to make sure her daughter follows in her footsteps. Explosions, falling lights, and trailer fires prove that. As the Leemans are the richest family in town the police are pretty relaxed about it all. Despite everything, main rival (but nice) Amber Atkins won't be stopped. There could well be more death and disappointment to come."
12550,1997,Border,176,7.9,J.P. Dutta,J.P. Dutta-O.P. Dutta,J.P. Films,Action-Drama-History-War,"The year is 1971 when the Pakistani Army is at war with the Indian Soldiers. The Indian battalion is posted in Longewala region in Punjab and are just 150 in number while the Pakistani Army consists of 2000 armed soldiers with tanks. This movie is a landmark in Hindi Cinema and watch how the drama unfolds and the Indian soldiers fight for the pride of their motherland. Commendable performances from Jackie Shroff, Sudesh Berry, Sunil Shetty and Sunny Deol and excellent acting by Akshay Khanna."
12551,1999,Lush,,,,,,,
12552,1992,Shadows and Fog,,,,,,,
12553,2000,Legend of Loch Lomond: IMAX,,,,,,,
