id,year,title,Runtime,Rating,Directors,Writers,Production companies,Genres
1373,1993,The Program,112,6.4,David S. Ward,David S. Ward-Aaron Latham,Touchstone Pictures-The Samuel Goldwyn Company,Action-Drama-Romance-Sport
1374,2004,Profile of a Serial Killer,106,6.4,Renny Harlin,Wayne Kramer-Wayne Kramer-Kevin Brodbin,Dimension Films-Intermedia Films-Outlaw Productions-Avenue Pictures-Weed Road Pictures-Mindhunters (UK) Limited-Mindhunters Productie BV-Tonna Oy-Outlaw Victoria Productions Inc.-Egmond Film & Television,Crime-Horror-Mystery-Thriller
1375,2002,Food of Love,112,5.7,Ventura Pons,David Leavitt-Ventura Pons,42nd Street Productions S.L.-Els Films de la Rambla-FFP Media Entertainment-Televisió de Catalunya-Televisión Española-Vía Digital,Drama-Music-Romance
1376,2004,The Vicar of Dibley: 10th Anniversary Specials,,,,,,
1377,1958,The Bat / House on Haunted Hill,,,,,,
1378,2003,Breakthru Pilates Sculpt,,,,,,
1379,2003,Dancing to New Orleans,,,,,,
1380,1991,Mobile Suit Gundam: F91: The Motion Picture,,,,,,
1381,1995,Mouth to Mouth,106,6.7,Manuel Gómez Pereira,Manuel Gómez Pereira-Juan Luis Iborra-Joaquín Oristrell,Bocaboca Producciones-Sociedad General de Televisión-Sogepaq-Star Line TV Productions S.L.,Comedy-Romance
1382,2005,Jet Li and the Legend of Wong Fei Hung: Unconquered / Tiger of Canton / Southern Fist Kung Fu,,,,,,
1383,1998,God.com,87,5.9,Kai-Ming Lai,Kai Keung Lai-Kai-Ming Lai,,Crime-Mystery-Thriller
1384,1973,Walking Tall,125,7.0,Phil Karlson,Mort Briskin-Stephen Downing-John Michael Hayes,Bing Crosby Productions,Action-Biography-Crime-Drama-Thriller
1385,1972,Greaser's Palace,91,6.1,Robert Downey Sr.,Robert Downey Sr.,Greaser's Palace Ltd.,Comedy-Western
1386,2002,Video Visits: China,,,,,,
1387,1999,The Girl Next Door,82,6.2,Christine Fugate,Mel Frohman-Russ Firestone-Mel Frohman,Berns Brothers Productions-Cafe Sisters Productions,Documentary
1388,1983,Spring Symphony,103,6.2,Peter Schamoni,Peter Schamoni,Allianz Filmproduktion-Berliner Filmförderung-Peter Schamoni Film-Schweizer Fernsehen-Zweites Deutsches Fernsehen-Österreichischer Rundfunk,Biography-Music
1389,2003,Baby Neptune: Discovering Water,,7.8,Jim Janicek,Jim Janicek-Len Marino,Janicek Marino Creative,Animation-Family
1390,2005,Ben Franklin,,,,,,
1391,1993,Yanni: Live at the Acropolis,,,,,,
1392,2002,Live From Baghdad,108,7.4,Mick Jackson,Robert Wiener-Robert Wiener-Richard Chapman,HBO Films-Industry Entertainment,Drama-War
1393,1998,Mr. Murder,132,5.2,Dick Lowry,Dean R. Koontz-Stephen Tolkin,Elephant Walk Entertainment-Endemol Entertainment-Patchett Kaufman Entertainment-Pro 7,Sci-Fi-Thriller
1394,1999,Bringing Out the Dead,121,6.8,Martin Scorsese,Joe Connelly-Paul Schrader,De Fina-Cappa-Paramount Pictures-Touchstone Pictures,Drama-Thriller
1395,1963,Charade,113,8.0,Stanley Donen,Peter Stone-Peter Stone-Marc Behm,Universal Pictures-Stanley Donen Films,Comedy-Mystery-Romance-Thriller
1396,2004,Kaleido Star,25,7.6,Yoshimasa Hiraike-Jun'ichi Satô,Jun'ichi Satô-Reiko Yoshida-Reiko Yoshida,G.D.H.-Gonzo Digimation-Horipro-Medianet,Animation-Short
1397,2004,Beethoven: The Sound and the Fury,,,,,,
1398,1999,Dangerous Evidence: The Lori Jackson Story,,5.5,Sturla Gunnarsson,Ellis A. Cohen-Milton J. Shapiro-Sterling Anderson,Brayton-Carlucci Productions-Hearst Entertainment Productions-Hennessey Entertainment,Drama
1399,1984,1984,113,7.2,Michael Radford,George Orwell-Michael Radford,Umbrella-Rosenblum Films Production-Virgin Benelux-Virgin Schallplatten-Virgin,Drama-Sci-Fi
1400,2000,Britney Spears: Britney in Hawaii: Live and More,,,,,,
1401,1992,Passion Fish,135,7.5,John Sayles,John Sayles,Atchafalaya,Drama
1402,1993,Inspector Morse 28: Twilight of the Gods,,,,,,
1403,2000,Komodo,,,,,,
1404,1985,Ray Bradbury Theater,23,7.6,,Ray Bradbury-Mark Massari-John Philip Dayton,Alberta Filmworks-Atlantis Films-Ellipse Animation-Granada Television,Drama-Fantasy-Sci-Fi-Thriller
1405,1961,Cleo from 5 to 7,,,,,,
1406,1991,Hook,142,6.7,Steven Spielberg,J.M. Barrie-J.M. Barrie-James V. Hart,Amblin Entertainment-DreamWorks-TriStar Pictures,Adventure-Comedy-Family-Fantasy
1407,1921,Orphans of the Storm,150,7.8,D.W. Griffith,Adolphe d'Ennery-Eugène Cormon-D.W. Griffith,D.W. Griffith Productions,Drama-History-Romance
1408,1999,The Limey,89,7.1,Steven Soderbergh,Lem Dobbs,Artisan Entertainment,Crime-Drama-Mystery-Thriller
1409,2003,The O.C.: Season 1,,,,,,
1410,1974,Muhammad Ali: The Greatest 1964 - 74,,,,,,
1411,2001,China: The Panda Adventure: IMAX,48,6.2,Robert M. Young,Ruth Harkness-Paul Andersen-John Wilcox,San Diego Zoo-Trane-World Wildlife Fund,Drama
1412,2001,Sordid Lives,,,,,,
1413,1998,The Life and Times of Hank Greenberg,90,7.6,Aviva Kempner,Aviva Kempner,Ciesla Foundation,Documentary-Biography-Sport
1414,2003,Manhood,82,5.3,Bobby Roth,Bobby Roth,Jeffrey White Productions-Jung N Restless Productions Inc.,Comedy-Drama
1415,1933,W.C. Fields: International House,,,,,,
1416,2003,Beckett on Film,52,3.7,Pearse Lehane,Samuel Beckett-Pearse Lehane,Emdee 2000 Productions,Documentary
1417,2002,Shakedown,92,5.0,Brian Katkin,Dan Acre-Damian Akhavi-John Huckert,Califilm-New Concorde,Action-Drama
1418,2002,Inu-Yasha: The Movie 3: Swords of an Honorable Ruler,,,,,,
1419,1975,Madame Bovary,220,7.9,Rodney Bennett,Giles Cooper-Gustave Flaubert,British Broadcasting Corporation,Drama
1420,2000,Uncle Saddam,63,6.5,Joel Soler,Scott Thompson,Rive Gauche International Television,Documentary-Comedy-History-War
1421,1981,My Dinner with Andre,110,7.8,Louis Malle,Wallace Shawn-Andre Gregory,Saga Productions Inc.-The Andre Company,Biography-Comedy-Drama
1422,2005,Casino: 10th Anniversary Edition: Bonus Material,,,,,,
1423,1999,Blind Date: Freaks & Weirdos Uncensored,,,,,,
1424,2000,Beautiful Joe,98,5.9,Stephen Metcalfe,Stephen Metcalfe,Stratosphere Entertainment-Capitol Films-Beautiful Films-Haft Entertainment-Pacific Motion Pictures,Comedy-Drama
1425,1987,No Way Out,114,7.1,Roger Donaldson,Kenneth Fearing-Robert Garland-Robert Garland,Orion Pictures,Action-Crime-Drama-Mystery-Romance-Thriller
1426,1994,Go Fish,83,5.6,Rose Troche,Guinevere Turner-Rose Troche,Can I Watch-Islet-KPVI-Killer Films-The Samuel Goldwyn Company,Comedy-Drama-Romance
1427,1998,Sweepers,96,3.8,Keoni Waxman,Kevin Bernhardt-Kevin Bernhardt-Keoni Waxman,Millennium Films-Nu World Services-Martien Holdings A.V.V.-Millennium Films,Action-Adventure-Drama
1428,2003,The Recruit,115,6.6,Roger Donaldson,Roger Towne-Kurt Wimmer-Mitch Glazer,Touchstone Pictures-Spyglass Entertainment-Epsilon Motion Pictures,Action-Thriller
1429,2004,The Halfway House: Special Edition (Unrated Director's Cut),,,,,,
1430,2001,The House Next Door,,,,,,
1431,1998,Legalese,92,6.3,Glenn Jordan,Billy Ray,New Line Television,Crime-Drama-Romance
1432,1999,Ride with the Devil,138,6.8,Ang Lee,Daniel Woodrell-James Schamus,Universal Pictures-Good Machine,Drama-Romance-War-Western
1433,1942,Casablanca: Bonus Material,,,,,,
1434,1992,Are You Being Served? Again: The Complete Series,,,,,,
1435,2001,Wallace & Gromit in Three Amazing Adventures,,,,,,
1436,1939,Seabiscuit: The Lost Documentary,50,7.2,Manny Nathan,Hazel Merry Hawkins-Manny Nathan,Legend Films,Documentary
1437,1982,The Marx Brothers in a Nutshell,94,8.2,Richard Patterson,Joseph Adamson-Robert B. Weide,Jack Rollins & Charles H. Joffe Productions-Whyaduck Productions,Comedy-Documentary
1438,1999,Children of the Corn 666: Isaac's Return,82,3.7,Kari Skogland,Stephen King-Tim Sulka-John Franklin,Dimension Films-Blue Rider Pictures-Blue Rider Pictures,Horror-Mystery-Thriller
1439,2002,The Three Pickers,,,,,,
1440,2004,Overhaulin': Season 1,,,,,,
1441,1998,Stargate SG-1: Season 2,,,,,,
1442,2001,Sade: Life Promise Pride Love,,,,,,
1443,1987,21 Jump Street: Season 2,,,,,,
1444,2001,Pride FC: The Return of the Warriors,,,,,,
1445,2005,Street Fighter Alpha: Generations,45,5.9,Ikuo Kuwana,Mitsuhiro Yamada,Capcom Company-Manga Entertainment,Animation-Action-Adventure-Fantasy-Thriller
1446,1997,Waco: The Rules of Engagement,136,8.0,William Gazecki,William Gazecki-Dan Gifford-Michael McNulty,Fifth Estate Productions-SomFord Entertainment,Documentary-History
1447,2000,Gangster No. 1,103,6.8,Paul McGuigan,Johnny Ferguson-Louis Mellis-David Scinto,FilmFour-Pagoda Film-Road Movies Filmproduktion-British Screen Productions-British Sky Broadcasting (BSkyB)-Filmboard Berlin-Brandenburg (FBB)-NFH Productions-Little Bird,Crime-Drama-Thriller
1448,1999,Blue Submarine 6,,,,,,
1449,1996,The Gingko Bed,88,5.7,Je-kyu Kang,,Shin Cine Communications,Fantasy-Romance-Action
1450,1993,Geronimo: An American Legend,115,6.5,Walter Hill,John Milius-John Milius-Larry Gross,Columbia Pictures,Drama-History-Western
1451,1976,The Big Bus,88,5.6,James Frawley,Fred Freeman-Lawrence J. Cohen,Paramount Pictures,Comedy-Action
1452,2001,Perfume,106,3.7,Michael Rymer,Michael Rymer-L.M. Kit Carson,MainPix-Manifesto Films-Moonstar Entertainment-Parseghian Planco,Drama
1453,1996,Van Halen: Video Hits: Vol. 1,65,6.9,Pete Angelus-Meiert Avis-Carolyn Beug,,,Music
1454,2004,Fangoria Blood Drive,119,4.6,BC Furtney-Rob Graydon-Chip Gubera,BC Furtney-Christopher P. Garetano-Chip Gubera,Koch Vision-Orson Entertainment Ltd.,Horror
1455,2003,Belly of the Beast,91,4.7,Siu-Tung Ching,Thomas Fenton-Steven Seagal-James Townsend,Century Time (H.K.) Ltd.-GFT Beast Films Inc.-GFT Entertainment-Salon Films-Studio Eight Beast Ltd.-Studio Eight Productions,Action
1456,1995,Nina Takes a Lover,,,,,,
1457,1973,The White Seal / A Cricket in Times Square,,,,,,
1458,1936,Popeye,,,,,,
1459,2001,Dark Asylum,83,4.3,Gregory Gieras,Gregory Gieras-D.B. Smith,Insane Pictures-Media Pro Pictures-Shoreline Entertainment,Thriller-Horror
1460,1996,Soul of the Game,94,7.4,Kevin Rodney Sullivan,Gary Hoffman-David Himmelstein,Gary Hoffman Productions-Home Box Office-Mike Medavoy Productions-Papazian-Hirsch Entertainment International,Drama-History-Sport
1461,2002,Gravion,23,6.8,,Yûji Hosono-Atsuhiro Tomioka-Kiyoko Yoshimura,Gonzo Digimation-Imagica,Animation-Adventure-Comedy-Sci-Fi
1462,2004,Funny Ladies of British Comedy,,7.2,Duane Huey,Michelle Street,Iowa Public Television,Comedy-Documentary
1463,1982,Britannia Hospital,116,6.3,Lindsay Anderson,David Sherwin,British Lion Film Corporation-EMI Films-Film and General Productions-National Film Finance Corporation (NFFC),Comedy-Sci-Fi
1464,2001,Pistol Opera,112,6.4,Seijun Suzuki,Kazunori Itô-Takeo Kimura,DENTSU Music And Entertainment-Eisei Gekijo-Ogura Jimusyo Co.-Shochiku-TV Tokyo-Victor Company of Japan,Crime-Action-Drama
1465,2001,Hysteria: The Def Leppard Story,90,6.7,Robert Mandel,Christopher Ames-Carolyn Shelby,LS Productions-Viacom Productions,Biography-Drama-Music
1466,1969,Midnight Cowboy,113,7.9,John Schlesinger,Waldo Salt-James Leo Herlihy,Jerome Hellman Productions-Florin Productions,Drama
1467,1993,Three Musketeers,105,6.4,Stephen Herek,Alexandre Dumas-David Loughery,Walt Disney Pictures-Caravan Pictures-Wolfgang Odelga Filmproduktion GmbH-Vienna Film Financing Fund-One for All Productions,Action-Adventure-Comedy-Family-Romance
1468,1968,The Diamond Arm,,,,,,
1469,2000,Girls Can't Swim,102,5.9,Anne-Sophie Birot,Anne-Sophie Birot-Christophe Honoré,Centre National de la Cinématographie-Conseil Régional de Bretagne-Procirep-Sépia Productions-YMC Productions,Comedy-Drama
1470,2002,Bend It Like Beckham,112,6.7,Gurinder Chadha,Gurinder Chadha-Guljit Bindra-Paul Mayeda Berges,Kintop Pictures-Film Council-Filmförderung Hamburg-British Sky Broadcasting (BSkyB)-British Screen Productions-Helkon Media-The Works-Scion Films-Bend It Films-Roc Media-Road Movies Filmproduktion-Future Films-Redbus Pictures,Comedy-Drama-Romance-Sport
1471,2004,Voices of Iraq,80,6.4,People of Iraq-Martin Kunert,,Booya Studios-Voices of Freedom LLC,Documentary-War
1472,2004,The Stink of Flesh,,5.2,Richard Griffin-Jeremy Owen,,Exhilarated Despair Productions,Documentary
1473,2004,Sesame Street: Learning About Letters,,,,,,
1474,2003,Classic Country Comedy,,,,,,
1475,1990,Brain Dead,85,6.0,Adam Simon,Charles Beaumont-Adam Simon-Charles Beaumont,Concorde Pictures-New Horizons,Horror-Mystery-Sci-Fi-Thriller
1476,2004,Six Feet Under: Season 4,,,,,,
1477,1969,Aradhana,169,7.7,Shakti Samanta,Sachin Bhowmick-Ramesh Pant,United Producers-Shakti Films,Drama-Musical-Romance
1478,2002,Colin's Sleazy Friends Rocks,,,,,,
1479,2002,Man on the Train,90,7.2,Patrice Leconte,Claude Klotz,Ciné B-Zoulou Films-Rhône-Alpes Cinéma-FCC-Tubedale Films-Pandora Filmproduktion-Cinema Parisien-Media Suits-Film Council-Centre National de la Cinématographie (CNC)-Canal+-Eurimages-Sofica Sofinergie 5-Natexis Banques Populaires Images 2,Crime-Drama-Thriller
1480,1988,Cold Summer of 1953,101,8.0,Aleksandr Proshkin,Edgar Dubrovsky,Mosfilm,Action-Crime-Drama-Thriller
1481,2001,Porn Star: The Legend of Ron Jeremy,77,6.4,Scott J. Gill,Scott J. Gill,District Films-Maelstrom Entertainment-Radius Productions,Documentary-Biography
1482,2003,Beyond Borders,127,6.5,Martin Campbell,Caspian Tredwell-Owen,Mandalay Pictures-CP Medien AG-Camelot Pictures-Mel's Cite du Cinema,Adventure-Drama-Romance-War
1483,2003,Interstella 5555 (Daft Punk),,,,,,
1484,1958,Fiend Without a Face,75,6.3,Arthur Crabtree,Herbert J. Leder-Amelia Reynolds Long,Producers Associates-Amalgamated Productions,Horror-Sci-Fi
1485,2002,Leaving Metropolis,89,6.2,Brad Fraser,Brad Fraser-Brad Fraser,Film Tonic-Realtime Films Inc.-Original Pictures-Téléfilm Canada-Manitoba Film & Sound-CanWest Western Independent Producers Fund-The Movie Network-Movie Central-Chum Television,Comedy-Drama-Romance
1486,2004,King Arthur: The Truth Behind the Legend,,,,,,
1487,2003,Infernal Affairs III,118,7.0,Andrew Lau Wai-Keung-Alan Mak,Alan Mak-Felix Chong-Felix Chong,Media Asia Films-Tianjin Film Studio-Eastern Dragon Film Co. Ltd.-CMC Group-Basic Pictures-China Film Co-Production Corporation,Action-Crime-Drama-Thriller
1488,1999,King of the Hill: Season 4,,,,,,
1489,2002,American Adobo,22,3.1,,Howard Busgang-Howard Nemetz-Shawn Thompson,,Comedy
1490,2001,Knight Hunters Eternity,,,,,,
1491,2004,Dream Theater: Live at Budokan,180,9.2,Yuji Morihara-Mike Portnoy,,Pushhd,Music
1492,1984,Rhinestone,111,3.8,Bob Clark,Phil Alden Robinson-Phil Alden Robinson-Sylvester Stallone,Twentieth Century Fox,Comedy-Music
1493,1980,John Lee Hooker: Live in Montreal: Montreal Jazz Festival,,,,,,
1494,2000,Appalachian Journey: Yo-Yo Ma/Edgar Meyer/Mark O'Connor,,,,,,
1495,2001,Alias: Season 1,,,,,,
1496,2002,Korn: Kornography: Unauthorized Biography,,,,,,
1497,2003,Red Water,92,4.2,Charles Robert Carner,J.D. Feigelson-Chris Mack,Sony Pictures Television,Action-Adventure-Crime-Drama-Horror-Sci-Fi-Thriller
1498,2001,Johnny Winter: Pieces and Bits,78,,Teddy Slatus,,,Music
1499,2000,FLCL,151,8.3,Kazuya Tsurumaki-Masahiko Ôtsuka-Shôji Saeki,Yoji Enokido-Kazuya Tsurumaki,Gainax-Production I.G.-Star Child Recording,Animation-Action-Comedy-Drama-Fantasy-Sci-Fi
1500,1987,Miss Marple: Collection 2,,,,,,
1501,1980,Forbidden Zone,74,6.8,Richard Elfman,Richard Elfman-Richard Elfman-Matthew Bright,Hercules Films Ltd.,Comedy-Fantasy-Musical
1502,1999,Superstar,81,5.1,Bruce McCulloch,Molly Shannon-Steve Koren,Broadway Pictures-SNL Studios,Comedy-Romance
1503,1997,The Boxer,113,7.1,Jim Sheridan,Jim Sheridan-Terry George,Universal Pictures-Hell's Kitchen Films-Hell's Kitchen Films,Drama-Romance-Sport
1504,2001,Light of My Eyes,113,7.0,Giuseppe Piccioni,Umberto Contarello-Umberto Contarello-Linda Ferri,Albachiara-Rai Cinema-Ministero per i Beni e le Attività Culturali (MiBAC),Drama
1505,1964,Hamlet,140,8.4,Grigoriy Kozintsev,Grigoriy Kozintsev-Boris Pasternak-William Shakespeare,Lenfilm Studio-Pervoe Tvorcheskoe Obedinenie,Drama
1506,2004,Paranoia Agent,,8.1,Satoshi Kon-Takuji Endo-Hiroshi Hamazaki,Satoshi Kon-Seishi Minakami-Tomomi Yoshino,Asmik Ace Entertainment-Madhouse-Tohokushinsha Film Corporation-WOWOW,Animation-Drama-Horror-Mystery
1507,1999,The Hunchback of Notre Dame,,,,,,
1508,2000,Hand Maid May,,6.8,,Yuu Kawamorita-Jûzô Mutsuki-Kazuki Matsui,,Animation-Adventure-Comedy-Sci-Fi
1509,2002,National Lampoon's Van Wilder,92,6.4,Walt Becker,Brent Goldberg-David Wagner,Myriad Pictures-In-Motion AG Movie & TV Productions-World Media Fonds V (WMF V)-Tapestry Films,Comedy-Romance
1510,2002,Faith Hill: When the Lights Go Down,55,,Gary Hal Vorson,Jeffrey Klarik,,Music
1511,2000,On the Beach,195,7.1,Russell Mulcahy,Nevil Shute-John Paxton-David Williamson,Coote Hayes Productions-Edwards/Sullivan Productions-Showtime Networks-Southern Star Entertainment-The Australian Film Commission,Drama-Sci-Fi
1512,2003,Blue's Clues: Blue's Room: Beyond Your Wildest Dreams!,,,,,,
1513,1962,The Twilight Zone: Vol. 42,,,,,,
1514,1987,Amazon Women on the Moon,85,6.2,Joe Dante-Carl Gottlieb-Peter Horton,Michael Barrie-Jim Mulholland,Universal Pictures,Comedy-Sci-Fi
1515,2001,Jane Doe,91,4.7,Kevin Alyn Elders,Kevin Alyn Elders,USA Films-USA Network-Winchester Entertainment PLC-Zinc Entertainment Inc.,Action-Thriller
1516,2000,Peril,92,4.7,David Giancola,David Giancola,Edgewood Studios,Thriller
1517,1999,Celebrities: Caught on Camera,53,3.5,,Ben Russell,Papparazzi TV Inc.,Documentary
1518,1995,Casper,100,6.1,Brad Silberling,Joseph Oriolo-Sherri Stoner-Deanna Oliver,Universal Pictures-Amblin Entertainment-The Harvey Entertainment Company-Universal Cartoon Studios,Comedy-Family-Fantasy
1519,1981,Inseminoid,93,3.7,Norman J. Warren,Nick Maley-Gloria Maley,Jupiter Film Productions,Horror-Sci-Fi
1520,2003,Suze Orman: The Laws of Money,,,,,,
1521,1955,The Trouble With Harry,99,7.1,Alfred Hitchcock,John Michael Hayes-Jack Trevor Story,Alfred J. Hitchcock Productions,Comedy-Mystery
1522,1968,Teorema,98,7.3,Pier Paolo Pasolini,Pier Paolo Pasolini,Aetos Produzioni Cinematografiche,Drama-Mystery
1523,1981,Dynasty: Season 1,,,,,,
1524,1985,American Ninja,95,5.4,Sam Firstenberg,Paul De Mielche-Avi Kleinberger-Gideon Amir,Cannon Group-Golan-Globus Productions,Action-Adventure-Romance
1525,2001,Monkeybone,93,4.7,Henry Selick,Kaja Blackley-Sam Hamm,Twentieth Century Fox-1492 Pictures-Twentieth Century Fox Animation-Twitching Image Studio,Animation-Comedy-Fantasy
1526,1982,The Pirate Movie,105,5.1,Ken Annakin,W.S. Gilbert-Trevor Farrant,Joseph Hamilton International Productions,Adventure-Comedy-Musical-Romance
1527,2003,Hawaiian Paradise,,,,,,
1528,1992,Radio Flyer,114,6.9,Richard Donner-David Mickey Evans,David Mickey Evans,Columbia Pictures-Stonebridge Entertainment-Donner/Shuler-Donner Productions,Drama
1529,2003,Hustle and Heat,88,4.4,Craig Ross Jr.,Duane Martin-Jay Wolcott,Strange Fruit Films,Action-Crime-Music-Romance-Thriller
1530,2002,Rose Red,254,6.8,Craig R. Baxley,Stephen King,Greengrass Productions-Victor Television Productions-Mark Carliner Productions-American Broadcasting Company (ABC),Horror-Mystery-Thriller
1531,1996,The Crucible,124,6.8,Nicholas Hytner,Arthur Miller-Arthur Miller,Twentieth Century Fox,Drama-History
1532,1992,Mo' Money,89,5.5,Peter MacDonald,Damon Wayans,Columbia Pictures-Wife 'n' Kids,Action-Comedy-Crime-Romance-Thriller
1533,1993,Darr,178,7.8,Yash Chopra,Honey Irani-Honey Irani-Javed Siddiqui,Yash Raj Films,Drama-Romance-Thriller
1534,2005,Thomas & Friends: Thomas' Sodor Celebration,,,,,,
1535,2005,Pooh's Heffalump Halloween Movie,67,6.7,Saul Blinkoff-Elliot M. Bour,Brian Hohlfeld-Evan Spiliotopoulos-A.A. Milne,Disneytoon Studios,Animation-Comedy-Family-Fantasy-Musical
1536,1988,Fresh Horses,105,5.0,David Anspaugh,Larry Ketron,Weintraub Entertainment Group,Drama
1537,2002,Yes Nurse! No Nurse!,100,6.8,Pieter Kramer,Harry Bannink-Frank Houtappels-Pieter Kramer,Bos Bros. Film & TV Productions,Comedy-Musical
1538,1999,Century of the Dragon,90,6.5,Clarence Yiu-leung Fok,Jing Wong,Jing's Production,Action-Crime-Thriller
1539,2002,Taboo: Season 1,,,,,,
1540,1975,The Devil's Rain,86,4.8,Robert Fuest,Gabe Essoe-James Ashton-Gerald Hopman,Sandy Howard Productions,Horror
1541,2000,Battle Queen 2020,,,,,,
1542,1993,Sleepless in Seattle,105,6.8,Nora Ephron,Jeff Arch-Nora Ephron-David S. Ward,TriStar Pictures,Comedy-Drama-Romance
1543,1995,Nick of Time,90,6.3,John Badham,Patrick Sheane Duncan,Paramount Pictures,Action-Crime-Drama-Thriller
1544,1976,The Duchess & The Dirtwater Fox,103,5.7,Melvin Frank,Melvin Frank-Barry Sandler-Jack Rose,20th Century Fox Film Corporation,Comedy-Western
1545,1998,The Dimension Travelers,,,,,,
1546,2003,Second Nature,90,5.4,Ben Bolt,E. Max Frye,TNT-El Dorado Pictures-Granada Entertainment,Drama-Mystery-Sci-Fi-Thriller-War
1547,1939,The Women,133,8.0,George Cukor,Clare Boothe Luce-Anita Loos-Jane Murfin,Metro-Goldwyn-Mayer (MGM),Comedy-Drama
1548,1998,The Shanghai Affairs,90,6.0,Donnie Yen,,Sam Po Entertainment Production Co.,Action-Drama-Romance
1549,1997,Deja Vu,117,7.1,Henry Jaglom,Victoria Foyt-Henry Jaglom,Jagtoria Films-Revere Entertainment-The Rainbow Film Company,Drama-Romance
1550,2004,Call Me: The Rise and Fall of Heidi Fleiss,84,5.6,Charles McDougall,Norman Snider,Nomadic Pictures-Once Upon a Time Films,Crime-Drama-Romance
1551,2004,Spider-Man 2: Bonus Material,,,,,,
1552,1983,Black Adder,,,,,,
1553,1995,Persuasion,,,,,,
1554,1979,The 5th Musketeer,116,5.4,Ken Annakin,Alexandre Dumas-David Ambrose-George Bruce,S&T-Film Berlin-Sascha Filmverleih,Action-Adventure-Romance
1555,1953,The Little Fugitive,80,7.6,Ray Ashley-Morris Engel-Ruth Orkin,Ray Ashley-Morris Engel-Ruth Orkin,Little Fugitive Production Company,Drama-Family
1556,1932,A Farewell to Arms,80,6.5,Frank Borzage,Benjamin Glazer-Oliver H.P. Garrett-Ernest Hemingway,Paramount Pictures,Drama-Romance-War
1557,2002,Dolls,114,7.7,Takeshi Kitano,Takeshi Kitano,Bandai Visual Company-Office Kitano-TV Tokyo-Tokyo FM Broadcasting Co.,Drama-Romance
1558,1990,Rocky V,104,5.2,John G. Avildsen,Sylvester Stallone,United Artists-Star Partners III Ltd.,Drama-Sport
1559,1998,AFI's 100 Years,138,7.1,Gary Smith-Dann Netter,Fred A. Rappoport-Marty Farrell-Gary Smith,American Film Institute-Smith-Hemion Productions,Documentary
1560,2004,Disney Princess Stories: Vol. 1: A Gift From the Heart,60,5.9,Benjamin Zev,Barbara M. Layman,Walt Disney Home Entertainment,Animation-Family
1561,2003,American Wedding,96,6.3,Jesse Dylan,Adam Herz-Adam Herz,Universal Pictures-Zide-Perry Productions-LivePlanet-Loumolo & Co.,Comedy
1562,2005,Chupacabra Terror,88,3.4,John Shepphird,Steve Jankowski-John Shepphird,Sci Fi Pictures-Regent Entertainment,Horror
1563,1992,To Grandmother's House We Go,96,5.9,Jeff Franklin,Jeff Franklin-Boyd Hale,Green/Epstein Productions-Jeff Franklin Productions-Lorimar Television,Adventure-Family-Comedy
1564,1966,The Rare Breed,97,6.4,Andrew V. McLaglen,Ric Hardman,Universal Pictures,Comedy-Drama-Romance-Western
1565,2004,Sarah Brightman Special: Harem: A Desert Fantasy,59,8.3,Rudi Dolezal-Hannes Rossacher,Rudi Dolezal-Hannes Rossacher,DoRo Produktion-Neue Sentimental Film-Schiwago Film,Music
1566,1996,Once a Thief,92,5.4,John Woo,Glenn Davis-William Laurin,Alliance Communications Corporation-CanWest Global Television Network-NDG Productions-WCG Entertainment Productions,Action-Crime-Thriller
1567,1981,Time Masters,,,,,,
1568,2003,In the City,110,6.9,Cesc Gay,Tomàs Aragay-Cesc Gay,Canal+ España-Generalitat de Catalunya - Institut Català de les Indústries Culturals-ICF Institut Català de Finances-Instituto de Crédito Oficial-Instituto de la Cinematografía y de las Artes Audiovisuales-MEDIA Programme of the European Union-Messidor Films-Televisió de Catalunya-Televisión Española,Drama-Romance
1569,2000,The Bogus Witch Project,85,1.8,Victor Kargan-Steve Agee-Kelly Aluise,Sam Jaffe,,Comedy
1570,1999,School's Out,93,5.1,Robert Sigl,Kai Meyer,RTL,Horror-Mystery-Thriller
1571,1982,Poltergeist,114,7.4,Tobe Hooper,Steven Spielberg-Michael Grais-Mark Victor,Metro-Goldwyn-Mayer (MGM)-Amblin Entertainment-SLM Production Group,Horror-Thriller
1572,1973,Doctor Who: Carnival of Monsters,24,7.8,Barry Letts,Robert Holmes-Sydney Newman,,Adventure-Drama-Family-Sci-Fi
1573,1999,The Omega Code,100,3.5,Robert Marcarelli,Stephan Blinn-Hollis Barton,Code Productions-Eclipse Catering-Gener8Xion Entertainment-TBN Films,Action-Adventure-Fantasy-Sci-Fi-Thriller
1574,1965,Dr. Goldfoot and the Bikini Machine,88,5.1,Norman Taurog,Elwood Ullman-Robert Kaufman-James H. Nicholson,American International Pictures (AIP),Comedy-Sci-Fi
1575,2003,Muddy Waters Can't Be Satisfied,,7.7,Robert Gordon-Morgan Neville,,American Masters-Eagle Rock Entertainment-WNET Channel 13 New York-Wellspring Media,Documentary-Biography
1576,2004,Phir Milenge,142,6.3,Revathy,Atul Sabharwal,Percept Picture Company,Drama
1577,2005,National Geographic: Predators at War,,,,,,
1578,1995,Nine Months,103,5.5,Chris Columbus,Patrick Braoudé-Chris Columbus,Twentieth Century Fox-1492 Pictures,Comedy-Romance
1579,2004,Shaolin Ulysses: Kung Fu Monks in America,,,,,,
1580,1987,City on Fire,105,7.1,Ringo Lam,Ringo Lam-Sai-Shing Shum-Jack Maeby,Cinema City,Action-Crime-Drama
1581,1997,Twilight of the Golds,,,,,,
1582,1990,Stephen King's It!,,,,,,
1583,2004,Moog,72,6.2,Hans Fjellestad,Hans Fjellestad,ZU33,Documentary-History-Music
1584,1988,Rammstein: Live Aus Berlin,,,,,,
1585,2001,Joy Ride,97,6.6,John Dahl,Clay Tarver-J.J. Abrams,Regency Enterprises-Epsilon Motion Pictures-New Regency Pictures-Bad Robot-LivePlanet,Mystery-Thriller
1586,1930,Marihuana / Assassin of Youth / Reefer Madness,,,,,,
1587,1962,Harakiri,133,8.7,Masaki Kobayashi,Shinobu Hashimoto-Yasuhiko Takiguchi-Yasuhiko Takiguchi,Shochiku,Action-Drama-History
1588,1997,Revolutionary Girl Utena,24,8.1,,Dan Green-Yoji Enokido-Kunihiko Ikuhara,J.C. Staff-TV Tokyo-Yomiko,Animation-Comedy-Drama-Fantasy-Romance-Thriller
1589,1988,Shoot to Kill,110,6.8,Roger Spottiswoode,Harv Zimmel-Harv Zimmel-Michael Burton,Touchstone Pictures-Silver Screen Partners III-Century Park Pictures,Action-Adventure-Crime-Drama-Thriller
1590,2001,Life as a House,125,7.5,Irwin Winkler,Mark Andrus,Winkler Films,Drama
1591,1988,Count Duckula: Season 1,,,,,,
