id,year,title,Runtime,Rating,Directors,Writers,Production companies,Genres
8915,1991,Terminator 2: Extreme Edition,137,8.5,James Cameron,James Cameron-William Wisher,Carolco Pictures-Pacific Western-Lightstorm Entertainment-Canal+-T2 Productions,Action-Sci-Fi
8916,1984,Beat Street,105,6.5,Stan Lathan,Steven Hager-Andrew Davis-David Gilbert,Orion Pictures,Drama-Music
8917,1972,Night Call Nurses,78,4.5,Jonathan Kaplan,George Armitage-Danny Opatoshu,New World Pictures,Thriller
8918,2004,Out of Reach,86,4.0,Po-Chih Leong,Trevor Miller-James Townsend,Franchise Pictures-Epsilon Motion Pictures,Action-Crime-Drama-Romance-Thriller
8919,1999,Cardcaptor Sakura,80,7.4,Morio Asaka-Terry Klassen,Jennifer Pertsch-Jennifer Pertsch-Nanase Ôkawa,Bandai Visual Company-Madhouse-NHK Enterprises-NHK-Nelvana-Ocean Group-Shelty-Voice Box Productions,Animation-Adventure-Family-Fantasy-Thriller
8920,1988,Tapeheads,93,5.7,Bill Fishman,Bill Fishman-Peter McCarthy-Jim Herzfeld,De Laurentiis Entertainment Group-Front Films-NBC Productions-Pacific Arts Video,Comedy-Music
8921,2004,Steve-O: Gross Misconduct,,,,,,
8922,2003,A Family Affair,,,,,,
8923,1952,Jack & the Beanstalk,70,6.1,Jean Yarbrough,Nathaniel Curtis-Pat Costello,Exclusive Productions Inc.,Comedy-Family-Fantasy-Musical-Romance
8924,2002,Long Time Dead,94,4.9,Marcus Adams,Marcus Adams-Eitan Arrusi-Chris Baker,Working Title Films-Film Council-WT2 Productions-Midfield Films-StudioCanal-Canal+,Horror-Thriller
8925,1948,The Treasure of the Sierra Madre: Bonus Material,,,,,,
8926,1975,Alice Cooper: Welcome to My Nightmare,84,7.5,David Winters,Alan Rudolph,Dabill Productions-Tommy J. Productions-Winters Hollywood Entertainment Holdings Corporation,Horror-Music
8927,2000,Twelve Nights,92,6.6,Oi Wah Lam,Oi Wah Lam,Golden Harvest Company-Golden Harvest Pictures,Drama-Romance
8928,2002,Snow Dogs,99,5.1,Brian Levant,Jim Kouf-Tommy Swerdlow-Michael Goldberg,Walt Disney Pictures-Kerner Entertainment Company-Galapagos Productions-Winterdance Productions Ltd.,Adventure-Comedy-Family-Sport
8929,2003,Winsor McCay: The Master Edition,,,,,,
8930,1995,Canadian Bacon,91,5.9,Michael Moore,Michael Moore,Dog Eat Dog Films-Gramercy Pictures-Maverick Picture Company-Polygram Filmed Entertainment-Propaganda Films,Comedy
8931,1998,Nautilus,,,,,,
8932,1949,Tokyo Joe,88,6.4,Stuart Heisler,Steve Fisher-Walter Doniger-Cyril Hume,Santana Pictures Corporation,Crime-Drama-Film-Noir-Thriller
8933,1952,Ikiru: Bonus Material,,,,,,
8934,2003,Johnny Cash: Hurt: A Film by Mark Romanek,,,,,,
8935,1992,A Touch of Frost: Season 1,,,,,,
8936,1997,Bram Stoker's The Mummy,,,,,,
8937,2001,Maya,,,,,,
8938,1994,Exotica,103,7.1,Atom Egoyan,Atom Egoyan,Alliance Entertainment-Ego Film Arts-Miramax-Ontario Film Development Corporation-Téléfilm Canada,Drama
8939,1990,A Show of Force,95,5.2,Bruno Barreto,Anne Nelson-Evan Jones-John Strong,Forna Productions-Golden Harvest Company-Paramount Pictures,Drama-Thriller
8940,2000,Felicity: Season 3,,,,,,
8941,1986,Dio: Sacred Heart,,,,,,
8942,2004,Species III,111,4.2,Brad Turner,Dennis Feldman-Ben Ripley,FGM Entertainment-Metro-Goldwyn-Mayer,Horror-Sci-Fi
8943,1993,Inspector Morse 7: Last Bus to Woodstock,,,,,,
8944,2005,Disney Princess Sing-Along Songs: Enchanted Tea Party,34,7.2,,Walt Disney,,Animation-Short
8945,1991,Once Upon a Time in China,134,7.4,Hark Tsui,Yiu-ming Leung-Elsa Tang-Hark Tsui,Golden Harvest Company-Film Workshop,Action-Adventure-Biography-Drama-History
8946,1987,Blind Chance,114,8.0,Krzysztof Kieslowski,Krzysztof Kieslowski,P.P. Film Polski,Drama
8947,2001,Deep Purple: Perihelion,,,,,,
8948,1997,Slayers: Premium,,,,,,
8949,1970,The Wizard of Gore,95,5.5,Herschell Gordon Lewis,Allen Kahn,Mayflower Pictures,Horror
8950,1936,King of the Pecos,54,6.1,Joseph Kane,Bernard McConville-Dorrell McGowan-Stuart E. McGowan,Republic Pictures,Western
8951,1959,Floating Weeds,119,8.0,Yasujirô Ozu,Yasujirô Ozu-Kôgo Noda-Tadao Ikeda,Daiei Studios,Drama
8952,2001,Soulkeeper,105,5.2,Darin Ferriola,Darin Ferriola,One-Tu-Three Productions Inc.,Action-Adventure-Comedy-Fantasy-Horror-Sci-Fi
8953,2003,MTV Video Music Awards Collection: Rock,,,,,,
8954,2002,The Rookie,127,7.0,John Lee Hancock,Mike Rich,98 MPH Productions-Gran Via-Walt Disney Pictures,Drama-Family-Sport
8955,1997,Twilight of the Dark Master,50,5.5,Akiyuki Shinbo,Duane Dell'Amico-Saki Okuse-Tatsuhiko Urahata,Goodhill Vision-Madhouse-Toei Animation-Toei Video Company-Tristone Entertainment Inc.,Animation-Fantasy
8956,2003,Sheryl Crow: C'mon America 2003,120,8.1,Martyn Atkins,,A&M Records-Parallel 28 Equipe-W Management,Documentary-Music
8957,1955,Battle Cry,149,6.6,Raoul Walsh,Leon Uris-Leon Uris,Warner Bros.,Drama-Romance-War
8958,2004,Bill Engvall: Here's Your Sign,72,7.4,Michael Drumm,Bill Engvall,Image Entertainment,Comedy
8959,2003,WWE: Bad Blood 2003,,6.5,Kevin Dunn,,,Action-Sport
8960,1989,Crimes and Misdemeanors,104,7.9,Woody Allen,Woody Allen,Jack Rollins & Charles H. Joffe Productions,Comedy-Drama
8961,1966,Andrei Rublev,205,8.2,Andrei Tarkovsky,Andrey Konchalovskiy-Andrei Tarkovsky,Mosfilm-Tvorcheskoe Obedinienie Pisateley i Kinorabotnikov,Biography-Drama-History
8962,2001,Heaven: Our Eternal Home,,,,,,
8963,2004,The Last King,,,,,,
8964,2003,Trailer Park Boys: Season 4,,,,,,
8965,2004,The Good,,,,,,
8966,2003,Pieces of April,80,7.1,Peter Hedges,Peter Hedges,United Artists-IFC Productions-InDigEnt-Kalkaska Productions-Well Done Productions,Comedy-Drama
8967,1978,Dead Kennedys: The Early Years Live,,,,,,
8968,1975,A Dog of Flanders,24,8.2,,Toyohiro Andô-Tsunehisa Itô-Takayuki Kase,Nippon Animation Co.-Zuiyo,Animation
8969,2000,The Sid Caesar Collection: Creating the Comedy,72,6.4,,,Creative Light Entertainment,Documentary-Family-Comedy
8970,2003,Little House on the Prairie: As Long as We Are Together,,,,,,
8971,1975,"Hill ""Halfon"" Doesn't Answer",,,,,,
8972,2000,The Photographer,91,5.4,Jeremy Stein,Jeremy Stein,The Photographer Company LLC,Comedy-Drama
8973,2004,The Spartans,175,8.1,Tim Kirby-Melanie Archer,Bettany Hughes,,Documentary-History
8974,1999,The Legend of Black Heaven,75,6.0,,Naruhisa Arakawa-Hiroki Hayashi-Hiroshi Ônogi,A.P.P.P.-Anime International Company,Animation-Action-Adventure-Comedy-Music-Sci-Fi
8975,1997,Dragon Ball Z: Vol. 2: The Saiyans,,,,,,
8976,1950,Harvey,104,8.0,Henry Koster,Mary Chase-Mary Chase-Oscar Brodney,Universal International Pictures (UI),Comedy-Drama-Fantasy
8977,1955,The Ladykillers,91,7.8,Alexander Mackendrick,William Rose-William Rose-Jimmy O'Connor,Ealing Studios-Michael Balcon Productions,Comedy-Crime
8978,2000,Choke,,,,,,
8979,1992,AC/DC: Live at Donington,120,8.5,David Mallet,,Leidseplein Presse-Serpent Films Productions,Documentary-Music
8980,1950,Cheaper by the Dozen,86,7.1,Walter Lang,Lamar Trotti-Frank B. Gilbreth Jr.-Ernestine Gilbreth Carey,Twentieth Century Fox,Comedy-Drama-Family
8981,2000,The Nutty Professor II: The Klumps,,,,,Buena Vista Television,Talk-Show
8982,2003,Scooby-Doo and the Legend of the Vampire,72,6.6,Scott Jeralds,Mark Turosz,Hanna-Barbera Productions-Warner Bros. Animation,Animation-Adventure-Comedy-Family-Music-Mystery
8983,1980,City of Women,139,7.0,Federico Fellini,Federico Fellini-Bernardino Zapponi-Federico Fellini,Opera Film Produzione-Gaumont,Comedy-Drama-Fantasy
8984,1956,And God Created Woman,95,6.3,Roger Vadim,Roger Vadim-Raoul Lévy,Cocinor-Iéna Productions-Union Cinématographique Lyonnaise,Drama-Romance
8985,1995,Houseguest,113,6.0,Randall Miller,Michael J. Di Gaetano-Lawrence Gay,Hollywood Pictures-Caravan Pictures,Comedy
8986,2004,Garfield as Himself,,,,,,
8987,1999,Universal Soldier: The Return,83,4.2,Mic Rodgers,Richard Rothstein-Christopher Leitch-Dean Devlin,Baumgarten-Prophet Entertainment-IndieProd Company Productions-Long Road Entertainment,Action-Sci-Fi
8988,1960,Frank Sinatra Show: Welcome Home Elvis,60,7.2,Richard Dunlap,John Bradford,Hobart Productions,Music-Talk-Show
8989,2001,Save the Last Dance,112,6.2,Thomas Carter,Duane Adler-Duane Adler-Cheryl Edwards,Cort/Madden Productions-MTV Films,Drama-Music-Romance
8990,1976,Black and White in Color,90,7.0,Jean-Jacques Annaud,Georges Conchon-Jean-Jacques Annaud,Artco-Film-France 3 Cinéma-Reggane Films-Smart Film Produktion-Société Française de Production-Société Ivoirienne de Cinema,Comedy-Drama-War
8991,1965,Tokyo Olympiad,170,8.0,Kon Ichikawa,Kon Ichikawa-Yoshio Shirasaka-Shuntarô Tanikawa,Organizing Committee for the Games of the XVIII Olympiad-Toho Company,Documentary-Sport
8992,1995,The Cinder Path,,,,,,
8993,2005,Family Guy Presents: Stewie Griffin: The Untold Story,88,7.7,Pete Michels-Peter Shin,Seth MacFarlane-Seth MacFarlane-David Zuckerman,20th Century Fox Television-Fox Television Animation-Fuzzy Door Productions-Twentieth Century Fox Animation-Twentieth Century Fox,Animation-Adventure-Comedy
8994,2004,A Fond Kiss,104,7.1,Ken Loach,Paul Laverty,Bianca Film-Cinéart-Glasgow Film Office-Matador Pictures-Scottish Screen-Sixteen Films-Tornasol Films,Drama-Romance
8995,1999,Getting Personal,,,,,,
8996,2004,10 Tokyo Warriors,,,,,,
8997,1992,Mystery Science Theater 3000: Teenagers from Outer Space,94,8.6,Kevin Murphy,Joel Hodgson-Michael J. Nelson-Trace Beaulieu,Best Brains,Comedy-Sci-Fi
8998,1962,The Twilight Zone: Vol. 40,,,,,,
8999,2001,Solo Mia,100,6.1,Javier Balaguer,Javier Balaguer-Álvaro García Mohedano,Star Line TV Productions S.L.-Televisión Española-Troto Internaciónal-Vía Digital,Drama
9000,1996,Homeward Bound 2: Lost in San Francisco,88,5.9,David R. Ellis,Chris Hauty-Julie Hickson-Sheila Burnford,Walt Disney Pictures-City Dogs Productions,Adventure-Comedy-Family-Romance
9001,1915,Chaplin's Essanay Comedies: Vol. 3,,,,,,
9002,1998,Nostradamus: A Voice from the Past,60,5.0,,,,
9003,1980,Private Benjamin,109,6.1,Howard Zieff,Nancy Meyers-Charles Shyer-Harvey Miller,Warner Bros.,Comedy-War
9004,2003,Speedo: POV,,,,,,
9005,1987,The Principal,109,6.3,Christopher Cain,Frank Deese,TriStar Pictures-Dorica Film-ML Delphi Premier Productions,Action-Crime-Drama-Thriller
9006,2004,R.E.M.: Perfect Square,143,8.6,Julia Knowles,,Warner Vision Entertainment,Music
9007,2003,Endgame,,5.3,Giselle Fernandez,Peter Lalonde,,Action-Drama-Fantasy-Thriller-War
9008,1969,The Reivers,112,6.8,Mark Rydell,William Faulkner-Harriet Frank Jr.-Irving Ravetch,Cinema Center Films-Duo Films-Solar Productions,Comedy-Drama
9009,1981,Danger Mouse: Seasons 1 & 2,,,,,,
9010,1994,Nightfighters: The True Story of the 332nd Fighter Group -- The Tuskegee Airmen,,,,,,
9011,1997,Under the Lighthouse Dancing,94,5.8,Graeme Rattigan,David Giles-Graeme Rattigan,Silver Turtle Films,Drama
9012,2004,Dora the Explorer: Dora's Fairytale Adventure,47,5.9,,,Sesame Workshop,Animation-Adventure-Comedy-Family-Musical
9013,2000,Roughnecks: The Starship Troopers Chronicles: The Tophet Campaign,,,,,,
9014,1939,Stagecoach,96,7.9,John Ford,Ernest Haycox-Dudley Nichols-Ben Hecht,Walter Wanger Productions,Adventure-Drama-Western
9015,2004,Cruel Intentions 3,85,4.7,Scott Ziehl,Rhett Reese,Original Film-Newmarket Capital Group-Newmarket Productions,Drama
9016,1997,The Man I Love,91,6.9,Stéphane Giusti,Stéphane Giusti,Ellipse Animation-La Sept-Arte-Onya Film Production,Drama-Romance-Sport
9017,1945,Blood on the Sun,98,6.2,Frank Lloyd,Lester Cole-Nathaniel Curtis-Garrett Fort,William Cagney Productions,Drama-Romance-Thriller-War
9018,1973,The Iceman Cometh,239,7.4,John Frankenheimer,Thomas Quinn Curtiss-Eugene O'Neill,Cinévision Ltée-The American Film Theatre,Drama
9019,1993,The Ballad of Little Jo,121,6.9,Maggie Greenwald,Maggie Greenwald,Joco-PolyGram Filmed Entertainment,Drama-Romance-Western
9020,1999,Storm Catcher,95,4.3,Anthony Hickox,Bill Gucwa-Ed Masterson,Franchise Pictures-Phoenician Entertainment-Stormy Productions Inc.,Action-Thriller
9021,2000,La Ley De Herodes,,,,,,
9022,2003,Not on the Lips,115,6.4,Alain Resnais,André Barde,Arena Films-France 2 Cinéma-France 3 Cinéma-Arcade-Vega Film-Canal+-CinéCinéma-Télévision Suisse-Romande (TSR)-La Région Île-de-France-Eurimages,Comedy-Musical-Romance
9023,1997,Oz: Season 1,,,,,,
9024,1998,Shadrach,88,6.4,Susanna Styron,William Styron-Susanna Styron-Bridget Terry,Millennium Films-Tidewater Pictures Inc.,Drama
9025,1993,City Hunter,105,6.5,Jing Wong,Tsukasa Hôjô-Jing Wong,Golden Harvest Company-Golden Way Films Ltd.-Paragon Films Ltd.,Action-Comedy-Crime
9026,1968,A Midsummer Night's Dream,124,6.4,Peter Hall,William Shakespeare,Filmways Pictures-Royal Shakespeare Enterprises Ltd.,Comedy-Fantasy-Romance
9027,1986,Poltergeist II / Poltergeist III: Double Feature,,,,,,
9028,1992,Jersey Girl,95,6.1,David Burton Morris,Gina Wendkos,Interscope,Comedy-Drama-Romance
9029,1997,Nil by Mouth,128,7.4,Gary Oldman,Gary Oldman,SE8 Group-EuropaCorp,Drama
9030,1987,The Flaming Brothers,99,6.4,Tung Cho 'Joe' Cheung,Jeffrey Lau-Kar-Wai Wong,Golden Harvest Company-In-Gear Film,Action-Crime-Romance
9031,1944,Wing and a Prayer,97,6.8,Henry Hathaway,Jerome Cady-Jerome Cady-Mortimer Braus,Twentieth Century Fox,Action-Drama-War
9032,1985,Brewster's Millions,102,6.5,Walter Hill,George Barr McCutcheon-Herschel Weingrod-Timothy Harris,Universal Pictures-Davis Entertainment-Lawrence Gordon Productions-Silver Pictures,Comedy
9033,2003,Passionada,,,,,,
9034,1951,Early Summer,125,8.2,Yasujirô Ozu,Kôgo Noda-Yasujirô Ozu,Shochiku,Drama
9035,1999,Forever Mine,115,5.3,Paul Schrader,Paul Schrader,Forever Mine (UK) Limited-J&M Entertainment-Moonstar Entertainment,Crime-Drama-Romance-Thriller
9036,2003,Dead End,85,6.6,Jean-Baptiste Andrea-Fabrice Canepa,Jean-Baptiste Andrea-Fabrice Canepa,Sagittaire Films-Captain Movies,Adventure-Horror-Mystery-Thriller
9037,1970,Love Story,100,6.9,Arthur Hiller,Erich Segal,Paramount Pictures-Love Story Company,Drama-Romance
9038,2004,UFC 45: Ultimate Fighting Championship: Revolution,,,,,,
9039,2004,The Boston Red Sox: 2004 World Series Collector's Edition,,,,,,
9040,1999,The Sixth Sense: Bonus Material,,,,,,
9041,1957,Gunfight at the O.K. Corral,122,7.2,John Sturges,Leon Uris-George Scullin,Wallis-Hazen,Biography-Drama-Western
9042,1957,Paths of Glory,88,8.4,Stanley Kubrick,Stanley Kubrick-Calder Willingham-Jim Thompson,Bryna Productions,Drama-War
9043,1981,Arthur,97,6.9,Steve Gordon,Steve Gordon,Orion Pictures-Jack Rollins & Charles H. Joffe Productions,Comedy-Romance
9044,2002,Fidel,206,6.5,David Attwood,Stephen Tolkin-Georgie Anne Geyer-Robert E. Quirk,Showtime Networks,Biography-Drama
9045,1987,Howling 3: The Marsupials,94,3.2,Philippe Mora,Gary Brandner-Philippe Mora,Bancannia Holdings Pty. Ltd.,Comedy-Horror
9046,1990,Dances With Wolves: Special Edition: Bonus Material,,,,,,
9047,2002,Manor House,50,8.4,Nick Murphy-Caroline Ross-Pirie,,Channel 4 Television Corporation-Wall to Wall Television,Documentary-History-Reality-TV
9048,2003,Capturing the Friedmans,107,7.8,Andrew Jarecki,,HBO Documentary-Notorious Pictures,Documentary-Biography
9049,1997,Boogie Nights,155,7.9,Paul Thomas Anderson,Paul Thomas Anderson,New Line Cinema-Lawrence Gordon Productions-Ghoulardi Film Company,Drama
9050,2002,The Job,,,,,,
9051,1980,Caddyshack,98,7.3,Harold Ramis,Brian Doyle-Murray-Harold Ramis-Douglas Kenney,Orion Pictures,Comedy-Sport
9052,2001,Dave Matthews Band: The Videos: 1994-2001,48,8.5,Ken Fox-David Hogan-Wayne Isham,,Crush Digital Video,Music
9053,2001,The Item,,,,,,
9054,2004,The Flight of the Phoenix,113,6.1,John Moore,Lukas Heller-Scott Frank-Edward Burns,Twentieth Century Fox-Aldrich Group-Davis Entertainment-Optional Pictures,Action-Adventure-Drama-Thriller
9055,2001,Follow That Bird,,,,,,
9056,1985,Into the Night,115,6.5,John Landis,Ron Koslow,Universal Pictures,Comedy-Drama-Thriller
9057,1999,The Brutal Truth,,,,,,
9058,1980,Bronco Billy,116,6.1,Clint Eastwood,Dennis Hackin,Warner Bros.-Second Street Films,Action-Adventure-Comedy-Drama-Romance-Western
9059,1994,A Troll in Central Park,76,5.4,Don Bluth-Gary Goldman,Stu Krieger-Don Bluth-Gary Goldman,Don Bluth,Animation-Adventure-Comedy-Family-Fantasy-Musical
9060,1976,The Killer Meteors,104,5.2,Wei Lo,Lung Ku,Lo Wei Motion Picture Company,Action-Thriller
9061,1948,Rope,80,8.0,Alfred Hitchcock,Hume Cronyn-Patrick Hamilton-Arthur Laurents,Warner Bros.-Transatlantic Pictures,Crime-Drama-Mystery-Thriller
9062,1991,Madonna: Truth or Dare,120,6.2,Alek Keshishian,,Boy Toy-Miramax-Propaganda Films,Documentary-Music
9063,2004,Shura no Toki,22,7.9,,Dan Green-Marc Thompson,Studio Comet-Studio Jack,Animation-Action-Comedy-Drama-History
9064,1997,Colors Straight Up,94,7.2,Michèle Ohayon,Michèle Ohayon,Echo Pictures,Documentary
9065,1996,Sunset Park,99,5.9,Steve Gomer,Seth Zvi Rosenfeld-Kathleen McGhee-Anderson,TriStar Pictures-Daniel L. Paulson Productions-Jersey Films,Drama-Sport
9066,1979,Meteor,108,5.0,Ronald Neame,Stanley Mann-Edmund H. North-Edmund H. North,American International Pictures-Meteor Joint Venture-Palladium Productions-Shaw Brothers,Action-Drama-Sci-Fi-Thriller
9067,1994,God of Gamblers Return,126,6.8,Jing Wong,Jing Wong,Win's Movie Productions Ltd.,Action-Comedy-Drama
9068,1985,Sylvester,104,6.5,Tim Hunter,Carol Sobieski,Columbia Pictures-Rastar Pictures,Drama-Family
9069,2004,It's Alive 2: It Lives Again / It's Alive 3: Island of the Alive,,,,,,
9070,1992,Memoirs of an Invisible Man,99,6.0,John Carpenter,H.F. Saint-Robert Collector-Dana Olsen,Warner Bros.-Canal+-Regency Enterprises-Alcor Films-Cornelius Productions,Comedy-Romance-Sci-Fi-Thriller
9071,2003,Have You Heard: Jim Croce Live,70,8.7,,,,Music
9072,1997,Fierce Creatures,93,6.4,Fred Schepisi-Robert Young,John Cleese-Iain Johnstone-Terry Jones,Universal Pictures-Fish Productions-Jersey Films,Comedy
9073,2002,Dawg,83,5.0,Victoria Hochberg,Ken Hastings,Gold Circle Films,Drama-Comedy-Romance
9074,1986,Heartbreak Ridge,130,6.8,Clint Eastwood,James Carabatsos-Dennis Hackin-Joseph Stinson,Jay Weston Productions-The Malpaso Company,Drama-War
9075,1969,Go,,,,,,
9076,1954,Samurai Trilogy 1: Musashi Miyamoto,,,,,,
9077,2003,Live Forever,82,7.2,John Dower,John Dower,Passion Pictures,Documentary-Music
9078,2003,Wheel of Time,81,7.2,Werner Herzog,Werner Herzog,Werner Herzog Filmproduktion-West Park Pictures Produktion-ARTE-Gesellschaft zur Förderung Buddhistischer Werte (GFBW )-Dario de Luca Tipota Movie Company,Documentary
9079,2004,Shiner,89,3.1,Christian Calson,Christian Calson,Bruiser Films LLC-Nebunule Films LLC,Drama
9080,2000,Autumn in New York,103,5.6,Joan Chen,Allison Burnett,Metro-Goldwyn-Mayer (MGM)-Lakeshore Entertainment,Drama-Romance
9081,1984,Sunday in the Country,90,7.8,Bertrand Tavernier,Pierre Bost-Bertrand Tavernier-Colo Tavernier,Films A2-Little Bear-Sara Films,Drama
9082,1973,The Last of Sheila,120,7.3,Herbert Ross,Stephen Sondheim-Anthony Perkins,Warner Bros.,Crime-Drama-Mystery-Thriller
9083,1967,Ram Aur Shyam,171,7.4,Tapi Chanakya,Kaushal Bharati-Narasa Raju D.V.-Narasa Raju D.V.,Vijaya International,Comedy-Drama-Family
9084,2000,MTV Unplugged: Mana,40,4.2,Jeb Brien-Lawrence Jordan-Milton Lage,Jim Burns-Robert Small,,Music-Short
9085,1999,My Sweet Suicide,78,5.5,David Flanagan,David Flanagan,Terence Michael Productions,
9086,1993,Bare Exposure,86,4.1,Rafe M. Portilo,Jalee Bailey,HollyDream Productions-New City Releasing,Comedy
9087,1992,Hero,119,6.5,Stephen Frears,Laura Ziskin-Alvin Sargent-David Webb Peoples,Columbia Pictures,Comedy-Drama-Romance
9088,2004,Tony Hawk's Secret Skatepark Tour,,,,,,
9089,1975,The Apple Dumpling Gang,100,6.4,Norman Tokar,Don Tait-Jack M. Bickham,Walt Disney Productions,Comedy-Family-Western
9090,2001,Trouble Every Day,101,6.0,Claire Denis,Claire Denis-Jean-Pol Fargeau,Arte France Cinéma-Arte-Canal+-Centre National de la Cinématographie-Dacia Films-Kinetique-Messaouda Films-Rézo Films-Rézo Productions-Zweites Deutsches Fernsehen,Drama-Horror-Thriller
9091,1967,At Last the 1948 Show,30,7.8,,Tim Brooke-Taylor-Graham Chapman-John Cleese,Associated-Rediffusion Television,Comedy
9092,1994,Miracle on 34th Street,114,6.5,Les Mayfield,Valentine Davies-George Seaton-George Seaton,Twentieth Century Fox-Hughes Entertainment,Family-Fantasy
9093,2004,Serial Killing 101,89,5.3,Trace Slobotkin,Dave Gist-Trace Slobotkin,Parlay Productions,Comedy-Horror-Mystery-Thriller
9094,2002,Maryam,87,7.0,Ramin Serry,,Centre Street-Streetlight Films,Drama
9095,1997,In the Company of Men,97,7.2,Neil LaBute,Neil LaBute-Neil LaBute,Alliance Atlantis Communications-Fair and Square Productions,Comedy-Drama
9096,2001,Thomas in Love,,,,,,
9097,1986,Gung Ho,112,6.2,Ron Howard,Edwin Blum-Lowell Ganz-Babaloo Mandel,Paramount Pictures,Comedy-Drama
9098,1988,A Cry in the Dark,120,6.9,Fred Schepisi,John Bryson-Robert Caswell-Fred Schepisi,Cannon Entertainment-Golan-Globus Productions-Cinema Verity-Evil Angels Films-Warner Bros.,Biography-Drama
9099,1988,Storm Chasers,,,,,,
9100,1983,Les Comperes,92,7.0,Francis Veber,Francis Veber,Fideline Films-DD Productions-EFVE,Comedy-Crime
9101,1991,Northern Exposure: Season 3,,,,,,
9102,1989,Kiki's Delivery Service: Bonus Material,,,,,,
9103,1914,Tillie's Punctured Romance,82,7.0,Mack Sennett-Charles Bennett,Hampton Del Ruth-Craig Hutchinson-Mack Sennett,Keystone Film Company,Comedy
9104,2001,Echo and the Bunnymen: Live in Liverpool,,,,,,
9105,2005,A Slice of Terror,50,6.2,Stuart Taylor,Allison Erkelens-Miranda Leigh,New Dominion Pictures-Discovery Channel,Documentary-Biography-Crime-Drama-History-Mystery-Thriller
9106,1944,Murder,,,,,,
9107,1993,Handel: The Messiah: Choir of King's College,,,,,,
9108,2002,Love Liza,90,7.0,Todd Louiso,Gordy Hoffman,Kinowelt Filmproduktion-Wild Bunch-StudioCanal-Muse Productions-Blacklist Films-Starhaus Filmproduktion,Comedy-Drama
9109,1988,Cocoon: The Return,116,5.4,Daniel Petrie,David Saperstein-Stephen McPherson-Elizabeth Bradley,Zanuck/Brown Productions-Twentieth Century Fox,Adventure-Comedy-Mystery-Romance-Sci-Fi
9110,1998,The Horse Whisperer,169,6.6,Robert Redford,Nick Evans-Eric Roth-Richard LaGravenese,Touchstone Pictures-Wildwood Enterprises,Drama-Romance-Western
9111,1997,Kiss the Girls,115,6.6,Gary Fleder,James Patterson-David Klass,Paramount Pictures-Rysher Entertainment,Crime-Drama-Mystery-Thriller
9112,1999,The Corruptor,110,6.0,James Foley,Robert Pucci,New Line Cinema-Illusion Entertainment Group,Action-Crime-Drama-Mystery-Thriller
9113,1979,A Little Romance,110,7.5,George Roy Hill,Allan Burns-Claude Klotz-George Roy Hill,Orion Pictures-Pan Arts-Trinacra Films,Adventure-Comedy-Romance
9114,2003,Killer Flood: The Day the Dam Broke,120,3.8,Doug Campbell,Peter Beckwith-Joseph Broido-Doug Campbell,PorchLight Entertainment-Edgewood Studios,Action-Drama-Thriller
9115,1934,Laurel & Hardy: March of the Wooden Soldiers,77,7.3,Gus Meins-Charley Rogers,Frank Butler-Nick Grinde-Anna Alice Chapin,Hal Roach Studios-Metro-Goldwyn-Mayer (MGM),Comedy-Family-Fantasy-Musical
9116,1994,With Honors,101,6.7,Alek Keshishian,William Mastrosimone,Spring Creek Productions-Warner Bros.,Comedy-Drama
9117,1997,Virasat,165,7.5,Priyadarshan,Kamal Haasan-Vinay Shukla-Vinay Shukla,M.R. Productions,Drama-Family-Musical-Romance
9118,2004,Pokemon: Journey to the Johto League Champion: Vol. 7: Journey's End,,,,,,
9119,1972,The Sorrow and the Pity,,,,,,
9120,1963,The Sword in the Stone,79,7.2,Wolfgang Reitherman,Bill Peet-T.H. White,Walt Disney Productions,Animation-Adventure-Comedy-Family-Fantasy-Musical
9121,1954,Apache,91,6.4,Robert Aldrich,James R. Webb-Paul Wellman,Hecht-Lancaster Productions,Western
9122,1933,Counsellor at Law,82,7.6,William Wyler,Elmer Rice-Elmer Rice,Universal Pictures,Comedy-Drama
9123,2004,Eight Clouds Rising,,,,,,
9124,1996,Underworld,95,4.9,Roger Christian,Larry Bishop,Trimark Pictures-Keystone Pictures-Underworld Films,Comedy-Thriller
9125,2001,Hearts in Atlantis,101,6.9,Scott Hicks,Stephen King-William Goldman,Castle Rock Entertainment-Village Roadshow Pictures-NPV Entertainment,Drama-Mystery
9126,2002,Sabretooth,120,3.5,James D.R. Hickox,Scott Vandiver-Tom Woosley,International Film Group-Sabretooth Productions Inc.,Horror-Sci-Fi
9127,2004,VeggieTales: An Easter Carol,49,6.8,Tim Hodge,Keith Lango-Tim Hodge,Warner Home Video-Big Idea Productions,Animation-Comedy-Drama-Family-Fantasy-Musical
9128,1965,Lost in Space: Season 1,,,,,,
9129,2005,The Boys and Girl from County Clare,,,,,,
9130,1990,A Chinese Ghost Story 2,104,7.0,Siu-Tung Ching,Kan Keito-Kee-To Lam-Tai-Mok Lau,Film Workshop,Action-Comedy-Fantasy-Romance
9131,1990,Air America,113,5.8,Roger Spottiswoode,Christopher Robbins-John Eskow-Richard Rush,Carolco Pictures-IndieProd Company Productions,Action-Comedy
9132,1991,L.A. Story,95,6.7,Mick Jackson,Steve Martin,Carolco Pictures-IndieProd Company Productions-L.A. Films,Comedy-Drama-Fantasy-Romance
9133,1997,Sharpe 14: Sharpe's Waterloo,101,8.1,Tom Clegg,Charles Wood-Bernard Cornwell,Carlton Television-Celtic Films-Picture Palace,Action-Adventure-History-War
9134,2004,A Day Without a Mexican,100,4.8,Sergio Arau,Sergio Arau-Yareli Arizmendi-Sergio Guerrero,Eye On The Ball Films-Instituto Mexicano de Cinematografía-Jose and Friends Inc.-Plural Entertainment-RTG Productions,Comedy-Drama-Fantasy-Mystery
9135,1988,Rumpole of the Bailey: Series 5,,,,,,Mystery
9136,2001,Charlotte Gray,121,6.4,Gillian Armstrong,Sebastian Faulks-Jeremy Brock,Ecosse Films-FilmFour-Pod Film-Senator Film Produktion,Drama-Romance-Thriller-War
9137,1999,Lured Innocence,,,,,,
9138,1999,The White River Kid,99,4.7,Arne Glimcher,John Fergus Ryan-David Leland,Franchise Pictures-St. Mortimer Productions Inc.,Comedy
9139,2002,Standing in the Shadows of Motown: Bonus Material,,,,,,
9140,2003,Shredder,,,,,,
9141,2002,Full Metal Panic!,24,7.7,,Shôji Gatô-Fumihiko Shimo,Gonzo,Action-Comedy-Romance-Sci-Fi-Animation
9142,1988,Saturday the 14th Strikes Back,78,2.9,Howard R. Cohen,Howard R. Cohen,Pacific Trust,Comedy-Fantasy-Horror-Sci-Fi
9143,1998,Queen Emeraldas,120,6.9,Yûji Asada,Gray G. Haddock-Mugi Kamio-Leiji Matsumoto,,Animation-Sci-Fi
9144,1974,Gone in 60 Seconds,105,6.5,H.B. Halicki,H.B. Halicki,H.B. Halicki Mercantile,Action-Crime-Drama-Thriller
