id,year,title,Runtime,Rating,Directors,Writers,Production companies,Genres
9374,1966,La Guerre Est Finie,121,7.5,Alain Resnais,Jorge Semprún,Europa Film-Sofracima,Drama-War
9375,2002,Wicked Minds,,,,,,
9376,2002,This Land Is Your Land: The Folk Years,,,,,,
9377,1937,The Prince and the Pauper,118,7.3,William Keighley-William Dieterle,Mark Twain-Laird Doyle-Catherine Chisholm Cushing,Warner Bros.,Adventure-Drama-Family-Fantasy
9378,1984,The Natural,138,7.5,Barry Levinson,Bernard Malamud-Roger Towne-Phil Dusenberry,TriStar Pictures-Delphi II Productions,Drama-Sport
9379,2000,WWII: The Lost Color Archives,171,8.4,,,,Documentary-War
9380,1970,Elvis: That's the Way It Is,97,8.0,Denis Sanders,,Metro-Goldwyn-Mayer,Documentary-Music
9381,1980,The Elephant Man,124,8.2,David Lynch,Christopher De Vore-Eric Bergren-David Lynch,Brooksfilms,Biography-Drama
9382,1997,Everybody Loves Raymond: Season 2,,,,,,
9383,1998,Substitute 2: School's Out,89,5.1,Steven Pearl,Roy Frumkes-Rocco Simonelli-Alan Ormsby,Dinamo Entertainment-Gun for Hire Films-Live Film & Mediaworks Inc.-Shooting Gallery,Action-Crime-Thriller
9384,1970,UFO,45,8.0,,Gerry Anderson-Sylvia Anderson-Reg Hill,Century 21 Television-Incorporated Television Company,Action-Sci-Fi
9385,1996,Legend of Crystania: The Chaos Ring,135,6.1,Ryûtarô Nakamura,Akinori Endô-Ryo Mizuno,,Animation-Action-Fantasy
9386,1999,World's Most Astounding Undercover Stings,,,,Dan Perry,,Reality-TV
9387,1977,The Exorcist 2: The Heretic,117,3.7,John Boorman,William Goodhart-William Peter Blatty-Rospo Pallenberg,Warner Bros.,Horror
9388,1985,Crimes of Passion,,,,,,
9389,1996,Striptease,115,4.4,Andrew Bergman,Carl Hiaasen-Andrew Bergman,Castle Rock Entertainment-Lobell/Bergman Productions,Comedy-Crime-Drama-Thriller
9390,2003,Benedict Arnold: A Question of Honor,100,6.4,Mikael Salomon,William Mastrosimone,A&E Television Networks-Dark Eagle Productions-De Angelis Group-Jaffe/Braunstein Films-Jersey Guys Productions-Victory Media Group,Drama-History
9391,2004,Satan's Little Helper,96,5.3,Jeff Lieberman,Jeff Lieberman,Satan's Little Company LLC-Intrinsic Value Films,Comedy-Horror
9392,1999,The Deep End of the Ocean,106,6.4,Ulu Grosbard,Jacquelyn Mitchard-Stephen Schiff,Columbia Pictures-Mandalay Entertainment-Via Rosa Productions,Drama
9393,1940,Go West / The Big Store,,,,,,
9394,1976,CBS Salutes Lucy: The First 25 Years,120,7.2,,,CBS,Documentary
9395,1998,Les Miserables,134,7.5,Bille August,Victor Hugo-Rafael Yglesias,Mandalay Entertainment-TriStar Pictures,Crime-Drama-History-Romance
9396,1996,The Crow: City of Angels,84,4.6,Tim Pope,James O'Barr-David S. Goyer,Bad Bird Productions-Dimension Films-Jeff Most Productions-Miramax,Action-Crime-Fantasy-Thriller
9397,1973,Columbo: Season 3,,,,,,
9398,2004,Bobby Jones,120,6.7,Rowdy Herrington,Rowdy Herrington-Kim Dawson-Rowdy Herrington,Bobby Jones Films LLC-Dean River Productions-LIFE-McDongall Films,Biography-Drama-Romance-Sport
9399,1991,Legend of the Dragon Kings: White Dragon,45,7.5,,Yoshiki Tanaka,Kitty Films,Animation
9400,1987,Allan Quatermain and the Lost City of Gold,,,,,,
9401,2003,Strange Things Happen at Sundown,135,4.2,Marc Fratto,Marc Fratto-Marc Fratto-Steve Gonzalez,Insane-O-Rama Productions,Horror-Action-Comedy
9402,2000,Mr. Accident,88,4.3,Yahoo Serious,David Roach-Yahoo Serious,Goldwyn Films,Comedy
9403,2004,Bikini Bandits: Briefs,,,,,,
9404,2004,WOW Gospel 2004,101,,Darryl D. Lassiter,Darryl D. Lassiter,,Music
9405,1998,Hoods,90,5.1,Mark Malone,Mark Malone,Keystone Pictures,Comedy-Drama
9406,2001,The Best of Insomniac: Uncensored: Vol. 1,,,,,,
9407,1999,The Amanda Show,30,6.7,,Dan Schneider-Andrew Hill Newman-John Hoberg,Nickelodeon Network-Tollin/Robbins Productions,Comedy-Family
9408,1999,God Said Ha!,,,Don DuPree,,Buena Vista Television,Talk-Show
9409,1970,Isle of Wight Festival: Message to Love: 1970,,,,,,
9410,2004,P.S.,97,6.2,Dylan Kidd,Helen Schulman-Helen Schulman-Dylan Kidd,Hart Sharp Entertainment-Fortissimo Films,Comedy-Drama-Fantasy-Romance
9411,1999,Lisboa,100,6.9,Antonio Hernández,Enrique Brasó-Antonio Hernández-Antonio Hernández,Alta Films-Blue Legend Producciones-Sinfonía Otoñal S.A.,Crime-Thriller
9412,2003,Hallow's End,90,3.1,Jon Keeyes,Chris Burdick,Hallow's End Productions-Highland Myst Entertainment,Horror
9413,1991,Robert Townsend: Partners in Crime: Vol. 2,60,8.2,Walter C. Miller-Robert Townsend,Franklyn Ajaye-Tommy Davidson-Robin Harris,Tinsel Townsend,Documentary-Comedy-Music
9414,1963,The Outer Limits: The Original Series: Season 1,,,,,,
9415,2005,Are We There Yet?,95,4.7,Brian Levant,Steven Gary Banks-Claudia Grazioso-Steven Gary Banks,Revolution Studios-Cube Vision,Adventure-Comedy-Family-Romance
9416,1957,Peyton Place,157,7.2,Mark Robson,John Michael Hayes-Grace Metalious,Twentieth Century Fox-Jerry Wald Productions,Drama-Romance
9417,2001,Carmen: A Hip Hopera,88,4.8,Robert Townsend,Michael Elliot,Carmen Productions-New Line Television,Musical-Drama
9418,1999,Roswell: Season 1,,,,,,
9419,1974,Lady Snowblood: Love Song of Vengeance,89,6.4,Toshiya Fujita,Kazuo Kamimura-Kazuo Koike-Kiyohide Ohara,Toho Film (Eiga) Co. Ltd.,Drama-Thriller
9420,1999,Cypress Edge,90,3.8,Serge Rodnunsky,Serge Rodnunsky,Rojak Films,Drama-Thriller
9421,2000,Anatomy,103,6.1,Stefan Ruzowitzky,Peter Engelmann-Stefan Ruzowitzky,Deutsche Columbia TriStar Filmproduktion-Claussen & Wöbke Filmproduktion GmbH,Horror-Thriller
9422,2000,Chutney Popcorn,,,,,,
9423,1968,Faces,130,7.7,John Cassavetes,John Cassavetes,,Drama
9424,1982,Kiss Me Goodbye,101,6.1,Robert Mulligan,Bruno Barreto-Jorge Amado-Charlie Peters,Twentieth Century Fox-Boardwalk Productions,Comedy-Fantasy-Romance
9425,1950,The Jackie Robinson Story,77,6.4,Alfred E. Green,Arthur Mann-Louis Pollock-Lawrence Taylor,Jewel Pictures,Biography-Drama-Sport
9426,1986,Platoon,120,8.1,Oliver Stone,Oliver Stone,Hemdale-Cinema 86,Drama-War
9427,2003,Chicago: A&E Live by Request,,,,,,
9428,2001,Friend,113,7.4,Kyung-taek Kwak,Kyung-taek Kwak,Cineline 2-Cowell Investment Capital Co.-J.R. Lighting-Korea Pictures-Simmani-Zemiro,Action-Crime-Drama
9429,1993,CB4,89,6.2,Tamra Davis,Chris Rock-Nelson George-Chris Rock,Imagine Entertainment-Universal Pictures,Comedy-Music
9430,2003,The Battle of Shaker Heights,79,6.1,Efram Potelle-Kyle Rankin,Erica Beeney,LivePlanet-Miramax,Drama-Romance-Comedy
9431,2000,Get Carter,102,5.1,Stephen Kay,Ted Lewis-David McKenna,Morgan Creek Entertainment-Franchise Pictures-The Canton Company-Epsilon Motion Pictures-Carter Productions,Action-Crime-Drama-Thriller
9432,1997,Cop Land,105,6.9,James Mangold,James Mangold,Miramax-Woods Entertainment-Across the River Productions,Crime-Drama-Thriller
9433,1971,Fiddler on the Roof,181,8.0,Norman Jewison,Sholom Aleichem-Arnold Perl-Joseph Stein,The Mirisch Production Company-Cartier Productions,Drama-Family-Musical-Romance
9434,2001,Love Ke Liye Kuch Bhi Karega,131,6.1,Eeshwar Nivas,Rajnish Thakur,Dream Merchants Enterprise,Comedy-Crime-Romance
9435,2000,Committed,98,5.2,Lisa Krueger,Lisa Krueger,Miramax,Comedy-Drama
9436,2002,Full Metal Panic FUMOFFU,,,,,,
9437,1972,Cesar and Rosalie,111,7.5,Claude Sautet,Jean-Loup Dabadie-Claude Sautet-Claude Néron,Fildebroc-Mega Film-Paramount-Orion Filmproduktion,Drama-Romance
9438,2000,Love & Basketball,124,7.2,Gina Prince-Bythewood,Gina Prince-Bythewood,40 Acres & A Mule Filmworks,Drama-Romance-Sport
9439,1998,Eternal,,,,,,
9440,1985,Explorers,109,6.6,Joe Dante,Eric Luke,Paramount Pictures,Adventure-Comedy-Family-Romance-Sci-Fi
9441,1996,Kazaam,93,2.9,Paul Michael Glaser,Paul Michael Glaser-Christian Ford-Roger Soffer,Interscope Communications-Isobel Griffiths Limited-Polygram Filmed Entertainment-Touchstone Pictures,Comedy-Family-Fantasy-Musical
9442,2004,The Chronicles of Riddick,119,6.7,David Twohy,Jim Wheat-Ken Wheat-David Twohy,Universal Pictures-Radar Pictures-One Race Productions-Primal Foe Productions,Action-Adventure-Sci-Fi-Thriller
9443,1998,Pocahontas II: Journey to a New World,72,4.9,Tom Ellery-Bradley Raymond,Allen Estrin-Cindy Marcus-Flip Kobler,Disneytoon Studios-Walt Disney Pictures,Animation-Adventure-Drama-Family-Musical-Romance
9444,1992,King of Beggars,101,6.9,Gordon Chan,Kin Chung Chan-Gordon Chan,Win's Entertainment Ltd.,Action-Comedy-Drama
9445,1994,Thumbelina,86,6.4,Don Bluth-Gary Goldman,Hans Christian Andersen-Don Bluth,Don Bluth,Animation-Family-Fantasy-Musical-Romance
9446,2004,Out of Season,105,4.4,Jevon O'Neill,Jevon O'Neill,Bauer Martinez Studios-Electric Dog & Bear-Erinfilm-Frame Werk Produktion GmbH & Co. KG-Lucky UKFS-Media Pro-The Tower Limited Liability Partnership,Crime-Drama
9447,2005,Samurai Gun,,,,,,
9448,2004,Roughnecks: The Starship Troopers Chronicles: Trackers,,,,,,
9449,1957,Hellcats of the Navy,82,5.4,Nathan Juran,Charles A. Lockwood-Hans Christian Adamson-David Lang,Morningside Productions,Drama-Thriller-War
9450,2005,Kisna: The Warrior Poet,170,4.7,Subhash Ghai,Sachin Bhowmick-Farrukh Dhondy-Subhash Ghai,,Drama-History-Musical-Romance
9451,1989,Rabid Grannies,,,,,,
9452,2002,A Season on the Brink,87,5.2,Robert Mandel,John Feinstein-David W. Rintels,Argentum Film Produktion und Betriebes KG-ESPN-Jess Productions-Kinetic Pictures-Once Upon a Time Films,Drama-Sport
9453,2000,Best of Travels in Europe with Rick Steves: Italy,,,,,,
9454,2001,A Line in the Sand,,,,,,
9455,1967,The Happiest Millionaire,141,6.9,Norman Tokar,Kyle Crichton-Cordelia Drexel Biddle-Kyle Crichton,Walt Disney Productions,Comedy-Family-Musical-Romance
9456,2004,PRIDE Fighting Championships: Total Elimination 2004,,,,,,
9457,2004,Wacky Races: The Complete Series,,,,,,
9458,2005,Kingdom of Heaven,144,7.2,Ridley Scott,William Monahan,Twentieth Century Fox-Scott Free Productions-BK-KOH-Reino del Cielo-Studio Babelsberg-Inside Track 3-Calle Cruzada-Dune Films-Kanzaman,Action-Adventure-Drama-History-War
9459,1988,I'm Gonna Git You Sucka,88,6.6,Keenen Ivory Wayans,Keenen Ivory Wayans,Front Films-Ivory Way Productions-Raymond Katz Production,Action-Comedy-Crime
9460,2005,Lucinda Williams: Live from Austin,,,,,,
9461,1994,Ready to Wear,133,5.1,Robert Altman,Robert Altman-Barbara Shulgasser,Etalon Film-Miramax,Comedy-Drama
9462,1980,Half a Loaf of Kung Fu,,,,,,
9463,1986,Castle in the Sky: Bonus Material,,,,,,
9464,1998,Sleepless Town,122,7.1,Chi-Ngai Lee,Seishu Hase-Chi-Ngai Lee-Hisashi Nozawa,Asmik Ace Entertainment-Hakuhodo DY Media Partners-Kadokawa Publishing Company-Nippon Shuppan Hanbai (Nippan) K.K.-Sumitomo Corporation-Toei Company,Drama
9465,2004,The Fight: American Experience,90,7.8,Barak Goodman,Barak Goodman-David Margolick,Arte-British Broadcasting Corporation (BBC)-Mitteldeutscher Rundfunk (MDR)-Social Media Productions-WGBH,Documentary-Biography-History
9466,1960,The Adventures of Huckleberry Finn,107,6.3,Michael Curtiz,Mark Twain-James Lee,Formosa Productions,Adventure-Comedy-Drama-Family
9467,1967,Mars Needs Women,83,3.2,Larry Buchanan,Larry Buchanan,Azalea Pictures,Sci-Fi
9468,1997,Battle Athletes: Vol. 3: Go,,5.7,,Hideyuki Kurata-Yôsuke Kuroda,,Animation
9469,2003,I'll Sleep When I'm Dead,103,5.8,Mike Hodges,Trevor Preston,Mosaic Film Group-Revere Pictures-Will & Company,Crime-Drama-Mystery-Thriller
9470,2000,Butterfly,,,,,,
9471,2004,The Butterfly Effect: Director's Cut,,,,,,
9472,1962,The Man Who Shot Liberty Valance,123,8.1,John Ford,James Warner Bellah-Willis Goldbeck-Dorothy M. Johnson,John Ford Productions,Drama-Western
9473,1980,Roadie,106,5.1,Alan Rudolph,Big Boy Medlin-Michael Ventura-Zalman King,Alive Enterprises-Vivant Productions,Comedy-Music
9474,2002,CKY4,,,,,,
9475,1994,The Critic: The Complete Series,,,,,,
9476,1986,Last Resort,84,4.2,Zane Buzby,Steve Zacharias-Jeff Buhai,Concorde Pictures-Trinity Pictures,Comedy
9477,1986,A Great Wall,97,6.9,Peter Wang,Shirley Sun-Peter Wang,Nanhai-W&S,Comedy-Drama
9478,2005,Ice Queen,92,2.9,Neil Kinsella,Peter Beckwith-Neil Kinsella-David R. Williams,Edgewood Studios-Artist View Entertainment,Horror-Thriller
9479,2002,The Cuckoo,99,7.8,Aleksandr Rogozhkin,Aleksandr Rogozhkin,CTB Film Company,Drama-War-Comedy
9480,1995,Family of Cops,90,5.7,Ted Kotcheff,Joel Blasberg,Alliance Communications Corporation-CBS Entertainment Production-Joel Blasberg Company-The Cramer Company,Action-Drama-Thriller
9481,1972,Deliverance,109,7.7,John Boorman,James Dickey-James Dickey-John Boorman,Warner Bros.-Elmer Enterprises,Adventure-Drama-Thriller
9482,1992,Inspector Morse 23: The Death of the Self,,,,,,
9483,1992,Inspector Morse 8: Ghost in the Machine,,,,,,
9484,2002,The Other Brother,94,4.9,Mandel Holland,Mandel Holland,DelFlix Pictures,Comedy-Drama
9485,1967,Persona,,,,,,
9486,2004,Evanescence: Anywhere but Home,,8.7,Hamish Hamilton,,Emotional Pictures-Wind-Up Records,Music
9487,2002,Dragon Ball Z: The Return of Cooler,,,,,,
9488,2000,Secret KGB JFK Assassination File,,,,,,
9489,1974,Dirty Mary,93,6.7,John Hough,Leigh Chapman-Antonio Santean-Richard Unekis,Academy Pictures-Twentieth Century Fox,Action-Crime-Thriller
9490,2004,The Pixies: Sell Out 2004: Reunion Tour,,,,,,
9491,1981,The Woman Next Door,106,7.4,François Truffaut,François Truffaut-Suzanne Schiffman-Jean Aurel,Les Films du Carrosse-TF1 Films Production,Drama-Romance
9492,2003,3 Walls,115,7.9,Nagesh Kukunoor,Nagesh Kukunoor,Metalight Productions-SIC Productions,Crime-Drama
9493,2003,MTV Video Music Awards Collection: Hip Pop,,,,,,
9494,1994,Body Chemistry III: Point of Seduction,90,4.0,Jim Wynorski,Jackson Barr,Concorde-New Horizons,Drama-Thriller
9495,2000,Kadosh,,,,,,
9496,2003,Cold Mountain: Bonus Material,,,,,,
9497,1985,Moonlighting: The Pilot,93,7.5,Robert Butler,Glenn Gordon Caron,Picturemaker Productions-ABC Circle Films,Comedy-Drama-Mystery-Romance
9498,2004,Lewis Black: Black on Broadway,58,8.1,Paul Miller,Lewis Black,Rickmill Productions,Documentary-Comedy
9499,1981,Ken Burns' America: Brooklyn Bridge,,,,,,
9500,2002,20,101,6.2,Rob Bowman,Gregg Chabot-Kevin Peterka-Gregg Chabot,Spyglass Entertainment-The Zanuck Company-Touchstone Pictures-Tripod Entertainment-World 2000 Entertainment,Action-Adventure-Fantasy-Sci-Fi-Thriller
9501,2001,Lakeboat,,,,,,
9502,1999,Letters From a Killer,,,,,,
9503,2004,NBA Dynasty Series: Chicago Bulls 1990s,,,,,,
9504,1999,Dillagi,188,5.4,Sunny Deol,Sutanu Gupta-Sanjay Masoomm,Vijayta Films,Drama-Family-Musical-Romance
9505,1997,Insomnia,96,7.3,Erik Skjoldbjærg,Nikolaj Frobenius-Erik Skjoldbjærg,Norsk Film-Nordic Screen Production AS-Norsk Filminstitutt,Crime-Mystery-Thriller
9506,1968,Once Upon a Time in the West: Bonus Material,,,,,,
9507,1988,Inspector Morse 6: The Settling of the Sun,,,,,,
9508,2004,Welcome to Mooseport,110,5.2,Donald Petrie,Doug Richardson-Tom Schulman,Twentieth Century Fox-Intermedia Films-Mediastream Vierte Film GmbH & Co. Vermarktungs KG-Mooseport Productions,Comedy-Romance
9509,1987,Batteries Not Included,106,6.6,Matthew Robbins,Mick Garris-Brad Bird-Matthew Robbins,Universal Pictures-Amblin Entertainment,Comedy-Family-Fantasy-Sci-Fi
9510,1985,P.D. James: The Black Tower,50,7.5,Ronald Wilson,William Humble-P.D. James,Anglia Television,Crime-Drama-Mystery
9511,1987,Someone to Watch Over Me,106,6.1,Ridley Scott,Howard Franklin-Danilo Bach-David Seltzer,Columbia Pictures,Crime-Drama-Romance-Thriller
9512,2004,Method,93,4.5,Duncan Roy,Katie L. Fetting-Duncan Roy,Andrew Stevens Entertainment-Method Company,Romance-Thriller
9513,1989,Tales from the Crypt: Season 1,,,,,,
9514,2002,PRIDE Fighting Championships: Cold Fury 3,,,,,,
9515,2000,If You Only Knew,107,5.7,David Snedeker,Gary Goldstein,Cinerenta Medienbeteiligungs KG-Two Sticks Productions,Romance-Comedy
9516,1995,Bad Company,108,5.4,Damian Harris,Ross Thomas,Touchstone Pictures-Tool Shed Productions,Crime-Drama-Thriller
9517,1971,Silent Running,,,,,,
9518,1995,Showgirls,128,4.7,Paul Verhoeven,Joe Eszterhas,Carolco Pictures-Chargeurs-United Artists-Vegas Productions,Drama
9519,1966,Au Hasard Balthazar,95,7.9,Robert Bresson,Robert Bresson,Argos Films-Athos Films-Parc Film-Svensk Filmindustri-Svenska Filminstitutet,Drama
9520,1969,The First Churchills,50,8.3,David Giles,Winston Churchill-Donald Wilson,British Broadcasting Corporation,Biography-Drama-History
9521,1993,Into the West,,,,,,
9522,1928,The Lost Films of Laurel & Hardy,,,,,,
9523,1967,Waterhole #3,95,6.4,William A. Graham,Joseph T. Steck-Robert R. Young,Geoffrey Productions,Comedy-Western
9524,1999,The Winslow Boy,104,7.4,David Mamet,Terence Rattigan-David Mamet,Winslow Partners Ltd.,Drama-Romance
9525,1994,The Legend of Drunken Master,102,7.6,Chia-Liang Liu-Jackie Chan,Edward Tang-Man-Ming Tong-Kai-Chi Yuen,Golden Harvest Company-Hong Kong Stuntman Association-Paragon Films Ltd.,Action-Comedy
9526,2001,Juwanna Mann,,,,,,
9527,1999,Crime & Passion,86,4.7,Gary Dean Orona,Gary Dean Orona,Orphan Productions,Crime-Drama-Romance
9528,1957,12 Angry Men,96,8.9,Sidney Lumet,Reginald Rose-Reginald Rose,Orion-Nova Productions,Drama
9529,2003,National Lampoon's Christmas Vacation 2: Cousin Eddie's Island Adventure,83,2.7,Nick Marck,Matty Simmons,Warner Bros. Television-National Lampoon Productions-Elliot Friedgen & Company,Comedy
9530,2002,Vietnam: We Were Heroes 1st Cavalry Division Airmobile,,,,,,
9531,2003,Undefeated,92,5.5,John Leguizamo,John Leguizamo-Frank Pugliese-Frank Pugliese,Forensic Films-Hart Sharp Entertainment-Lower East Side Films,Drama-Sport
9532,1989,The Adventures of Milo and Otis,,,,,,
9533,1996,Sorceress II: The Temptress,,,,,,
9534,2001,In July,,,,,,
9535,1941,Irene Dunne Romance Classics: Love Affair/ Penny Serenade,,,,,,
9536,1985,The Official Story,112,7.8,Luis Puenzo,Aída Bortnik-Luis Puenzo,Historias Cinematograficas Cinemania-Progress Communications,Drama-History-War
9537,2004,The Twins Effect 2,106,5.0,Patrick Leung-Corey Yuen,Kin Chung Chan-Suet Lam-Roy Szeto,Emperor Classic Films-Shenzhen Film Studio-Union Praise,Action-Adventure-Comedy-Fantasy
9538,1986,The Last Days of Patton,146,6.3,Delbert Mann,Ladislas Farago-William Luce,Entertainment Partners,Biography-Drama
9539,2001,Wit,99,8.1,Mike Nichols,Margaret Edson-Emma Thompson-Mike Nichols,HBO Films-Avenue Pictures,Drama
9540,1987,The Decalogue,,,,,,
9541,2003,Denise Austin: Yoga Buns,,,,,,
9542,2001,Lantana,121,7.3,Ray Lawrence,Andrew Bovell-Andrew Bovell,MBP-Jan Chapman Productions-Australian Film Finance Corporation-The New South Wales Film and Television Office,Drama-Mystery-Romance
9543,1977,Close Encounters of the Third Kind: Bonus Material,,,,,,
9544,1991,The Doors Collection,,,,,,
9545,2002,The Adventures of Pluto Nash,95,3.8,Ron Underwood,Neil Cuthbert,Castle Rock Entertainment-Village Roadshow Pictures-NPV Entertainment-Mel's Cite du Cinema,Comedy-Action-Sci-Fi
9546,2000,Lucky Numbers,105,5.0,Nora Ephron,Adam Resnick,Paramount Pictures-StudioCanal-Mad Chance,Comedy-Crime
9547,1986,Troll / Troll 2: Double Feature,,,,,,
9548,1976,Midway,132,6.8,Jack Smight,Donald S. Sanford,The Mirisch Corporation-Universal Pictures,Action-Drama-History-War
9549,2003,The Collected Shorts of Jan Svankmajer: Vol. 1,86,8.3,Jan Svankmajer,Edgar Allan Poe-Jan Svankmajer,Kimstim Films,Animation-Comedy-Fantasy
9550,1985,Perfect,115,4.3,James Bridges,Aaron Latham-Aaron Latham-James Bridges,Columbia Pictures-Delphi III Productions-Pluperfect,Drama-Romance
9551,1997,Drunks,,,,,,
9552,1997,I.M. Pei,90,7.7,Peter Rosen,,Peter Rosen Productions,Documentary-History
9553,2002,And Now ... Ladies and Gentlemen,133,6.2,Claude Lelouch,Claude Lelouch-Pierre Leroux-Pierre Uytterhoeven,Canal+-France 2 Cinéma-Gemka Productions-L&G Productions-Les Films 13,Crime-Drama-Romance-Thriller
9554,2003,The Inspector Lynley Mysteries: Deception on His Mind,90,7.4,Tim Leandro,Elizabeth George-Valerie Windsor,British Broadcasting Corporation-WGBH,Crime-Drama-Mystery-Romance
9555,1994,Frank & Jesse,,,,,,
9556,2003,Rugrats All Grown Up: Lucky 13,,,,,,
9557,2000,Jesus Christ Superstar: 2000,107,7.2,Gale Edwards-Nick Morris,Tim Rice,KQED-Really Useful Films,Music
9558,1997,Elvis Presley: Great Performances: Vol. 3: From the Waist Up,51,7.6,Andrew Solt,Peter Guralnick,Elvis Presley Enterprises,Documentary-Music
9559,2004,Chisholm '72: Unbought and Unbossed,76,7.4,Shola Lynch,,Realside Productions,Documentary
9560,2000,New World Disorder,,,,,,
9561,1996,Stories From My Childhood,,,,,,
9562,2002,Black Mask 2: City of Masks,102,3.6,Hark Tsui,Hark Tsui-Julien Carbon-Laurent Courtiaud,China Star Entertainment-Destination Films-Film Workshop-One Hundred Years of Film Company,Action-Drama-Sci-Fi
9563,1962,Walk on the Wild Side,114,6.8,Edward Dmytryk,Nelson Algren-John Fante-Edmund Morris,Famous Artists Productions-Columbia Pictures-Famartists Productions S.A.,Drama-Romance
9564,1976,Lifeguard,96,6.7,Daniel Petrie,Ron Koslow,Paramount Pictures,Drama
9565,1982,Rocky III,99,6.8,Sylvester Stallone,Sylvester Stallone,United Artists,Drama-Sport
9566,1987,Inspector Morse 1: The Dead of Jericho,,,,,,
9567,1997,Mystery Science Theater 3000: Overdrawn at the Memory Bank,91,8.0,Kevin Murphy,Joel Hodgson-Paul Chaplin-Bill Corbett,Best Brains,Comedy-Sci-Fi
9568,1933,W.C. Fields,,,,,,
9569,1988,War and Remembrance: Vol. 2,1620,8.3,Dan Curtis,Dan Curtis-Earl W. Wallace-Herman Wouk,Dan Curtis Productions-ABC Circle Films-Jadran Film-Paramount Pictures,Drama-War
9570,2005,Blood Relic,86,4.0,J. Christian Ingvordsen,Matthew M. Howe-J. Christian Ingvordsen,Sultan Films,Horror-Thriller
9571,1960,Flaming Star,101,6.6,Don Siegel,Clair Huffaker-Nunnally Johnson-Clair Huffaker,Twentieth Century Fox,Western
9572,2002,Alanis Morissette: Live in the Navajo Nation,53,7.2,Alan Carter,Lewis Friedman-Parvene Michaels-Spencer Thornton,Earth Escapes-Innovative Media Productions-TBA Entertainment Corporation-Tall Pony,Documentary-Music
9573,1944,House of Frankenstein,71,6.3,Erle C. Kenton,Edward T. Lowe Jr.-Curt Siodmak,Universal Pictures,Fantasy-Horror-Sci-Fi
9574,2002,Empires: Peter and Paul and the Christian Revolution,,,,,,
9575,1968,Star!,176,6.6,Robert Wise,William Fairchild,Robert Wise Productions-Twentieth Century Fox,Biography-Comedy-Drama-History-Musical-Romance
9576,1942,To the Shores of Tripoli,86,6.1,H. Bruce Humberstone,Lamar Trotti-Steve Fisher,Twentieth Century Fox,Drama-Romance-War
9577,1990,Jeeves and Wooster: Season 4,,,,,,
9578,1949,Sands of Iwo Jima,100,7.2,Allan Dwan,Harry Brown-James Edward Grant-Harry Brown,Republic Pictures,Action-Drama-Romance-War
9579,2004,The Hidden Fuhrer: Hitler's Sexuality,81,7.3,Fenton Bailey-Randy Barbato-Gabriel Rotello,,World of Wonder Productions-World of Wonder,Documentary
9580,2002,Blue Gate Crossing,85,7.0,Chih-yen Yee,Chih-yen Yee,Arc Light Films-Pyramide Productions,Drama-Romance
9581,1976,The Jeffersons: Season 2,,,,,,
9582,1976,I,,,,,,
9583,1960,Chaudhvin Ka Chand,169,7.2,M. Sadiq,Tabish Sultanpuri-Saghir Usmani-Saghir Usmani,Guru Dutt Films Pvt. Ltd.,Musical-Romance
9584,1997,Billy Joel: Greatest Hits: Vol. 3: The Video,80,7.8,Chris Blum-Howard Deutch-Kathy Dougherty,,Automatic Productions,Documentary-Music
9585,1973,The Tomorrow People: Set 1,30,7.4,,Roger Damon Price-Brian Finch-Jon Watkins,Thames Television,Drama-Fantasy-Sci-Fi
9586,1994,Mosquito,92,4.6,Gary Jones,Tom Chaney-Steve Hodge-Gary Jones,Acme Films Ltd.-Antibes Inc.-Excalibur Motion Pictures,Horror-Sci-Fi
9587,2003,Blue Gender,,,,,,
9588,2004,Tying the Knot,81,7.4,Jim de Sève,,"1,049 Films",Documentary-History-Romance
9589,2001,The Last Siege,,,,,,
9590,1988,The Bear,96,7.7,Jean-Jacques Annaud,James Oliver Curwood-Gérard Brach,Price-Renn Productions,Adventure-Family-Drama
9591,2001,A Knight's Tale,132,6.9,Brian Helgeland,Brian Helgeland,Columbia Pictures-Escape Artists-Finestkind-Black and Blu Entertainment,Action-Adventure-Romance
9592,1998,There's Something About Mary: Special Edition,,,,,,
9593,1995,Friday,91,7.3,F. Gary Gray,Ice Cube-DJ Pooh,New Line Cinema-Priority Films,Comedy-Drama
9594,2003,NASCAR: Winston Cup 2003 Year in Review,,,,,,
9595,1999,My Father,89,7.8,Yimou Zhang,Shi Bao-Shi Bao,Columbia Pictures Film Production Asia-Guangxi Film Studio,Drama-History-Romance
9596,1971,Straw Dogs,113,7.5,Sam Peckinpah,David Zelag Goodman-Sam Peckinpah-Gordon Williams,ABC Pictures-Talent Associates-Amerbroco,Crime-Drama-Thriller
9597,1965,War-Gods of the Deep,84,5.4,Jacques Tourneur,Charles Bennett-Louis M. Heyward-Edgar Allan Poe,Bruton Film Productions,Adventure-Fantasy-Sci-Fi
9598,1979,Manhattan,96,8.0,Woody Allen,Woody Allen-Marshall Brickman,Jack Rollins & Charles H. Joffe Productions,Comedy-Drama-Romance
9599,2001,The Mind of the Married Man: Season 1,,,,,,
9600,2004,Intermedio,,,,,,
9601,1997,The Wedding Party,91,6.0,Cherie Nowlan,Alexandra Long,Stamen Films Pty. Ltd.-The Australian Film Commission-New South Wales Film & Television Office,Comedy-Drama-Romance
9602,1981,Tower of Death,86,5.2,See-Yuen Ng-Sammo Kam-Bo Hung-Corey Yuen,Tin Shing Hoh-Chuo-Lun Ting,Seasonal Film Corporation,Action-Mystery
9603,2005,Pink Floyd: Atom Heart Mother,,,,,,
9604,1997,A Gun,85,5.9,Todd Morris,Todd Morris-Deborah Twiss,Independent Partners,Crime-Drama-Thriller
9605,2001,Armitage: Dual-Matrix,,,,,,
9606,1980,Agatha Christie's The Mirror Crack'd,105,6.2,Guy Hamilton,Jonathan Hales-Barry Sandler-Agatha Christie,G.W. Films-EMI Films,Crime-Mystery-Thriller
9607,2003,Cromartie High School,12,7.8,,Kathleen Moynihan-Eiji Nonaka,CPTA-Production I.G.,Animation-Comedy
9608,1996,Love and Death on Long Island,,,,,,
9609,1985,Sweet Dreams,115,7.1,Karel Reisz,Robert Getchell,HBO Pictures-Silver Screen Partners,Biography-Drama-Music-Musical
9610,1998,A Will of Their Own,300,7.2,Karen Arthur,Susan Nanus-Susan Richards Shreve-Lynn Roth,Lakeside Productions-Warner Bros. Television-Wolper Organization,Drama
9611,1959,Anatomy of a Murder,160,8.0,Otto Preminger,Wendell Mayes-John D. Voelker,Otto Preminger Films,Crime-Drama-Mystery-Thriller
9612,1959,Destiny of a Man,103,8.1,Sergey Bondarchuk,Yuriy Lukin-Fyodor Shakhmagonov-Mikhail Sholokhov,Mosfilm,Drama-War
