id,year,title,Runtime,Rating,Directors,Writers,Production companies,Genres
475,1993,Surf Ninjas,87,5.0,Neal Israel,Dan Gordon,New Line Cinema,Action-Adventure-Comedy-Family-Sport
476,2004,VeggieTales Classics: Where's God When I'm Scared?,,,,,,
477,1990,George Carlin: Personal Favorites,,,,,,
478,1962,The Beverly Hillbillies,25,7.2,,Paul Henning-Mark Tuttle-Dick Wesson,CBS Television Network-Filmways Television,Comedy-Family
479,1988,George Carlin: What Am I Doing in New Jersey?,61,8.3,Bruce Gowers,George Carlin,Cable Stuff Productions,Documentary-Comedy
480,1997,Flypaper,,,,,,
481,2002,Building the Great Pyramid,58,7.2,Jonathan Stamp,Steven Manuel-Jonathan Stamp,British Broadcasting Corporation-Discovery Channel-Norddeutscher Rundfunk-Turner Broadcasting System,Documentary
482,2002,Frida,123,7.4,Julie Taymor,Hayden Herrera-Clancy Sigal-Diane Lake,Handprint Entertainment-Lions Gate Films-Miramax-Ventanarosa Productions,Biography-Drama-Romance
483,2001,Rush Hour 2,90,6.6,Brett Ratner,Ross LaManna-Jeff Nathanson,New Line Cinema-Roger Birnbaum Productions-Salon Films,Action-Comedy-Crime-Thriller
484,1992,Danielle Steel's Jewels,241,7.1,Roger Young,Jonathan Estrin-Shelley List-Danielle Steel,Delux Productions-List/Estrin Productions-NBC Productions-RCS,Drama-Romance
485,1967,The Avengers '67,,,,,,
486,1959,Journey to the Center of the Earth,132,7.1,Henry Levin,Walter Reisch-Charles Brackett-Jules Verne,Twentieth Century Fox-Cooga Mooga-Joseph M. Schenck Enterprises,Adventure-Family-Fantasy-Romance-Sci-Fi
487,1968,Doctor Who: Lost in Time: The Patrick Troughton Years,,,,,,
488,2001,His Secret Life,106,7.4,Ferzan Ozpetek,Gianni Romoli-Ferzan Ozpetek-Gianni Romoli,"R&C Produzioni-Films Balenciaga, Les-MEDIA Programme of the European Union-Ministero per i Beni e le Attività Culturali (MiBAC)",Drama-Romance
489,1998,Return to Paradise,111,6.9,Joseph Ruben,Pierre Jolivet-Olivier Schatzky-Wesley Strick,Polygram Filmed Entertainment-Propaganda Films-Tetragram,Drama-Romance-Thriller
490,1999,The Passion of Ayn Rand,104,6.0,Christopher Menaul,Barbara Branden-Howard Korder-Mary Gallagher,Producers Entertainment Group-Showtime Networks,Biography-Drama-Romance
491,1966,Torn Curtain,128,6.7,Alfred Hitchcock,Brian Moore-Willis Hall-Keith Waterhouse,Universal Pictures,Thriller
492,1984,Mrs. Soffel,110,6.3,Gillian Armstrong,Ron Nyswaner,Edgar J. Scherick Associates-Metro-Goldwyn-Mayer,Drama-Romance
493,1972,The Giallo Collection: Who Saw Her Die?,,,,,,
494,1983,Monty Python's The Meaning of Life: Special Edition,,,,,,
495,2000,Mission Kashmir,154,6.8,Vidhu Vinod Chopra,Vikram Chandra-Vidhu Vinod Chopra-Abhijat Joshi,Destination Films-Vinod Chopra Productions,Action-Drama-Thriller
496,2004,Primus: Hallucino-Genetics Live 2004,155,8.3,Brian Myers,,,Music
497,2003,Broadway's Lost Treasures,110,8.2,Chris Cohen,Steven B. Hecht-Hildy Parks,KQED-Public Broadcasting Service,Music
498,1989,Glory: Bonus Material,,,,,,
499,2000,Under Suspicion,110,6.5,Stephen Hopkins,John Wainwright-Claude Miller-Jean Herman,Revelations Entertainment-TF1 International,Crime-Drama-Thriller
500,2002,Mail Call: The Best of Season 1,,,,,,
501,1975,Three Days of the Condor,117,7.5,Sydney Pollack,James Grady-Lorenzo Semple Jr.-David Rayfiel,Wildwood Enterprises-Dino De Laurentiis Company,Mystery-Thriller
502,2003,Mitch Hedberg: Mitch All Together,,8.6,,,,Documentary-Comedy
503,2005,Max and Ruby: Springtime for Max and Ruby,,,,,,
504,1964,The Twilight Zone: Vol. 27,,,,,,
505,1997,A Thousand Acres,105,6.0,Jocelyn Moorhouse,Jane Smiley-Laura Jones,Touchstone Pictures-Propaganda Films-Beacon Communications-Via Rosa Productions-Prairie Films-Polygram Filmed Entertainment-Beacon Pictures,Drama
506,1976,Blank Generation / Dancin' Barefoot,,,,,,
507,1966,Nevada Smith,128,7.0,Henry Hathaway,Harold Robbins-John Michael Hayes-John Michael Hayes,Solar Productions,Western
508,1979,Saint Jack,112,7.1,Peter Bogdanovich,Howard Sackler-Paul Theroux-Peter Bogdanovich,Copa del Oro-Playboy Productions-Shoals Creek,Drama
509,2004,The Volcano Disaster,,,,,,
510,2004,Blue's Clues: Blue's Room: It's Hug Day,,,,,,
511,2002,Avenging Angelo,97,5.3,Martyn Burke,Will Aldis-Will Aldis-Steve Mackall,Dante Entertainment-Epsilon Motion Pictures-Quinta Communications-Cinema Holdings-Lionweed-Franchise Pictures-Warner Bros.,Action-Comedy-Crime-Romance
512,2000,Bubblegum Crisis: Hurricane Live!,,,,,,
513,1995,Butterfly Kiss,88,6.3,Michael Winterbottom,Frank Cottrell Boyce-Frank Cottrell Boyce-Michael Winterbottom,British Screen Productions-Dan Films-Merseyside Film Production Fund,Comedy-Drama-Romance-Thriller
514,2000,Santana: Supernatural Live,88,8.0,,,Angotti Productions,Documentary-Music
515,2005,Avia Vampire Hunter,83,2.1,Leon Hunter,Leon Hunter,Hunter Productions,Action-Horror
516,2001,Monsoon Wedding,114,7.4,Mira Nair,Sabrina Dhawan,IFC Productions-Mirabai Films-Pandora Filmproduktion-Paradis Films-Baron Pictures-Delhi Dot Com-Mirabai Films Delhi,Comedy-Drama-Romance
517,2001,Two Can Play That Game,90,6.1,Mark Brown,Mark Brown,Screen Gems-C4 Pictures,Comedy-Romance
518,1969,The Prime of Miss Jean Brodie,116,7.6,Ronald Neame,Muriel Spark-Jay Presson Allen-Jay Presson Allen,Twentieth Century-Fox Productions,Drama-Romance
519,1979,From Mao to Mozart: Isaac Stern in China,84,7.7,Murray Lerner,,,Documentary-Music
520,2004,E's Otherwise,,,,,,
521,1927,Presenting Felix the Cat,,,,,,
522,1999,Love Songs,101,6.2,Andre Braugher-Louis Gossett Jr.-Robert Townsend,Charles Fuller,Showtime Networks,Romance
523,1969,My Side of the Mountain,100,6.7,James B. Clark,Joanna Crawford-Jean George-Jane Klove,Paramount Pictures,Adventure-Family
524,1999,Mumford,112,6.9,Lawrence Kasdan,Lawrence Kasdan,Touchstone Pictures-Kasdan Pictures,Comedy-Drama
525,1999,The Last Seduction II,96,4.4,Terry Marcel,Steve Barancik-Dave Cummings,Specific Films,Crime-Drama-Thriller
526,1994,Angie,107,5.4,Martha Coolidge,Avra Wing-Todd Graff,"Caravan Pictures-Hollywood Pictures-Morra, Brezner, Steinberg and Tenenbaum Entertainment",Comedy-Drama-Romance
527,1985,Barbarian Queen,72,3.9,Héctor Olivera,Howard R. Cohen,Aries Cinematográfica Argentina-Rodeo Productions,Adventure-Fantasy
528,2005,The Hitchhiker's Guide to the Galaxy,109,6.8,Garth Jennings,Douglas Adams-Douglas Adams-Karey Kirkpatrick,Touchstone Pictures-Spyglass Entertainment-Everyman Pictures-Hammer & Tongs,Adventure-Comedy-Sci-Fi
529,1998,Summer of the Monkeys,101,6.3,Michael Anderson,Wilson Rawls-Greg Taylor-Jim Strain,The Edge Productions Corp.-Waterfront Pictures,Drama-Family
530,1987,Return to Horror High,95,4.3,Bill Froehlich,Bill Froehlich-Mark Lisson-Dana Escalante,Balcor Film Investors-New World Pictures,Comedy-Horror
531,1996,You're Invited to Mary-Kate and Ashley's Vacation Parties,,,,,,
532,1988,Young Einstein,91,5.1,Yahoo Serious,David Roach-Yahoo Serious,Warner Bros.,Comedy-History
533,1991,Drop Dead Fred,103,5.9,Ate de Jong,Elizabeth Livingston-Carlos Davis-Anthony Fingleton,PolyGram Filmed Entertainment-Working Title Films,Comedy-Drama-Fantasy
534,2000,With a Friend Like Harry,117,7.2,Dominik Moll,Dominik Moll-Gilles Marchand-Francis Villain,Canal+-Centre National de la Cinématographie (CNC)-Diaphana Films-M6 Films-Procirep-Sofica Sofinergie 5,Comedy-Drama-Mystery-Thriller
535,1960,The Alamo,162,6.9,John Wayne,James Edward Grant,Batjac Productions-The Alamo Company,Adventure-Drama-History-War-Western
536,2001,Sol Goode,,,,,,
537,1991,Here is Greenwood,180,7.4,Tomomi Mochizuki,Yukie Nasu-Michael Haigney-Larry Juris,,Animation-Comedy-Romance
538,2003,A Crime of Passion,,5.3,Charles Wilkinson,Carl Binder-John Benjamin Martin,Edge Entertainment-Rigel Entertainment-Waterfront Pictures,Crime-Drama-Mystery-Thriller
539,1987,Rumpole of the Bailey: Series 4,,,,,,
540,2003,Ghosts of the Abyss: Bonus Material,,,,,,
541,1998,King Cobra,,,,,,
542,1997,The Blackout,98,5.4,Abel Ferrara,Abel Ferrara-Marla Hanson-Christ Zois,Cipa-Les Films Number One-MDP Worldwide,Drama-Mystery-Thriller
543,1999,Roughnecks: The Starship Troopers Chronicles: The Pluto Campaign,,7.5,,Robert A. Heinlein-Duane Capizzi-Jeff Kline,Adelaide Productions,Sci-Fi-Animation-Action-Adventure
544,1987,Maurice: Bonus Material,,,,,,
545,2002,Bob the Builder: The Big Game,,,,,,
546,2005,The Strip Game,72,5.5,Method Man,,Immortal Entertainment-Pup Daddy Films-Sickmel Productions-Smart Girl Productions,Documentary
547,1992,Kuffs,102,5.9,Bruce A. Evans,Bruce A. Evans-Raynold Gideon,Dino de Laurentiis Communications-EvansGideon-Beginner's Luck,Action-Comedy-Crime
548,1991,Hudson Hawk,100,5.8,Michael Lehmann,Bruce Willis-Robert Kraft-Steven E. de Souza,TriStar Pictures-Silver Pictures-Ace Bone,Action-Adventure-Comedy
549,1955,Rage at Dawn,87,6.1,Tim Whelan,Horace McCoy-Frank Gruber,Nat Holt Productions,Action-Adventure-Crime-Drama-Western
550,1995,First Knight,134,5.9,Jerry Zucker,Lorne Cameron-David Hoselton-William Nicholson,Columbia Pictures-First Knight Productions,Action-Adventure-Romance
551,1994,The Santa Clause,97,6.4,John Pasquin,Leo Benvenuti-Steve Rudnick,Walt Disney Pictures-Hollywood Pictures-Outlaw Productions,Comedy-Drama-Family-Fantasy
552,1994,Radioland Murders,108,6.2,Mel Smith,George Lucas-Willard Huyck-Gloria Katz,Universal Pictures-Lucasfilm,Comedy-Crime-Drama-Musical-Mystery-Romance
553,1995,Rangeela,142,7.5,Ram Gopal Varma,H. Banerjee-Sanjay Chhel-Ram Gopal Varma,Jhamu Sughand Productions,Comedy-Drama-Musical-Romance
554,1972,Solaris,,,,,,
555,1996,Cadfael: A Morbid Taste for Bones,76,8.1,Richard Stroud,Christopher Russell-Edith Pargeter,Carlton UK Productions,Crime-Drama-Mystery
556,1999,New Waterford Girl,97,7.0,Allan Moyle,Tricia Fish,Sienna Films-imX Communications,Comedy
557,1991,Liebestraum,112,6.0,Mike Figgis,Mike Figgis,Initial Entertainment Group-Pathé Entertainment,Mystery-Thriller
558,1994,Fantastic Four,22,6.5,,Stan Lee-Ron Friedman-Glenn Leopold,Genesis Entertainment-Marvel Enterprises-Marvel Productions-New World Entertainment Films,Animation-Action-Sci-Fi
559,1940,Rebecca: Bonus Material,,,,,,
560,2003,Star Trek: Enterprise: Season 3,,,,,,
561,1963,High and Low,143,8.4,Akira Kurosawa,Hideo Oguni-Ryûzô Kikushima-Eijirô Hisaita,Kurosawa Production Co.-Toho Company,Crime-Drama-Mystery-Thriller
562,2002,Bloody Mallory,94,4.5,Julien Magnat,Stéphane Kazandjian-Julien Magnat,Alquimia Cinema-Bee Movies-Canal Plus Ecriture-Canal+-Fidélité Productions-Film Office-Gimages 5-Mars Distribution-Natexis Banques Populaires Images 2,Action-Comedy-Horror
563,2001,Jimmy Neutron: Boy Genius,82,6.0,John A. Davis,John A. Davis-Steve Oedekerk-John A. Davis,Paramount Pictures-Nickelodeon Movies-DNA Productions-Nickelodeon Animation Studios-O Entertainment,Animation-Action-Adventure-Comedy-Family-Sci-Fi
564,1990,Predator 2,108,6.3,Stephen Hopkins,Jim Thomas-John Thomas-Jim Thomas,Davis Entertainment-Lawrence Gordon Productions-Silver Pictures-Twentieth Century Fox,Action-Horror-Sci-Fi
565,2002,Tom Petty and the Heartbreakers: Live at the Olympic: The Last DJ,,,,,,
566,1996,Bullet,96,6.6,Julien Temple,Mickey Rourke-Bruce Rubenstein,Clipsal Films-Village Roadshow Pictures,Action-Crime-Drama
567,2003,Dunsmore,89,6.8,Peter Spirer,Michael Andrews,Aslan Productions-Shoreline Entertainment-Valencia Motion Pictures,Drama
568,1999,Knights of Ramune,,,,,,
569,1979,The In-Laws,103,7.3,Arthur Hiller,Andrew Bergman,Warner Bros.,Adventure-Comedy-Crime-Thriller-Action
570,2000,The Visit,107,6.7,Jordan Walker-Pearlman,Kosmond Russell-Jordan Walker-Pearlman,DaWa Movies,Drama
571,1999,American Beauty,122,8.4,Sam Mendes,Alan Ball,DreamWorks-Jinks/Cohen Company,Drama
572,1962,The Masque of the Red Death / The Premature Burial,,,,,,
573,1983,Winners & Sinners,108,6.8,Sammo Kam-Bo Hung,Sammo Kam-Bo Hung-Barry Wong,Golden Harvest Company,Action-Comedy-Crime
574,1960,Strangers When We Meet,117,7.1,Richard Quine,Evan Hunter-Evan Hunter,Bryna Productions-Richard Quine Productions,Drama-Romance
575,1994,Highlander: Season 4,,,,,,
576,2000,Popular: Season 2,,,,,,
577,1961,The Twilight Zone: Vol. 36,,,,,,
578,1963,The Terror,81,5.0,Roger Corman-Francis Ford Coppola-Jack Hale,Leo Gordon-Jack Hill-Roger Corman,Roger Corman Productions,Horror-Thriller
579,1973,The Autobiography of Miss Jane Pittman,,,,,,
580,1971,THX 1138: Special Edition,,,,,,
581,1993,Black Jack: The Movie,,,,,,
582,1986,Jo Jo Dancer,97,6.3,Richard Pryor,Rocco Urbisci-Paul Mooney-Richard Pryor,Columbia Pictures-Delphi V Productions,Biography-Comedy-Drama
583,1959,Third Man on the Mountain,107,7.3,Ken Annakin,Eleanore Griffin-James Ramsey Ullman,Walt Disney Productions,Adventure-Drama-Family
584,1998,The Curve,91,5.9,Dan Rosen,Dan Rosen,Mount Royal Entertainment-Click Productions-Hope Street Entertainment,Drama-Mystery-Romance-Thriller
585,1995,My Family,128,7.3,Gregory Nava,Gregory Nava-Anna Thomas,American Playhouse-American Zoetrope-Majestic Films International-Newcomb Productions,Drama
586,1995,Shanghai Triad,108,7.2,Yimou Zhang,Bi Feiyu-Li Xiao,Alpha Films-La Sept Cinéma-Ministère des Affaires étrangères et du Développement International-Shanghai Film Studios-Union Générale Cinématographique,Crime-Drama-History-Romance-Thriller
587,1983,The Scarlet and the Black,143,7.7,Jerry London,J.P. Gallagher-David Butler,ITC-RAI Radiotelevisione Italiana-Bill McCutchen Productions-CBS Entertainment Production,Drama-History-War
588,1990,Blue Planet: IMAX,,,,,,
589,2000,Northanger Abbey,,,,,,
590,2001,Michael McDonald: A Gathering of Friends,70,,Jim Gable,,Graying & Balding Inc.,Music
591,2003,Particles of Truth,101,6.9,Jennifer Elster,Jennifer Elster,75 Films-Matter Productions,Drama
592,1974,House of Whipcord,102,5.9,Pete Walker,David McGillivray-Pete Walker,Peter Walker (Heritage) Ltd.,Horror
593,2000,Baby Genius: Mozart and Friends,,,,,,
594,2002,By Hook or By Crook,,,,,,
595,2001,Monarch of the Glen: Series 2,,,,,,
596,1999,Alice in Wonderland (TV Version),,,,,,
597,1977,The Brady Bunch Variety Hour,60,9.0,Jack Regas,Steve Bluestein-Ronny Graham-Mike Kagan,Sid & Marty Krofft Television Productions-Paramount Television,Comedy-Music
598,1973,Bobby Darin: Mack is Back,,,,,,
599,1989,Sea of Love,113,6.8,Harold Becker,Richard Price,Universal Pictures,Crime-Drama-Mystery-Romance-Thriller
600,1966,What's Up,80,6.0,Woody Allen-Senkichi Taniguchi,Woody Allen-Julie Bennett-Frank Buxton,Benedict Pictures Corp.-National Recording Studios-Toho Company,Adventure-Comedy-Crime-Thriller
601,1992,The Smiths: The Complete Picture,50,7.9,Tim Broad-Paula Grief-Derek Jarman,,,Music
602,2000,Tokyo Raiders,118,5.9,Jingle Ma,Susan Chan-Felix Chong,Golden Harvest Company-Golden Harvest Pictures-Red on Red Productions,Action-Comedy-Drama-Romance
603,1997,Burn Up Excess: Vol. 1: To Serve and Protect,,,,,,
604,2005,Walt Disney's Timeless Tales: Vol. 2,,,,,,
605,2000,The Secrets of the Dead Sea Scrolls,,,,,,
606,1968,Quatermass and the Pit,,,,,,
607,1994,Speed,116,7.2,Jan de Bont,Graham Yost,The Mark Gordon Company-Twentieth Century Fox,Action-Adventure-Crime-Thriller
608,1970,The Lickerish Quartet,90,6.1,Radley Metzger,Michael DeForrest-Michael DeForrest-Radley Metzger,Carstein-Cinemar-Peter Carsten Produktion,Drama
609,2002,Jimmy Neutron: Attack of the Twonkies,,,,,,
610,1999,Offspring: Americana,,,,,,
611,2004,Spooks & Creeps,,,,,,
612,1946,Cloak and Dagger,106,6.6,Fritz Lang,Albert Maltz-Ring Lardner Jr.-Boris Ingster,Warner Bros.-United States Pictures,Adventure-Film-Noir-Romance-Thriller-War
613,1965,The Dr. Who Collection,,,,,,
614,1993,Bad Boy Bubby,114,7.4,Rolf de Heer,Rolf de Heer,Bubby-Fandango-The South Australian Film Corporation-Australian Film Finance Corporation (AFFC),Comedy-Crime-Drama
615,1999,An Ideal Husband,97,6.9,Oliver Parker,Oscar Wilde-Oliver Parker,Arts Council of England-Canal+-Fragile Films-Icon Entertainment International-Icon Productions-Miramax-Pathé Pictures International,Comedy-Romance
616,1983,SCTV Network 90: Vol. 4,,,,,,
617,2004,UFC: Ultimate Fighting Championship: Ultimate Knockouts 3,,,,,,
618,1994,Totally F***ed Up,,,,,,
619,1980,Doctor Who: The Leisure Hive,21,6.6,Lovett Bickford,David Fisher-Sydney Newman,,Adventure-Drama-Family-Sci-Fi
620,2003,Hot Wheels: World Race,,7.4,,Ian Richter-Mark Edward Edens-Andrew Duncan,Mattel-HW Productions-Mainframe Entertainment-Voice Box Productions,Animation-Action-Sci-Fi-Sport
621,1997,Armageddon,97,5.1,Tibor Takács,Tibor Takács-Brian Irving,Millennium Films-Mondofin B.V.,Action-Sci-Fi
622,1991,Talkin' Dirty After Dark,89,5.1,Topper Carew,Topper Carew,New Line Cinema,Comedy
623,1986,Dario Argento Collection: Vol. 2: Demons 2,,,,,,
624,2004,My Mother Likes Women,,,,,,
625,1999,Underground Comedy Movie,88,2.5,Vince Offer,Vince Offer-Dante,Bop Productions-Shoreline Entertainment,Comedy
626,1941,They Died with Their Boots On,140,7.3,Raoul Walsh,Wally Kline-Æneas MacKenzie-Lenore J. Coffee,Warner Bros.,Biography-Drama-Romance-War-Western
627,1971,Beware of a Holy Whore,103,6.9,Rainer Werner Fassbinder,Rainer Werner Fassbinder,Antiteater-X-Film-Nova International Films,Comedy-Drama
628,2003,Rescue Heroes: The Movie,83,5.9,Ron Pitts,Brent Piaskoski,Nelvana,Animation-Family
629,1984,Firestarter,114,6.0,Mark L. Lester,Stephen King-Stanley Mann,Dino De Laurentiis Company-Universal Pictures,Action-Horror-Sci-Fi-Thriller
630,1977,Empire of the Ants,89,4.1,Bert I. Gordon,H.G. Wells-Jack Turley-Bert I. Gordon,Cinema 77,Adventure-Horror-Sci-Fi
631,2005,Unleashed,103,7.0,Louis Leterrier,Luc Besson,EuropaCorp-Danny the Dog Prods Ltd.-TF1 Films Production-Qian Yian International-Current Entertainment-Clubdeal-Canal+,Action-Crime-Drama-Thriller
632,1972,Shaft's Big Score!,104,6.1,Gordon Parks,Ernest Tidyman,Metro-Goldwyn-Mayer-Shaft Productions,Action-Crime-Drama-Thriller
633,1993,Baazigar,175,7.8,Abbas Alibhai Burmawalla-Mastan Alibhai Burmawalla,Robin Bhatt-Akash Khurana-Javed Siddiqui,United Seven Combines-Venus Records & Tapes,Crime-Drama-Musical-Romance-Thriller
634,1989,Christmas with The Simpsons,,,,,,
635,1971,The Fassbinder Collection: Pioneer in Ingolstadt,,,,,,
636,1980,Stir Crazy,111,6.8,Sidney Poitier,Bruce Jay Friedman-Charles Blackwell,Columbia Pictures,Comedy-Crime
637,2001,National Geographic: Inside American Power: Air Force One,,,,,,
638,1985,The Last Dragon,109,6.9,Michael Schultz,Louis Venosta,Delphi III Productions-Motown Productions,Action-Comedy-Drama-Music
639,2002,Jim Brown: All-American,140,5.4,Spike Lee,,HBO Sports-40 Acres & A Mule Filmworks,Documentary-Biography-Sport
640,1992,To Catch a Killer,182,7.4,Eric Till,Jud Kinberg,Creative Entertainment Group-Libra Pictures-Telestories Entertainment Inc.,Biography-Crime-Drama-Thriller
641,1968,Charly,103,7.1,Ralph Nelson,Daniel Keyes-Stirling Silliphant,ABC Pictures-Robertson and Associates-Selmur Productions,Drama-Romance-Sci-Fi
642,1990,Mystery Science Theater 3000: The Hellcats,,7.1,Jim Mallon,Joel Hodgson-Michael J. Nelson-Trace Beaulieu,Best Brains,Comedy-Sci-Fi
643,2002,Buying the Cow,88,5.9,Walt Becker,Walt Becker-Peter W. Nelson,Destination Films,Comedy-Romance
644,1994,Cheyenne Warrior,90,6.8,Mark Griffiths,Michael B. Druxman,Libra Pictures,Action-Western
645,2004,Dear Frankie,105,7.8,Shona Auerbach,Andrea Gibb,Pathé Pictures International-UK Film Council-Scottish Screen-Scorpio Films-Sigma Films-Inside Track Productions,Drama-Romance
646,1987,Matewan,135,7.9,John Sayles,John Sayles,Cinecom Entertainment Group-Film Gallery-Goldcrest Films International-Red Dog Films,Drama-History
647,1960,Cinderfella,91,6.0,Frank Tashlin,Frank Tashlin-Jerry Lewis-Joe Besser,Jerry Lewis Productions,Comedy-Family-Fantasy-Musical-Romance
648,2003,John Mayall & The Bluesbreakers and Friends: 70th Birthday Concert,159,7.6,,,,Music
649,1999,Ricky Martin: The Ricky Martin Video Collection,40,5.8,Nigel Dick-Gustavo Adrian Garzon-Wayne Isham,,,Music
650,2002,Elvira's Haunted Hills,,,,,,
651,1997,The Rainbow Fish / Dazzle the Dinosaur,,,,,,
652,1996,Marvin's Room,98,6.7,Jerry Zaks,Scott McPherson-Scott McPherson,Scott Rudin Productions-Tribeca Productions-Marvin Productions,Drama
653,2000,American Tragedy,170,5.6,Lawrence Schiller,Lawrence Schiller-James Willwerth-Norman Mailer,20th Century Fox Television-Fox Television Studios-Lawrence Schiller Productions,Crime-Drama
654,1975,Return of the Chinese Boxer,,,,,,
655,1965,Green Acres: Season 1,,,,,,
656,2004,Veronica 2030,,,,,,
657,1996,Highlander: Season 5,,,,,,
658,1991,Robin Hood: Prince of Thieves,143,6.9,Kevin Reynolds,Pen Densham-Pen Densham-John Watson,Warner Bros.-Morgan Creek Entertainment,Action-Adventure-Drama-Romance
659,1972,The Last House on the Left,84,6.0,Wes Craven,Wes Craven-Ulla Isaksson,Sean S. Cunningham Films-The Night Co.-Lobster Enterprises,Horror-Thriller
660,2000,Saving Grace,93,6.9,Nigel Cole,Mark Crowdy-Craig Ferguson-Mark Crowdy,Portman Entertainment Group-Sky Pictures-WAVEpictures-Homerun Productions-Rich Pickings Ltd.-Whizbang Films,Comedy-Crime
661,2002,Who is Cletis Tout?,,,,,,Talk-Show
662,1995,Rob Roy,139,6.9,Michael Caton-Jones,Alan Sharp,United Artists-Talisman Productions,Adventure-Biography-Drama-History
663,1999,La Femme Nikita: Season 3,,,,,,
664,1997,Office Killer,82,4.9,Cindy Sherman,Elise MacAdam-Tom Kalin-Todd Haynes,Good Fear-Good Machine-Kardana-Swinsky Films,Comedy-Horror-Thriller
665,1976,Lipstick,89,5.3,Lamont Johnson,David Rayfiel,Dino De Laurentiis Company-Paramount Pictures,Crime-Drama-Thriller
666,2000,The Man Who Came to Dinner,176,7.8,Jay Sandrich-Judy Kinberg-Jerry Zaks,Moss Hart-George S. Kaufman-Adam Green,Public Broadcasting Service-Roundabout Theatre Company-Stage on Screen-WNET Channel 13 New York,Comedy-Drama
667,1965,Gilligan's Island: Season 2,,,,,,
668,2004,Saturday Night Live: The Best of Will Ferrell 2,82,7.5,Beth McCarthy-Miller,Matt Piedmont,Lions Gate Entertainment,Documentary-Comedy
669,1986,Real Kung Fu of Shaolin,,,,,,
670,2002,He Loves Me,92,7.2,Laetitia Colombani,Laetitia Colombani-Caroline Thivel,Téléma-TF1 Films Production-TPS Cinéma-Cofimage 12-Conseil Régional d'Aquitaine,Romance-Thriller
671,1989,The Winter People,110,6.3,Ted Kotcheff,John Ehle-Carol Sobieski,Castle Rock Entertainment-Nelson Entertainment,Drama
672,1991,He Said,115,5.6,Ken Kwapis-Marisa Silver,Brian Hohlfeld,Paramount Pictures,Comedy-Drama-Romance
673,1999,Fight Club: Bonus Material,,,,,,
674,1988,Hellbound: Hellraiser II,97,6.5,Tony Randel,Clive Barker-Peter Atkins,Film Futures-New World Pictures-Troopstar,Horror-Thriller
675,2004,Rugrats All Grown Up: O' Brother!,,,,,,
676,1998,Mafia!,87,5.5,Jim Abrahams,Jim Abrahams-Greg Norberg-Michael McManus,Tapestry Films-Touchstone Pictures,Comedy-Crime
677,2001,In the Mood for Love,,,,,,
678,1965,Loves of a Blonde,90,7.7,Milos Forman,Milos Forman-Milos Forman-Jaroslav Papousek,CBK-Filmové studio Barrandov-Sebor,Comedy-Romance-Drama
679,1990,R.E.M.: Pop Screen,32,7.1,Jem Cohen-Eric Darnell-Katherine Dieckmann,,Warner Bros. Records,Short-Music
680,2000,Better Than Sex,95,6.4,Jonathan Teplitzky,Jonathan Teplitzky,Better Than-Fireworks Pictures-France Télévision Distribution-Meercat Films-New South Wales Film & Television Office-New Vision Films,Comedy-Drama-Romance
681,1986,Police Academy 3: Back in Training,83,5.3,Jerry Paris,Neal Israel-Pat Proft-Gene Quintano,Police Academy Productions-Warner Bros.,Comedy
682,1998,The Mighty,100,7.3,Peter Chelsom,Rodman Philbrick-Charles Leavitt,Chaos Productions-Jane Startz Productions-Miramax-Scholastic Productions,Comedy-Drama
683,1951,Cavalry Charge,89,5.9,Lewis R. Foster,Daniel Mainwaring-George Worthing Yates-Winston Miller,Pine-Thomas Productions,Western
684,1995,Visitors of the Night,98,5.1,Jorge Montesi,Michael J. Murray,Ann Daniel Films-Pebblehut Productions,Sci-Fi-Thriller
685,1999,Running Out of Time,93,7.4,Johnnie To,Nai-Hoi Yau-Laurent Courtiaud-Julien Carbon,China Star Entertainment-Win's Entertainment Ltd.-Milky Way Image Company,Action-Crime-Drama-Thriller
686,2000,Bedazzled,93,6.0,Harold Ramis,Peter Cook-Peter Cook-Dudley Moore,Twentieth Century Fox-Regency Enterprises-KirchMedia,Comedy-Fantasy
687,2003,Peter Jennings Reports: The Kennedy Assassination: Beyond Conspiracy,86,6.7,Mark Obenhaus,Edward Gray-Mark Obenhaus,Springs Media Inc.-The Documentary Group,Documentary-History
688,2003,The History Channel Presents: The Alamo,240,,,,History Channel,Documentary
689,1998,One True Thing,127,7.0,Carl Franklin,Anna Quindlen-Karen Croner,Monarch Pictures-Ufland-Universal Pictures,Drama
690,2004,Baby Einstein: Baby Da Vinci,33,6.7,,,The Baby Einstein Company,Short-Family-Music
691,1999,Angel's Dance,99,6.2,David L. Corley,David L. Corley,Promark Entertainment Group-Videal GmbH,Action-Comedy-Crime-Drama-Romance
692,1992,The Hand that Rocks the Cradle,110,6.6,Curtis Hanson,Amanda Silver,Hollywood Pictures-Interscope Communications-Nomura Babcock & Brown-Rock'n Cradle Productions,Drama-Thriller
693,1996,The Quest,95,5.6,Jean-Claude Van Damme,Frank Dux-Jean-Claude Van Damme-Steve Klein,MDP Worldwide-Selima Films AVV-Signature Pictures,Action-Adventure-Thriller
694,2000,When Dinosaurs Roamed America,,,,,,
695,2004,Koma,88,6.1,Chi-Leung Law,Susan Chan-Sin Ling Yeung,Camera Media-Filmko Entertainment Limited,Drama-Horror-Romance-Thriller
696,1996,Last Man Standing,101,6.4,Walter Hill,Ryûzô Kikushima-Akira Kurosawa-Walter Hill,Lone Wolf-New Line Cinema,Action-Crime-Drama-Thriller
697,2000,Caillou: Caillou's Treasure Hunt and Other Adventures,,,,,,
698,1997,Daud,180,6.0,Ram Gopal Varma,Sanjay Chhel-Kannan Iyer-Kannan Iyer,Jhamu Sughand Productions-Varma Corporation,Action-Adventure-Comedy-Romance-Thriller
699,2004,Mahoromatic: Automatic Maiden: Summer Special,,,,,,
700,1997,Todd McFarlane's Spawn,30,8.1,,Todd McFarlane-John Leekley-Alan B. McElroy,HBO Animation-Home Box Office-McFarlane Films,Animation-Action-Crime-Drama-Fantasy-Horror-Mystery-Sci-Fi-Thriller
701,2002,Nine Lives,85,2.3,Andrew Green,Andrew Green-Tom MacRae,A&A Films Ltd.,Horror-Thriller
702,1996,For the Moment,,,,,,
