id,year,title,Runtime,Rating,Directors,Writers,Production companies,Genres,Plot
13003,1999,The Jaundiced Eye,89,6.9,Nonny de la Peña,Nonny de la Peña,Fifth Estate Productions-Pyedog Productions,Documentary,"At the prompting of his ex-wife and her new live-in boyfriend, a gay man is accused by his five-year-old son of child molestation. The gay man's parents are also indicted. Small-town prejudices are further fueled by the father's admitted homosexuality and the common but erroneous stereotype that all gay men are child molesters. This documentary follows the journey of that family, reliving the horror of the first accusations through an initial guilty verdict, time in prison, the overturning of the first convictions and the eventual dropping of a subsequent case due to lack of evidence."
13004,1972,Butterflies Are Free,109,7.2,Milton Katselas,Leonard Gershe-Leonard Gershe,Frankovich Productions,Comedy-Drama-Music-Romance,"All Don Baker wants is a place of his own away from his over-protective mother. Don's been blind since birth, but that doesn't stop him from setting up in a San Francisco apartment and making the acquaintance of his off-the-wall, liberated, actress neighbor Jill. Don learns the kind of things from Jill that his mother would never have taught him! And Jill learns from Don what growing up and being free is really all about."
13005,2001,Sacrificio: Who Betrayed Che Guevara?,60,7.3,Erik Gandini-Tarik Saleh,,Atmo Media Network-Sveriges Television,Documentary,"The two young Swedish journalist's Erik Gandini and Tarik Saleh have worked one year with Sacrificio, a film about the events surrounding the death of Che Guevara. They have traveled the world around and met among others the man who shot Che Guevara and the former CIA agent who walks around with Che's last tobacco in his pistol butt. In their attempts to find out what really happened they discover that the man who is accused of having betrayed Che Guevara as a matter of fact lives in Malmö, in the south of Sweden."
13006,1979,Soap: Season 3,,,,,,,
13007,1975,Dog Day Afternoon,125,8.0,Sidney Lumet,Frank Pierson-P.F. Kluge-Thomas Moore,Warner Bros.-Artists Entertainment Complex,Biography-Crime-Drama-Thriller,"Based upon a real-life story that happened in the early seventies in which the Chase Manhattan Bank in Gravesend, Brooklyn, was held siege by a bank robber determined to steal enough money for his male lover to undergo a sex change operation. On a hot summer afternoon, the First Savings Bank of Brooklyn is held up by Sonny and Sal, two down-and-out characters. Although the bank manager and female tellers agree not to interfere with the robbery, Sonny finds that there's actually nothing much to steal, as most of the cash has been picked up for the day. Sonny then gets an unexpected phone call from Police Captain Moretti, who tells him the place is surrounded by the city's entire police force. Having few options under the circumstances, Sonny nervously bargains with Moretti, demanding safe escort to the airport and a plane out of the country in return for the bank employees' safety."
13008,1997,Mrs. Dalloway,97,6.8,Marleen Gorris,Eileen Atkins-Virginia Woolf,First Look International-Bayly/Paré Productions-Bergen Film & TV-Newmarket Capital Group-BBC Films-European Co-production Fund-Nederlandse Programma Stichting-Dutch Co-Production Fund-Nederlands Fonds voor de Film,Drama-Romance,"London, summer 1923. Clarissa, MP Richard Dalloway's wife, sets out on a beautiful morning; she's shopping for flowers for her party that evening. At the same time Septimus Warren Smith, a young man who survived the battlefields of Europe, is suffering from a nightmarish delayed-onset form of shell-shock. Clarissa's nearly-grown daughter is distant, and preoccupied. In the course of one day, Peter, Clarissa's passionate old suitor, returns from India and is invited to her party; Septimus commits suicide; Clarissa relives a day in her youth (and her reasons for her choice of a life with the reliable Richard Dalloway)."
13009,2004,Yoga: Step by Step,54,,,,,,Yoga for the Rest of Us will ease you into the world of yoga--whatever your age and ability--and can become your personal at-home yoga trainer. Use it in the morning or at night and discover how easily yoga can be incorporated into your daily routine and how quickly you'll see the benefits for your body and spirit.
13010,1996,Angels and Insects,,,Don DuPree,,Buena Vista Television,Talk-Show,"Gene Siskel and Roger Ebert review five new movies and recommend a video. Two thumbs down for the bleak futuristic thriller, Screamers (1995). Both critics have seen it all many times before. Two thumbs up for Ian McKellen's modernized Richard III (1995). They especially praise McKellen in the title role. A split vote on Bed of Roses (1996) with Christian Slater and Mary Stuart Masterson. Siskel's mixed but positive review praises the well-played and well-written lead female character; Ebert disliked both lead characters. Two thumbs up for the racial drama, Once Upon a Time... When We Were Colored (1995). Both critics enjoyed the richly emotional experience. Two thumbs up for the peculiar Angels and Insects (1995). They reserve particular praise for the costume design."
13011,2000,Kaho Naa Pyaar Hai,172,6.9,Rakesh Roshan,Rakesh Roshan-Sagar Sarhadi-Honey Irani,Film Kraft,Action-Romance,"A poor singer, Rohit, and the daughter of a very rich man, Sonia, fall in love. While on a cruise ship, they get separated from the rest of their party and end up on a deserted island. They live happily here for a few days until they are rescued. Sonia's friends help Rohit to make a name for himself so that they can get married. But before he reaches this goal, he meets an untimely death. Sonia's father sends her to live with her cousins in New Zealand to get over her heartbreak. In New Zealand she meets Raj Chopra who looks exactly like Rohit."
13012,2003,Genius,,,,,,,
13013,1982,Simon and Garfunkel: Concert in Central Park,,,,,,,
13014,1992,Forever Knight: The Trilogy: Part 1,,,,,,,
13015,1987,The Lost Boys: Special Edition,,,,,,,
13016,2004,Agatha Christie's Poirot: The Hollow,,,,,,,
13017,2002,Dragon Ball: Commander Red Saga,,,,,,,
13018,1968,Spirits of the Dead,121,6.6,Federico Fellini-Louis Malle-Roger Vadim,Edgar Allan Poe-Roger Vadim-Pascal Cousin,Les Films Marceau-Produzioni Europee Associate-Cocinor,Drama-Horror-Mystery,"Three directors each adapt a Poe short story to the screen: ""Toby Dammit"" features a disheveled, drugged and drunk English movie star who nods acceptance in the Italian press and his producers fawn over him. ""Metzengerstein"" features a medieval countess who has a love-hate relationship with a black stallion - who, it turns out, is really her dead lover. ""William Wilson"" tells the story of a sadistic Austrian student with an exact double whom he later kills."
13019,2004,1421: The Year China Discovered America?,113,6.5,David Wallace,William Cran-David Wallace,Paladin InVision-Penguin Television,Documentary,
13020,1977,Jabberwocky,105,6.2,Terry Gilliam,Lewis Carroll-Charles Alverson-Terry Gilliam,Python Films-Umbrella Entertainment Productions,Adventure-Comedy-Fantasy,After the death of his father the young cooper 'Dennis Cooper' goes to town where he has to pass several adventures. The town and the whole kingdom is threatened by a terrible monster called 'Jabberwocky'. Will Dennis make his fortune? Is anyone brave enough to defeat the monster? A medieval tale with Pythonesque humour.
13021,1999,Travel the World by Train: North America,60,6.5,Graham Loveridge,,,Documentary,
13022,1972,Lucio Fulci: Don't Torture a Duckling,,,,,,,
13023,1990,Rosencrantz and Guildenstern Are Dead,117,7.5,Tom Stoppard,Tom Stoppard,Brandenberg-WNET Channel 13 New York,Comedy-Drama,"Showing events from the point of view of two minor characters from Hamlet, men who have no control over their destiny, this film examines fate and asks if we can ever really know what's going on? Are answers as important as the questions? Will Rosencrantz and Guildenstern (or Guildenstern and Rosencrantz) manage to discover the source of Hamlet's malaise as requested by the new king? Will the mysterious players who are strolling around the castle reveal the secrets they evidently know? And whose serve is it?"
13024,1973,Scream,,,,,,,
13025,2004,Cavedweller,101,5.7,Lisa Cholodenko,Dorothy Allison-Anne Meredith,Cavedweller Productions Ltd.-Dufferin Gate Productions-Orly Adelson Productions-Showtime Networks,Drama-Music,"After rock musician Randall Pritchard's fatal car accident, his wife and band mate Delia Byrd drags their unwilling daughter Cissy from his California home to her own, a Georgia backwater. There they move in with Delia's hard-handed first partner, now terminal Clint Windsor, how she left with their daughters Amanda and Dede, who are now summoned to the 'reassembled' family. Clint's ma completes the messy picture."
13026,1998,Raped By an Angel 2: Uniform Fan,89,5.1,Aman Chang,Jing Wong,Jing's Production-Young Filmmakers Ltd.,Action-Comedy-Horror-Romance,A dentist obsessed with young women in various uniforms stalks two sisters. The oldest sister is romantically pursued by a thug that was just released from prison. The dentist also has the hots for her and the two paths eventually cross.
13027,2005,WWE: The Great American Bash 2005,180,6.0,Kevin Dunn,Court Bauer-Christopher DeJoseph-Rudy Fischmann,World Wrestling Entertainment,Sport,"Batista defends the World Heavyweight Title against John Bradshaw Layfield, Rey Mysterio continues his issue with Eddie Guerrero, the Mexicools take on the Blue World Order, Road Warrior Animal and Heidenreich challenge MNM for the WWE Tag Team Titles, the Undertaker ends Muhammad Hassan, and more."
13028,1992,Doing Time on Maple Drive,92,7.1,Ken Olin,James Duff,FNM Films,Drama,"A young college student returns from Yale to introduce his fiancée to his family. While there, the relationships between the various family members are tested, and the secrets hidden behind the seemingly ""perfect family"" front are brought to light."
13029,2005,Inside Deep Throat,89,6.7,Fenton Bailey-Randy Barbato,Fenton Bailey-Randy Barbato,Imagine Entertainment-HBO Documentary Films-World of Wonder-Home Box Office-World of Wonder Productions,Documentary-Biography-History,"In 1972, a seemingly typical shoestring budget pornographic film was made in a Florida hotel, ""Deep Throat,"" starring Linda Lovelace. This film would surpass the wildest expectation of everyone involved to become one of the most successful independent films of all time. It caught the public imagination which met the spirit of the times, even as the self appointed guardians of public morality struggled to suppress it, and created, for a brief moment, a possible future where sexuality in film had a bold artistic potential. This film covers the story of the making of this controversial film, its stunning success, its hysterical opposition along with its dark side of mob influence and allegations of the on set mistreatment of the film's star. In short, the combined events would redefine the popular appeal of pornography, even as more cynical developments would lead it down other paths."
13030,1999,To Serve and Protect,169,5.9,Jean de Segonzac,Vincent Patrick,Lakeside Productions-Wolper Organization,Thriller-Crime-Drama,"The Carr Family is a well known family of cops, for three generations now. Now the current generation of cops are investigating a serial killer who murders his victims all differently so they can't trace them all back to him. Yet the murder starts sending Tom Carr, at the police station, videos with him, the serial killer, on it. If that wasn't bad enough. Tom and his wife Helen have to care for their nephew, Matt, when his mom is killed and his dad is hospitalized one night after a shooting at a near convince store. The killer starts to get personal now and attacks the Carr family, by kidnapping and threatening to kill Matt. What will the Carr family do in this time of Crisis? Will Matt be saved in enough time or be the next victim to the killer?"
13031,1989,Star Trek: The Next Generation: Season 3,,,,,,,
13032,2004,The Stone Cold Truth,,7.2,Kevin Dunn,,World Wrestling Entertainment (WWE),Action,
13033,2000,Death Row Uncut,,,,,,,
13034,1954,Knights of the Round Table,,,,,,,
13035,2004,Mind Hunters,106,6.4,Renny Harlin,Wayne Kramer-Wayne Kramer-Kevin Brodbin,Dimension Films-Intermedia Films-Outlaw Productions-Avenue Pictures-Weed Road Pictures-Mindhunters (UK) Limited-Mindhunters Productie BV-Tonna Oy-Outlaw Victoria Productions Inc.-Egmond Film & Television,Crime-Horror-Mystery-Thriller,"On a remote island, the FBI has a training program for their psychological profiling division, called ""Mindhunters"", used to track down serial killers. The training goes horribly wrong, however, when a group of seven young agents discover that one of them is a serial killer, and is setting about slaying the others. Can the few that are left figure out who the killer is in time?"
13036,2004,Lingerie Bowl 2004: The Ultimate Catfight,,,,,,,
13037,1994,Main Khiladi Tu Anari,175,6.9,Sameer Malkan,Sachin Bhowmick-Kader Khan,United Seven Combines-Venus Records & Tapes,Action-Comedy-Drama-Romance,"Karan (Ashkay Kumar), a police officer whose brother is murdered by ruthless gangster Goli (Shakti Kapoor). Despite his best efforts, the only witness, Mona (Shilpa Shetty), is also killed. But Karan's plans for revenge are interrupted when he's ordered to work with Deepak (Saif Ali Khan), a famous actor training for his next role as a cop. The mismatched pair catch a break when they discover a crude dancer who looks just like Mona (Shetty again), and together they hatch a wild plan to bring Goli to justice."
13038,1996,Sci-Fighters,94,4.4,Peter Svatek,Mark Sevi,Shostak/Rossner Productions,Sci-Fi,"Boston, 2009. A police detective (Roddy Piper) searches for Adrian Dunn, his ex-partner (Billy Drago) who murdered his wife. Dunn has escaped from prison on the moon and returned to Earth with an alien virus."
13039,1997,Paradise Road,122,6.8,Bruce Beresford,David Giles-Martin Meader-Bruce Beresford,Samson Productions Pty. Ltd.-Planet Pictures-YTC Motion Picture Investments-Village Roadshow Pictures,Drama-History-War,"The group of women from different countries and social levels are prisoners in a Japanese POW camp, where one of them, Adrienne, who is a graduate of the Royal Academy of Music, organizes a vocal band in spite of their guards resistance."
13040,1977,Day of the Animals,97,5.4,William Girdler,William W. Norton-Eleanor E. Norton-Edward L. Montoro,Film Ventures International-Mid-America Pictures-Montoro Productions Ltd.,Horror-Sci-Fi-Thriller,"The depletion of the earth's ozone layer causes animals above the altitude of 5000 feet to run amok, which is very unfortunate for a group of hikers who get dropped off up there by helicopter just before the quarantine is announced."
13041,1987,The Believers,114,6.1,John Schlesinger,Mark Frost-Nicholas Conde,Orion Pictures,Crime-Drama-Horror-Mystery-Thriller,"After the death of his wife, police psychiatrist Cal Jamison moves to New York. There he has to help in the investigation of the murder of two youths, who seem to have been immolated during a cult ritual. Jamison believes it's been Voodoo and, ignoring the warnings of his housekeeper, enters the scenery and soon gets under their influence. They try to get him to sacrifice his own son."
13042,2001,Will & Grace: Season 4,,,,,,,
13043,1986,Hard Lessons,100,6.1,Eric Laneuville,Charles Eric Johnson,Landsburg Company,Biography-Drama,"The true story of a teacher in Los Angeles who becomes the Principal of George Washington Memorial High School. The school and its students are affected by the normal life of gangs and drugs in their lives. McKenna wanted to give the students a real choice at education and all it offered for their future. But he faced teachers used to the reality of their school, parents unable or unwilling to give the kids the support they needed, and kids just wanting to survive the streets never mind learning something. After Denzel Washington (George McKenna) became a superstar, the film was re-released on home video under the title Hard Lessons."
13044,2003,Crunch: Fat-Burning Pilates,,,,,,,
13045,1998,Don't Let Me Die on a Sunday,86,5.4,Didier Le Pêcheur,Didier Le Pêcheur,Program 33,Drama,"Ben works in a morgue. Ben's wife left him and he is into various kinds of alternative sexuality. Teresa dies of an ecstasy overdose on the dance floor. When she is brought to the morgue, she is resurrected -how shall I say?- in Ben's arms (that part based on a true story). From this starting point, the film revolves around the interactions between them and Boris (orgy fan), Abdel (no sentimental life), Ducon (wants to kill himself), Nico (dying of AIDS), etc... A social study of the 90s with heavy references to sex and death."
13046,2005,Mysterious Skin,,,,,,,
13047,2002,What's New Scooby-Doo?,30,7.2,,Jordana Arkin-Joseph Barbera-Chris Brown,Warner Bros. Animation-Warner Bros. Television-Cartoon Network-Hanna-Barbera Productions-Warner Bros.,Animation-Comedy-Family-Mystery,
13048,1969,Battle of Britain,132,7.0,Guy Hamilton,James Kennaway-Wilfred Greatorex-Derek Dempster,Spitfire Productions,Action-Drama-History-War,Historical reenactment of the air war in the early days of World War Two for control of the skies over Britain as the new Luftwaffe and the Royal Air Force determine whether or not an invasion can take place.
13049,2002,The Jimmy Show,,,,,,,
13050,2002,Two Weeks Notice,101,6.1,Marc Lawrence,Marc Lawrence,Castle Rock Entertainment-Village Roadshow Pictures-NPV Entertainment-Fortis Films,Comedy-Romance,"Harvard educated lawyer Lucy Kelson, following in the footsteps of her lawyer parents, uses her career for social activism. She hides any sense of femininity behind her work. George Wade is the suave public face of the Manhattan-based Wade Corporation, a development firm that Lucy routinely opposes and whose true head is George's profit-oriented brother, Howard Wade. George, who has a reputation as a lady's man, has had as his legal counsel a series of beautiful female lawyers with questionable credentials, they who have more primarily acted as his casual sex partners. Needing a real lawyer, he offers Lucy the job of his legal counsel on a chance meeting. Despite warnings from her parents in working for the ""enemy"", Lucy, who has no intention of being the latest in his bed partners, accepts the job as she feels she can do more good from the inside, and as George, as part of the job offer, promises not to demolish a community center in a heritage building as part of a development project near her childhood Coney Island home where her parents still live. Although Lucy is able to effect the type of change she wanted from this position, she finds she cannot deal with George's expectations of her, namely being his primary confidante and advisor at all hours of the day and night, mostly about issues she considers frivolous. As such, she gives him two weeks notice, although she promises to help George find her replacement. As Lucy begins to review resumes, George himself unilaterally decides to hire June Carver, a fellow Harvardite, but who seems to have her sights set on George as both a boss and personal partner. As June begins to replace Lucy in seemingly all aspects of George's life, Lucy begins to realize that she herself has fallen for George. However, Lucy's feelings for George and her attempts to re-ingratiate herself into George's life are placed into jeopardy when she learns of a Wade Corporation decision against her basic sensibilities."
13051,2004,Ghost in the Shell: Stand Alone Complex,,8.6,Junichi Fujisaku,Shirow Masamune-Marc Handler-Dai Satô,Cavia-Epics-Production I.G.-Sony Computer Entertainment,Action-Crime-Mystery-Sci-Fi-Thriller,"Based on the cyberpunk anime of the same name. The games take place in the year 2030, between the stories told in Ghost in the Shell: Stand Alone Complex (2002) and Ghost in the Shell: S.A.C. 2nd GIG. Major Motoko Kusanagi must uncover the truth behind a mysterious case known only as T.A.R."
13052,1993,What's Eating Gilbert Grape,118,7.8,Lasse Hallström,Peter Hedges-Peter Hedges,Paramount Pictures,Drama,"What's Eating Gibert Grape is a beautifully shot movie of tenderness, caring and self-awareness that is set amongst the fictional working class one street town Endora. Centred around the Grape family Ellen and Amy and their two brothers Arnie and Gilbert, who, along with their morbidly obese widowed mother Bonnie Grape are striving to survive and coexist with the absence of a father figure, low wage work and seventeen-year-old Arnie's severe mental condition. It is in this awkward and extremely one sided affair that the unfortunate Gilbert has to constantly, while working for the town's slowly dying convenience store, take care of his younger brother Arnie. Gilbert's life, his future, is thwarted he knows this, but it is in this guardian angel that his love and bond for Arnie cannot, and will not, be let go. That is until the free spirit of Becky arrives in town, and with her grandmother are stranded for the week while waiting for parts for their vehicle. This realization unties new feelings, new thoughts and new hope for the put upon Gibert, something new is eating Gilbert Grape."
13053,1965,The Beast that Killed Women/ The Monster of Camp Sunshine,,,,,,,
13054,2004,Pingu: Chillin' with Pingu,,,,,,,
13055,1981,Rocky (Hindi),,,,,,,
13056,1999,Bicentennial Man,132,6.9,Chris Columbus,Isaac Asimov-Isaac Asimov-Robert Silverberg,1492 Pictures-Columbia Pictures-Laurence Mark Productions-Radiant Productions-Touchstone Pictures,Comedy-Drama-Sci-Fi,"This film follows the 'life' and times of the lead character, an android who is purchased as a household robot programmed to perform menial tasks. Within a few days the Martin family realizes that they don't have an ordinary droid as Andrew begins to experience emotions and creative thought. In a story that spans two centuries, Andrew learns the intricacies of humanity while trying to stop those who created him from destroying him."
13057,1942,Val Lewton: Cat People / The Curse of the Cat People,,,,,,,
13058,1991,Backdraft,137,6.7,Ron Howard,Gregory Widen,Imagine Films Entertainment-Trilogy Entertainment Group,Action-Crime-Drama-Mystery-Thriller,A rookie firefighter tries to earn the respect of his older brother and other firefighters while taking part in an investigation of a string of arson/murders. This detailed look into the duties and private lives of firemen naturally features widespread pyrotechnics and special effects.
13059,1983,The Man Who Loved Women,110,5.2,Blake Edwards,Blake Edwards-Milton Wexler-Geoffrey Edwards,Delphi Films-Columbia Pictures,Comedy-Drama-Romance,"Marianna, a Los Angeles based therapist, tells the story of one of her patients, middle aged David Fowler, a successful sculptor. He originally came to see her due to his sudden impotence in all aspects of his life, including in his art and in his sex life, the latter especially worrisome as he has always adored women in the holistic sense, they in general who adore him right back. David's sessions with Marianna have most often been comprised of he talking about the women in his life, both past and present, those in his early life who included his single mother who had her fair share of suitors and lovers, and a plethora of prostitutes, one to who he lost his virginity and the profession which he has always treated with respect beyond the issues of many women resorting to the business as a last resort to survive. He has moved from one girlfriend/lover to another in his fear that he would miss something special in the women he has not yet met. Those women include but are not limited to: Courtney, local on-air television personality who pampers him with her cooking; Agnes, who may have the best looking legs in the world according to David, but who tells David in return that the legs he saw to which he was initially attracted were not hers; Louise, the wife of a Houston-based client, wealthy Roy Carr, David's sexual encounters with Louise which are characterized by their riskiness and her canny ability to calculate the time required; and David's assistant Nancy, the one woman to who he was attracted but had never slept with due to the vulnerable state she was in when they met. Beyond trying to figure out what has caused David's current issue, Marianna has to admit to herself that she too is not immune to his charms. All of these women realize that they are most-likely temporary fixtures in his life, but love him nonetheless. However, one woman may make him feel true love, enough to want to settle down with her."
13060,2004,Rockets Redglare,,,,,,,
13061,1973,Lady Snowblood,97,7.7,Toshiya Fujita,Kazuo Kamimura-Kazuo Koike-Norio Osada,Toho Film (Eiga) Co. Ltd.,Action-Drama-Thriller,"Yuki's family is nearly wiped out before she is born due to the machinations of a band of criminals. These criminals kidnap and brutalize her mother but leave her alive. Later her mother ends up in prison with only revenge to keep her alive. She creates an instrument for this revenge by purposefully getting pregnant. Though she dies in childbirth, she makes sure that the child will be raised as an assassin to kill the criminals who destroyed her family. Young Yuki never knows the love of a family but only killing and revenge."
